Location,Period,Kitchen,Dish_Name,Description,Portion_Size,Ingredients,Calories,Protein (g),Total Carbohydrates (g),Sugar (g),Total Fat (g),Saturated Fat (g),Cholesterol (mg),Dietary Fiber (g),Sodium (mg),Potassium (mg),Calcium (mg),Iron (mg),Trans Fat (g),Vitamin D (IU),Vitamin C (mg),Calories From Fat,Vitamin A (RE),Saturated Fat + Trans Fat (g),Allergens
Stetson_East,Dinner,HOMESTYLE,Vegetarian Collard Greens,"Fresh Collard Greens, Onion, and Garlic",1/2 cup,"Collard Greens, Water, Apple Cider Vinegar, Yellow Onions, Yellow Onions, Light Brown Sugar^, Celery, Tomatoes, Canola Oil, Carrots, Kosher Salt^, Garlic, Garlic, Parsley, Thyme, Black Pepper, Bay Leaf",70,3,12,6,2.5,0,0,4,330,250,230,0.6,0.0,0,35,20,0,0,"Vegetarian, Avoiding Gluten, Onion, Garlic, Tomato, Vegan, How Good Friendly, Celery"
Stetson_East,Dinner,HOMESTYLE,Roasted Carrots ,Roasted Carrots Seasoned with Salt,1/2 cup,"Carrots, Canola Oil, Kosher Salt^",80,1,12,6,3.5,0,0,3,180,400,40,0.4,0,0,7,30,0.0,0,"Vegetarian, Avoiding Gluten, Vegan, How Good Friendly"
Stetson_East,Dinner,GLOBAL EATS,Vegan Cheese Baked Chickpea Rotini,Chickpea pasta baked in a marinara sauce and topped with vegan cheese,8 ounce,"Water, Gluten Free  Rotini^, Vegan Mozzarella^, Tomatoes^, Tomato Puree^, Kosher Salt^, Yellow Onions, Olive Oil, Parsley, Sea Salt, Garlic, Basil, Oregano, Red Pepper",340,14,49,4,12,5,0,10,1910,820,180,3.8,0.0,0,3,110,0,5,"Vegetarian, Avoiding Gluten, Good Source of Protein, Onion, Garlic, Tomato, Vegan"
Stetson_East,Dinner,GLOBAL EATS,Beyond Sweet Italian Sausage,,1/2 each,Vegan Sweet Italian Sausage^,130,8,3,0,9,4,0,2,270,120,20,2,0,0,0,80,5,5,"Vegetarian, Avoiding Gluten, Good Source of Protein, Vegan"
Stetson_East,Dinner,GLOBAL EATS,Roasted Broccoli,Broccoli seasoned with sea salt and pepper,1/2 cup,"Broccoli, Canola Oil, Sea Salt, Black Pepper",40,2,5,1,2,0,0,2,140,240,40,0.6,0,0,67,20,0.0,0,"Vegetarian, Avoiding Gluten, Vegan, How Good Friendly"
Stetson_East,Dinner,MENUTAINMENT,Eggs Your Way,,1 each,Egg,60,6,0,0,4,1.5,165,0,60,60,20,0.8,0,35,0,40,0.0,0,"Egg, Vegetarian, Avoiding Gluten"
Stetson_East,Dinner,MENUTAINMENT,Eggs,,1/4 cup,Liquid Egg^,90,7,0.0,0,6,2,225,0,80,80,40,1.1,0,60,0,50,0.0,0,"Egg, Vegetarian, Avoiding Gluten, Good Source of Protein"
Stetson_East,Dinner,MENUTAINMENT,Egg Whites,two egg whites made-to-order,1/4 cup,Liquid Egg White^,30,7,0,0,0,0,0,0,100,100,0,0,0.0,0,0,0,0.0,0,"Egg, Vegetarian, Avoiding Gluten, Good Source of Protein"
Stetson_East,Dinner,MENUTAINMENT,Diced Bacon,,1 ounce,Bacon^,130,10,0,0,10,3.5,30,0,480,140,0,0.3,0,5,0,90,0.0,5,"Good Source of Protein, Pork, Gluten*"
Stetson_East,Dinner,MENUTAINMENT,Italian Sausage Crumbles,,1 ounce,Italian Sausage^,90,5,0.0,0,7,2.5,25,0,230,100,0,0.4,0,10,0,70,0.0,5,"Avoiding Gluten, Celery*, Mustard*, Soy, Pork"
Stetson_East,Dinner,MENUTAINMENT,Diced Ham,,1 ounce,Ham^,35,4,2,0.0,1,0,15,0,360,200,0,0.2,0,170,0,10,0,0,"Pork, Gluten*"
Stetson_East,Dinner,MENUTAINMENT,Shredded Sharp American Cheese,,1 ounce,American Cheese^,100,5,1,0.0,9,5,30,0,470,40,300,0.2,0,90,0,80,0.0,5,"Avoiding Gluten, Milk, Beef*, Pork*"
Stetson_East,Dinner,MENUTAINMENT,Baby Spinach,,1/4 ounce,Spinach,0,0,0,0,0,0,0,0,5,40,10,0.2,0,0,2,0,0.0,0,"Vegetarian, Avoiding Gluten, Vegan, How Good Friendly"
Stetson_East,Dinner,MENUTAINMENT,Sliced Mushrooms,,1 ounce,Mushrooms,5,0.0,0.0,0.0,0,0,0,0,0,90,0,0.1,0,0,1,0,0.0,0,"Vegetarian, Avoiding Gluten, Vegan, How Good Friendly, Mushroom"
Stetson_East,Dinner,MENUTAINMENT,Diced Tomatoes,,1 ounce,Tomatoes,5,0,1,0.0,0,0,0,0,0,70,0,0.1,0,0,4,0,0.0,0,"Vegetarian, Avoiding Gluten, Tomato, Vegan"
Stetson_East,Dinner,MENUTAINMENT,Chopped Green Bell Pepper,,1 ounce,Green Bell Peppers,5,0,1,0.0,0,0,0,0,0,50,0,0.1,0,0,23,0,0.0,0,"Vegetarian, Avoiding Gluten, Vegan"
Stetson_East,Dinner,MENUTAINMENT, Diced Onions,,1 ounce,Yellow Onions,10,0,3,1,0,0,0,0,0,40,10,0.1,0,0,2,0,0.0,0,"Vegetarian, Avoiding Gluten, Onion, Vegan"
Stetson_East,Dinner,FLAME,Hamburger Patty,Ground sirloin patty grilled to perfection ,1 each,Beef Patty,170,16,0,0,11,4,55,0,45,190,10,1.5,0,0,0,100,0.0,5,"Avoiding Gluten, Good Source of Protein, Beef"
Stetson_East,Dinner,FLAME,Grilled Chicken,Tender and moist,1 each,Chicken Breast^,120,23,0,0,3,1,80,0,140,260,0,0.4,0,0,0,25,0.0,0,"Avoiding Gluten, Good Source of Protein, Poultry"
Stetson_East,Dinner,FLAME,All Beef Hot Dog,,1 each,Beef Hot Dog^,180,7,2,0.0,17,7,35,0,480,140,10,0.7,0.0,20,0.0,150,0.0,5,"Good Source of Protein, Beef"
Stetson_East,Dinner,FLAME,Onions and Peppers,sauteed onions and sweet bell peppers,1/2 cup,"Green Bell Peppers, Yellow Onions, Butter, Black Pepper",130,1,7,3,11,7,30,2,0,160,20,0.3,0.0,0,40,100,0.0,5,"Vegetarian, Avoiding Gluten, Milk, Onion"
Stetson_East,Dinner,FLAME,French Fries,,3 ounce,French Fries^,150,1,18,0.0,9,1,0,1,20,270,10,0.3,0,0,0,80,0.0,0,
Stetson_East,Dinner,FLAME,White Hot Dog Bun,,1 each,Hot Dog Bun^,100,3,19,2,1,0,0,0.0,160,30,30,1.3,0,0,0.0,10,0.0,0,"Vegetarian, Gluten, Wheat, Vegan, Soy*"
Stetson_East,Dinner,FLAME,White Hamburger Bun,White Hamburger Bun,1 each,Burger Bun^,150,4,28,4,2,0,0,0,280,50,50,1.5,0,0,0.0,20,0.0,0,"Vegetarian, Gluten, Soy, Wheat, Tree Nuts*, Egg*, Sesame, Milk*"
Stetson_East,Dinner,FLAME,American Cheese Slice,,1 slice,American Cheese^,50,3,0.0,0,4.5,2.5,15,0,240,20,150,0.1,0,45,0,40,0.0,5,"Avoiding Gluten, Milk, Beef*, Pork*"
Stetson_East,Dinner,DELI,Sliced Genoa Salami,,1 ounce,Genoa Salami^,120,5,0,0,11,4,30,0,480,0.0,0,0.4,0,0.0,7,100,0.0,5,"Avoiding Gluten, Celery*, Mustard*, Garlic, Beef, Pork"
Stetson_East,Dinner,DELI,Sliced Capicola,,1 ounce,Capicola^,35,5,2,0.0,1,0,15,0,440,80,0,0.3,0,0.0,0.0,10,0.0,0,"Pork, Soy*, Gluten*, Wheat*"
Stetson_East,Dinner,DELI,Sliced Smoked Ham,,1 ounce,Ham^,35,5,0,0,1.5,0.5,15,0,330,90,0,0.2,0,10,0,15,0.0,0,"Pork, Gluten*, Wheat*"
Stetson_East,Dinner,DELI,Thinly Sliced Deli Turkey Breast,,1 ounce,Turkey Breast^,30,4,0.0,0,1,0,15,0,260,40,0,0.2,0,0,0,10,0,0,"Avoiding Gluten, Poultry"
Stetson_East,Dinner,DELI,FIT Tuna Salad,Classic tuna salad ,3 oz portion,"Tuna^, Canola Oil, Red Onions, Celery, Lemon Juice, Light Mayonnaise^, Kosher Salt^, Black Pepper",90,8,0.0,0,6,0.5,15,0,240,90,10,0.7,0,20,1,50,0,0,"Egg, Good Source of Protein, MSG*, Onion, Celery, Soy*, Gluten*, Mustard, Fish"
Stetson_East,Dinner,DELI,Chicken Salad,"Moist chicken salad, in a low fat dressing",1/3 cup,"Chicken Breast^, Mayonnaise^, Celery, White Pepper",110,8,0,0,9,1.5,30,0,150,130,0,0.2,0,0,0,80,5,0,"Egg, Good Source of Protein, Onion, Celery, Poultry, Gluten*, Mustard"
Stetson_East,Dinner,DELI,American Cheese Slice,,1 slice,American Cheese^,50,3,0.0,0,4.5,2.5,15,0,240,20,150,0.1,0,45,0,40,0.0,5,"Avoiding Gluten, Milk, Beef*, Pork*"
Stetson_East,Dinner,DELI,Sliced Swiss Cheese,,1 ounce,Swiss Cheese^,110,8,0,0,9,5,25,0,55,20,250,0,0,0,0,80,0.0,5,"Vegetarian, Avoiding Gluten, Good Source of Protein, Milk"
Stetson_East,Dinner,DELI,Sliced Sharp Cheddar Cheese,,1 ounce,Cheddar Cheese^,110,6,0.0,0,9,5,30,0,190,20,200,0,0.0,5,0,80,0.0,5,"Vegetarian, Avoiding Gluten, Milk"
Stetson_East,Dinner,DELI,Sliced Provolone Cheese,,1 ounce,Provolone Cheese^,100,7,0.0,0,8,5,20,0,210,40,210,0.1,0.0,5,0,70,0.0,5,"Vegetarian, Avoiding Gluten, Good Source of Protein, Milk"
Stetson_East,Dinner,DELI,Sliced Pepper Jack Cheese,,1 ounce,Pepper Jack Cheese^,110,7,0,0,9,5,25,0,170,20,210,0.2,0.0,5,0,80,0.0,5,"Vegetarian, Avoiding Gluten, Good Source of Protein, Milk"
Stetson_East,Dinner,DELI,Chopped Romaine Lettuce,,1 cup,Chopped Lettuce,10,0.0,2,0.0,0,0,0,0.0,0,120,20,0.5,0,0,2,0,0.0,0,"Vegetarian, Avoiding Gluten, Vegan"
Stetson_East,Dinner,DELI,Baby Spinach,,2 cup,Spinach,15,2,2,0,0,0,0,1,45,330,60,1.6,0,0,17,0,0.0,0,"Vegetarian, Avoiding Gluten, Vegan, How Good Friendly"
Stetson_East,Dinner,DELI,Sliced Tomatoes,,1 slice,Tomatoes,0,0,0.0,0,0,0,0,0,0,30,0,0,0,0,2,0,0.0,0,"Vegetarian, Avoiding Gluten, Tomato, Vegan"
Stetson_East,Dinner,DELI,Sliced Red Onion,,1 slice,Red Onions,5,0,1,0.0,0,0,0,0,0,20,0,0,0,0,1,0,0.0,0,"Vegetarian, Avoiding Gluten, Onion, Vegan"
Stetson_East,Dinner,DELI,Bread & Butter Pickles,,4 each,Pickles^,25,0,6,6,0,0,0,0,160,0,0,0,0,0,0.0,0,0.0,0,"Mustard*, Beef*, Pork*"
Stetson_East,Dinner,DELI,Banana Pepper Rings,,1 tbsp,Banana Peppers^,0,0,0,0,0,0,0,0,30,0.0,0,0,0,0.0,0,0,0,0,"Vegetarian, Avoiding Gluten, Sulphites, Vegan"
Stetson_East,Dinner,DELI,Sliced Cucumber,,1/4 cup,Cucumber,0,0,0,0,0,0,0,0,0,30,0,0,0,0,1,0,0.0,0,"Vegetarian, Avoiding Gluten, Vegan"
Stetson_East,Dinner,DELI,Sliced Red Bell Pepper,,1/4 cup,Red Bell Peppers,5,0,1,0.0,0,0,0,0,0,50,0,0.1,0,0,29,0,0.0,0,"Vegetarian, Avoiding Gluten, Vegan"
Stetson_East,Dinner,DELI,Mayonnaise,,1 tbsp,Mayonnaise^,90,0,0,0,10,1.5,5,0,75,0,0,0,0,0,0,90,0,0,"Egg, Vegetarian, Onion, Gluten*, Mustard"
Stetson_East,Dinner,DELI,Pesto Mayonnaise,Pesto Mayonnaise,1 tbsp,"Mayonnaise^, No Nut Pesto^, Kosher Salt^, Black Pepper",90,0,0,0,9,1.5,5,0,90,10,10,0.1,0,0,0,80,10,0,"Egg, Vegetarian, Milk, Onion, Garlic, Gluten*, Mustard"
Stetson_East,Dinner,DELI,Chipotle Garlic Ranch,"Ranch dressing, roasted garlic and chipotle peppers",2 tbsp,"Ranch Dressing^, Garlic, Chipotle Peppers^, Canola Oil, Black Pepper",130,0,1,1,14,2,10,0,180,0,0,0,0,0,0,130,0.0,0,"Egg, Vegetarian, Avoiding Gluten, Celery*, Milk, Mustard*, Onion, Garlic, Tomato"
Stetson_East,Dinner,DELI,Dijon Honey Dressing,,2 tbsp,Honey Mustard Dressing^,130,0,7,6,12,2,15,0,160,10,0,0,0,0,0.0,100,0,0,"Egg, Vegetarian, Avoiding Gluten, Celery*, Mustard"
Stetson_East,Dinner,DELI,Yellow Mustard,,1 tbsp,Yellow Mustard^,10,0.0,0.0,0,0.5,0,0,0.0,170,20,10,0.3,0,0,0,0,0.0,0,"Vegetarian, Avoiding Gluten, Garlic, Vegan, Mustard"
Stetson_East,Dinner,DELI,Olive Oil,,1 floz,Olive Oil,240,0,0,0,27,3.5,0,0,0,0,0,0.2,0.0,0,0,240,0.0,5,"Vegetarian, Avoiding Gluten, Vegan"
Stetson_East,Dinner,DELI,Red Wine Vinegar,,1 floz,Red Wine Vinegar^,5,0,0,0,0,0,0.0,0,0,10,0,0.1,0,0.0,0,0,0.0,0,"Vegetarian, Avoiding Gluten, Sulphites, Vegan"
Stetson_East,Dinner,DELI,White Bread,,1 slice,White Bread^,80,3,15,1,1,0,0,0.0,130,30,30,1,0,0,0.0,5,0.0,0,"Vegetarian, Gluten, Soy, Wheat, Egg*, Sesame*, Milk*"
Stetson_East,Dinner,DELI,Whole Wheat Bread,,1 slice,Whole Wheat Bread^,110,4,21,3,2,0,0,3,170,100,40,0.9,0,0,0.0,20,0.0,0,"Vegetarian, Gluten, Soy, Wheat, Tree Nuts*, Milk*"
Stetson_East,Dinner,DELI,Kaiser Roll,,1 each,Kaiser Roll^,240,7,43,3,4.5,0,0,1,410,90,70,2,0,0,0.0,40,0.0,0,"Egg, Vegetarian, Good Source of Protein, Gluten, Wheat"
Stetson_East,Dinner,DELI,Hoagie Roll,,1 each,Hoagie Roll^,200,6,36,0,3,0.5,0,2,410,80,60,1.9,0.0,0,0,25,0.0,0,"Vegetarian, Gluten, Soy, Wheat, Vegan"
Stetson_East,Dinner,DELI,"10"" Flour Tortilla",,1 each,Flour Tortilla^,200,6,34,1,6,3,0,1,400,50,80,2,0,0,0.0,50,0.0,5,"Vegetarian, Gluten, Wheat, Sulphites, Vegan"
Stetson_East,Dinner,DELI,"12"" Spinach Herb Tortilla",,1 each,Spinach Herb Tortilla^,290,8,47,0,8,4,0,2,640,80,120,3,0,0,0.0,70,0.0,5,"Vegetarian, Good Source of Protein, Gluten, Onion, Wheat, Garlic, Sulphites, Vegan"
Stetson_East,Dinner,DELI,"12"" Tomato Basil Flour Tortilla",,1 each,Tomato Basil Tortilla^,300,9,47,0,9,4,0,2,620,80,120,3,0,0,0.0,80,0.0,5,"Vegetarian, Good Source of Protein, Gluten, Onion, Wheat, Garlic, Sulphites, Tomato, Vegan"
Stetson_East,Dinner,DELI,Homemade Potato Chips,Fresh Fried Potato Chips,4 ounce,Potato Chips^,370,2,21,0.0,30,3.5,0,2,260,360,10,0.7,0,0,0,270,0.0,5,Soy
Stetson_East,Dinner,DELI SPECIAL,Pepperoni Pizza Grilled Cheese,,1 sandwich,"Texas Bread^, Pork Pepperoni^, No Nut Pesto^, Provolone Cheese^, Tomatoes^, Tomato Puree^, Margarine^, Mayonnaise^, Yellow Onions, Olive Oil, Sea Salt, Garlic, Chipotle Chili Pepper^, Cumin, Smoked Paprika^, Garlic, Kosher Salt^, Basil, Oregano, Coriander, Granulated Onion, Oregano, Red Pepper",860,30,50,1,55,18,85,3,2020,380,320,1.4,0.0,5,4,490,120,20,"Egg, Good Source of Protein, Gluten, Milk, Onion, Wheat, Garlic, Tomato, Beef, Pork, Sesame*, Mustard"
Stetson_East,Dinner,SOUP,Tomato Basil Bisque,"smooth tomato puree seasoned and simmered with savory vegetables in a creamy vegetarian broth highlighted with basil, fennel and sweet cream",8 floz,Tomato Basil Vegetarian Soup^,160,4,20,11,7,4.5,25,0.0,250,840,80,1.1,0,10,4,60,350,5,"Vegetarian, Gluten, Milk, Onion, Wheat, Tomato, Celery"
Stetson_East,Dinner,SOUP,Lemon Orzo Chicken Soup,"orzo, pulled chicken, carrots and celery in a chicken broth with a touch of cream",8 floz,Chicken Orzo Soup^,160,7,14,2,8,4,30,1,780,170,30,0.6,0,10,3,70,140,5,"Egg, Good Source of Protein, Gluten, Milk, MSG*, Onion, Soy, Wheat, Garlic, Celery, Poultry"
Stetson_East,Dinner,SOUP,"Crackers, Oyster, Zesta, Keebler, 0.5 oz",Keebler Zesta Oyster Crackers,1 each,"Enriched flour (wheat flour, niacin, reduced iron, vitamin B1 [thiamin mononitrate], vitamin B2 [riboflavin], folic acid), soybean oil (with TBHQ for freshness), leavening (baking soda, sodium acid pyrophosphate, monocalcium phosphate). Contains 2% or less of sugar, salt, malt extract, soy lecithin. Contains: Wheat, Soy. ",60,1,9,0,2.5,0,0,0,140,10,0,0.5,0,0,0.0,20,0.0,0,"Vegetarian, Gluten, Soy, Wheat"
Stetson_East,Dinner,FRESH 52 A,Romaine Blend,,1 cup,Lettuce Blend,10,0.0,1,0.0,0,0,0,0.0,0,110,10,0.4,0,0,2,0,0.0,0,"Vegetarian, Avoiding Gluten, Vegan"
Stetson_East,Dinner,FRESH 52 A,Spring Mix,,1 cup,Spring Lettuce Salad Mix,5,0.0,1,0.0,0,0,0,0.0,0,130,20,0.7,0,0,2,0,0.0,0,"Vegetarian, Avoiding Gluten, Vegan"
Stetson_East,Dinner,FRESH 52 A,Baby Spinach,,1 cup,Spinach,5,0.0,1,0,0,0,0,0.0,25,170,30,0.8,0,0,8,0,0.0,0,"Vegetarian, Avoiding Gluten, Vegan, How Good Friendly"
Stetson_East,Dinner,FRESH 52 A,Cherry Tomatoes,,1 ounce,Tomatoes,5,0,1,0.0,0,0,0,0,0,70,0,0.1,0,0,4,0,0.0,0,"Vegetarian, Avoiding Gluten, Tomato, Vegan"
Stetson_East,Dinner,FRESH 52 A,Sliced Cucumber,,1 ounce,Cucumber,0,0,1,0,0,0,0,0,0,40,0,0.1,0,0,1,0,0.0,0,"Vegetarian, Avoiding Gluten, Vegan, How Good Friendly"
Stetson_East,Dinner,FRESH 52 A,Shredded Carrots,,1 ounce,Carrots,10,0,3,1,0,0,0,0.0,20,90,10,0.1,0,0,2,0,0.0,0,"Vegetarian, Avoiding Gluten, Vegan, How Good Friendly"
Stetson_East,Dinner,FRESH 52 A,Julienne Celery,,1 ounce,Celery,0,0,0.0,0,0,0,0,0,25,70,10,0.1,0,0,1,0,0.0,0,"Vegetarian, Avoiding Gluten, Vegan, Celery"
Stetson_East,Dinner,FRESH 52 A,Sliced Red Onion,,1 ounce,Red Onions,10,0,3,1,0,0,0,0,0,40,10,0.1,0,0,2,0,0.0,0,"Vegetarian, Avoiding Gluten, Onion, Vegan"
Stetson_East,Dinner,FRESH 52 A,Red and Green Bell Peppers,,1 ounce,"Green Bell Peppers, Red Bell Peppers",5,0,2,0.0,0,0,0,0.0,0,50,0,0.1,0,0,29,0,0.0,0,"Vegetarian, Avoiding Gluten, Vegan"
Stetson_East,Dinner,FRESH 52 A,Sliced Mushrooms,,1 cup,Mushrooms,15,2,2,1,0,0,0,0.0,0,220,0,0.3,0,5,1,0,0.0,0,"Vegetarian, Avoiding Gluten, Vegan, How Good Friendly, Mushroom"
Stetson_East,Dinner,FRESH 52 A,Sliced Black Olives,,1 ounce,Black Olives^,35,0,2,0,3,0.5,0,0,210,0,20,1.8,0,0,0,30,0.0,0,"Vegetarian, Avoiding Gluten, Vegan"
Stetson_East,Dinner,FRESH 52 A,Blanched Broccoli,,1 ounce,"Water, Water, Broccoli, Kosher Salt^",10,0.0,2,0,0,0,0,0.0,15,90,10,0.2,0,0,25,0,0,0,"Vegetarian, Avoiding Gluten, Vegan, How Good Friendly"
Stetson_East,Dinner,FRESH 52 A,Curry Roasted Cauliflower,"curry, lemon, cauliflower",1 ounce,"Cauliflower, Canola Oil, Lemon Juice, Curry Powder^, Kosher Salt^, Black Pepper",25,0.0,1,0.0,2.5,0,0,0.0,55,80,10,0.2,0,0,13,20,0,0,"Vegetarian, Vegan, Mustard"
Stetson_East,Dinner,FRESH 52 A,Roasted Corn,roasted corn,1 ounce,"Corn, Canola Oil",45,0.0,5,0.0,2.5,0,0,0.0,0,60,0,0.1,0,0,1,25,0.0,0,"Vegetarian, Avoiding Gluten, Vegan"
Stetson_East,Dinner,FRESH 52 A,Black Bean and Corn Salad,Spicy Classical Black Bean Salad ,1 ounce,"Low Sodium Black Turtle Beans^, Corn, Red Onions, Lime, Jalapeno, Olive Oil, Cilantro, Garlic, Cumin",25,1,5,0,0.5,0,0,1,20,80,10,0.4,0.0,0,2,5,0.0,0,"Vegetarian, Avoiding Gluten, Onion, Garlic, Vegan"
Stetson_East,Dinner,FRESH 52 A,Edamame,,1 ounce,Edamame,35,3,3,0.0,1.5,0,0,1,0,120,20,0.6,0,0,2,15,0.0,0,"Vegetarian, Avoiding Gluten, Soy, Vegan, How Good Friendly"
Stetson_East,Dinner,FRESH 52 A,Green Peas,,1 ounce,Green Peas,20,1,4,1,0,0,0,1,20,30,10,0.4,0,0,3,0,0.0,0,"Vegetarian, Avoiding Gluten, Vegan"
Stetson_East,Dinner,FRESH 52 A,Cooked Quinoa,,1 ounce,"Water, Quinoa",50,2,8,0,1,0,0,0.0,0,70,10,0.6,0.0,0,0,5,0,0,"Vegetarian, Avoiding Gluten, Vegan"
Stetson_East,Dinner,FRESH 52 A,Sliced Pepperoncini Peppers,,1 ounce,Pepperoncini^,5,0,1,0.0,0,0,0,0,330,50,0,0.1,0,0,19,0,0.0,0,"Vegetarian, Avoiding Gluten, Sulphites, Vegan"
Stetson_East,Dinner,FRESH 52 A,Grilled Chicken,"Boneless breast of chicken, grilled to perfection",1 ounce,"Chicken Breast^, Canola Oil, Kosher Salt^, Black Pepper",50,7,0,0,2,0,25,0,280,80,0,0.1,0,0,0,20,0.0,0,"Avoiding Gluten, Good Source of Protein, Poultry"
Stetson_East,Dinner,FRESH 52 A,Diced Bacon,,1 ounce,Bacon^,130,10,0,0,10,3.5,30,0,480,140,0,0.3,0,5,0,90,0.0,5,"Good Source of Protein, Pork, Gluten*"
Stetson_East,Dinner,FRESH 52 A,Shredded Cheddar Cheese,,1 ounce,Cheddar Cheese^,110,6,0.0,0,9,5,30,0,190,20,200,0,0.0,5,0,80,0.0,5,"Vegetarian, Avoiding Gluten, Milk"
Stetson_East,Dinner,FRESH 52 A,Roasted Butternut Squash,,1 ounce,"Butternut Squash, Canola Oil, Kosher Salt^, Black Pepper",20,0,3,0.0,0.5,0,0,0.0,45,100,10,0.2,0,0,6,5,0.0,0,"Vegetarian, Avoiding Gluten, Vegan, How Good Friendly"
Stetson_East,Dinner,FRESH 52 A,Shredded Parmesan Cheese,,1 ounce,Parmesan Cheese^,120,11,0.0,0,8,5,20,0,480,30,360,0.2,0.0,5,0,70,0.0,5,"Vegetarian, Avoiding Gluten, Good Source of Protein, Milk"
Stetson_East,Dinner,FRESH 52 A,Classic Caesar Dressing,,1 floz,Caesar Dressing^,150,1,0.0,0,16,3,15,0,220,10,30,0.1,0,0,1,140,5,5,"Egg, Avoiding Gluten, Milk, Onion, Garlic, Mustard, Fish"
Stetson_East,Dinner,FRESH 52 A,Sesame Dressing,,1 floz,Asian Sesame Dressing^,80,0,12,10,4,0,0,0,320,0,0,0,0,0,0,35,0,0,"Vegetarian, Celery*, Gluten, Mustard*, Soy, Wheat, Garlic, Vegan, Sesame"
Stetson_East,Dinner,FRESH 52 A,Balsamic Vinaigrette Dressing,,1 floz,Balsamic Vinaigrette^,60,0,5,4,4.5,0,0,0,190,0,0.0,0,0,0,0.0,45,0.0,0,"Vegetarian, Avoiding Gluten, Celery*, Mustard*, Garlic, Vegan"
Stetson_East,Dinner,FRESH 52 A,Fat Free Raspberry Dressing,,1 floz,Fat Free Raspberry Vinaigrette^,30,0,8,7,0,0,0,0,75,0,0,0,0,0.0,0.0,0,0.0,0,"Vegetarian, Avoiding Gluten, Onion, Garlic, Vegan"
Stetson_East,Dinner,FRESH 52 A,Homestyle Ranch Dressing,,1 floz,Ranch Dressing^,100,0,0.0,0.0,11,1.5,10,0,250,0,0,0,0,0,0,100,0.0,0,"Egg, Vegetarian, Celery*, Milk, Mustard*, MSG"
Stetson_East,Dinner,FRESH 52 A,Fat Free Italian Dressing,,1 floz,Fat Free Italian Dressing^,15,0,3,2,0,0,0,0,470,0,0,0,0,0,0.0,0,0.0,0,"Vegetarian, Avoiding Gluten, Celery*, Mustard*, Onion, Garlic, Vegan"
Stetson_East,Dinner,FRESH 52 A,Blue Cheese Dressing,,1 floz,Blue Cheese Dressing^,160,0,1,1,16,3.5,15,0,270,0,0,0,0,0.0,0.0,140,0.0,5,"Egg, Vegetarian, Avoiding Gluten, Milk, Onion, Garlic, Mustard, MSG"
Stetson_East,Dinner,FRESH 52 A,Greek Dressing,,1 floz,Greek Dressing^,100,0,0.0,0,11,1.5,0,0,280,10,10,0.1,0,0,0,100,0,0,"Vegetarian, Avoiding Gluten, Milk, Onion, Garlic, Celery, Mustard"
Stetson_East,Dinner,FRESH 52 A,Croutons,Croutons to add to a salad,1 ounce,"French Baguette^, Garlic, Kosher Salt^, Canola Oil",80,2,16,0,0,0,0,0.0,360,30,10,1.1,0,0,0,0,0,0,"Vegetarian, Gluten, Wheat, Garlic, Tree Nuts*, Soy*, Milk*"
Stetson_East,Dinner,FRESH 52 A,Baked Wonton Strips,,1 ounce,Wonton Wrapper^,50,3,7,0,1.5,0,5,0,115,0.0,0,0.4,0,0.0,3,15,0,0,"Egg, Vegetarian, Gluten, Wheat"
Stetson_East,Dinner,FRESH 52 A,Roasted Sunflower Seeds,,1 tbsp,Unsalted Sunflower Seeds,45,2,2,0,4,0,0,0.0,0,70,10,0.3,0.0,0,0,35,0.0,0,"Vegetarian, Avoiding Gluten, Vegan"
Stetson_East,Dinner,FRESH 52 A,Raisins,,1 tbsp,Raisins,25,0,7,6,0,0,0,0,0,70,10,0.2,0,0,0,0,0.0,0,"Vegetarian, Avoiding Gluten, Vegan"
Stetson_East,Dinner,FRESH 52 A,Dried Cranberries,,1 tbsp,Cranberries^,30,0,8,7,0,0,0,0,0,0,0,0,0,0,0,0,0.0,0,"Vegetarian, Avoiding Gluten, Vegan"
Stetson_East,Dinner,FRESH 52 A,Balsamic Vinegar,,1 floz,Balsamic Vinegar^,25,0,5,4,0,0,0,0,5,30,10,0.2,0,0,0,0,0,0,"Vegetarian, Avoiding Gluten, Sulphites, Vegan"
Stetson_East,Dinner,FRESH 52 A,Red Wine Vinegar,,1 floz,Red Wine Vinegar^,5,0,0,0,0,0,0.0,0,0,10,0,0.1,0,0.0,0,0,0.0,0,"Vegetarian, Avoiding Gluten, Sulphites, Vegan"
Stetson_East,Dinner,FRESH 52 A,Canola Oil,,1 floz,Canola Oil,240,0,0,0,27,2,0,0,0,0,0,0,0,0,0,250,0.0,0,"Vegetarian, Avoiding Gluten, Vegan"
Stetson_East,Dinner,FRESH 52 A,Olive Oil,,1 floz,Olive Oil,240,0,0,0,27,3.5,0,0,0,0,0,0.2,0.0,0,0,240,0.0,5,"Vegetarian, Avoiding Gluten, Vegan"
Stetson_East,Dinner,FRESH 52 B,Sweet and Sour Tofu,Fried Tofu with a sweet and tangy sauce with fresh steamed vegetables.,1 ounce,"Tofu^, Green Bell Peppers, Pineapple^, Red Bell Peppers, Yellow Onions, Water, Ketchup^, Rice Wine^, Less Sodium Gluten Free Soy Sauce^, Unseasoned Rice Wine Vinegar, Cornstarch, Green Onions, Sugar",20,0.0,4,2,0,0,0,0,50,40,10,0.2,0.0,0,8,0,0,0,"Mustard*, Onion, Soy, Sulphites, Tomato, How Good Friendly, Gluten*, Alcohol, Wheat*"
Stetson_East,Dinner,FRESH 52 B,Cubed Tempeh,,1 ounce,Tempeh^,50,6,4,0,1.5,0,0,2,0,90,30,0.7,0,0,0.0,15,0.0,0,"Vegetarian, Soy, Vegan"
Stetson_East,Dinner,FRESH 52 B,Chick Peas,,1 ounce,Low Sodium Chick Peas^,45,3,8,1,0.5,0,0,2,70,80,10,0.8,0,0,0,5,0.0,0,"Vegetarian, Avoiding Gluten, Vegan, How Good Friendly"
Stetson_East,Dinner,FRESH 52 B,Dark Red Kidney Beans,,1 ounce,Low Sodium Kidney Beans^,25,1,4,0.0,0,0,0,2,35,70,10,0.4,0,0,0,0,0.0,0,"Vegetarian, Avoiding Gluten, Vegan"
Stetson_East,Dinner,FRESH 52 B,Hummus,,1 ounce,Hummus^,70,2,4,0,5,0.5,0,2,120,90,10,0.7,0,0,0,45,0.0,0,"Vegetarian, Avoiding Gluten, Garlic, Vegan, Sesame"
Stetson_East,Dinner,FRESH 52 B,Salsa,,1 floz,Salsa^,10,0,2,1,0,0,0,0.0,230,90,10,0.1,0.0,0,1,0,0.0,0,"Vegetarian, Onion, Garlic, Tomato, Vegan"
Stetson_East,Dinner,FRESH 52 B,Shredded Vegan Cheddar Cheese,,1 ounce,Vegan Cheddar Cheese Style Shreds^,90,0.0,8,0,7,4,0,0,230,10,120,0,0,0,0,60,0.0,5,"Vegetarian, Avoiding Gluten, Vegan"
Stetson_East,Dinner,FRESH 52 B,Lettuce Leaf,,1 each,Lettuce Leaf,0,0,0,0,0,0,0,0,0,10,0,0.1,0,0,1,0,0.0,0,"Vegetarian, Avoiding Gluten, Vegan"
Stetson_East,Dinner,FRESH 52 B,Sliced Tomatoes,,1 slice,Tomatoes,0,0,0.0,0,0,0,0,0,0,30,0,0,0,0,2,0,0.0,0,"Vegetarian, Avoiding Gluten, Tomato, Vegan"
Stetson_East,Dinner,FRESH 52 B,Dill Relish,,1 ounce,Pickle Relish^,35,0,10,0.0,0,0,0,0.0,310,20,0,0.3,0,0,1,0,0.0,0,"Vegetarian, Avoiding Gluten, Vegan"
Stetson_East,Dinner,FRESH 52 B,Sliced Dill Pickles,Sliced Dill Pickles,1 ounce,Pickles^,0,0,0.0,0,0,0,0,0,230,30,20,0.1,0,0,1,0,0.0,0,"Vegetarian, Mustard*, Vegan"
Stetson_East,Dinner,FRESH 52 B,Julienne Yellow Onions,,1 ounce,Yellow Onions,10,0,3,1,0,0,0,0,0,40,10,0.1,0,0,2,0,0.0,0,"Vegetarian, Avoiding Gluten, Onion, Vegan"
Stetson_East,Dinner,FRESH 52 B,Kale Salad,"kale, lemon, tomato, radish",1/2 cup,"Kale, Tomatoes, Radish, Canola Oil, Lemon Juice, Kosher Salt^, Sugar, White Pepper",90,3,7,3,7,0.5,0,5,320,470,270,1.8,0.0,0,104,60,0.0,0,"Vegetarian, Avoiding Gluten, Tomato, Vegan"
Stetson_East,Dinner,FRESH 52 B,Pickled Beet Salad,"Sliced pickled beets, fresh onions all tossed and served in a light vinaigrette",1/2 cup,"Beets^, Red Onions, Lettuce Leaf, Red Wine Vinegar^, Canola Oil, Parsley, Salt, Sugar, Black Pepper, Cumin",45,1,8,5,1,0,0,2,260,160,20,1.7,0.0,0,6,10,0.0,0,"Vegetarian, Avoiding Gluten, Onion, Sulphites, Vegan"
Stetson_East,Dinner,FRESH 52 B,Vegetable Pasta Salad,"penne pasta, broccoli, olives, grape tomatoes, onions, parsley, balsamic",1/2 cup,"Water, Water, Penne^, Tomatoes, Balsamic Vinaigrette^, Broccoli, Kalamata Olives^, Red Onions, Parsley, Kosher Salt^",130,3,18,4,5,0.5,0,2,330,160,20,0.9,0,0,24,45,0,0,"Vegetarian, Celery*, Gluten, Mustard*, Onion, Wheat, Garlic, Tomato, Egg*"
Stetson_East,Dinner,FRESH 52 B,Coleslaw,Shredded cabbage tossed in dressing.,1/2 cup,"Shredded Cabbage Mix^, Coleslaw Dressing^, Carrots",120,1,11,9,9,1.5,10,2,220,280,40,0.6,0,0,26,80,5,0,"Egg, Vegetarian, Avoiding Gluten, Onion, Garlic, Celery, Mustard"
Stetson_East,Dinner,FRESH 52 B,Watermelon,,1 wedge,Watermelon,90,2,22,18,0,0,0,1,0,330,20,0.7,0,0,24,0,0.0,0,"Vegetarian, Avoiding Gluten, Vegan"
Stetson_East,Dinner,FRESH 52 B,Red Seedless Grapes,,1/4 cup,Grapes,25,0,7,6,0,0,0,0,0,80,0,0.1,0,0,1,0,0.0,0,"Vegetarian, Avoiding Gluten, Vegan"
Stetson_East,Dinner,FRESH 52 B,Cubed Pineapple,,1/4 cup,Pineapple,20,0,5,4,0,0,0,0.0,0,40,10,0.1,0,0,20,0,0.0,0,"Vegetarian, Avoiding Gluten, Vegan"
Stetson_East,Dinner,FRESH 52 B,Cubed Cantaloupe,,1/4 cup,Cantaloupe,15,0,3,3,0,0,0,0,5,110,0,0.1,0,0,15,0,0.0,0,"Vegetarian, Avoiding Gluten, Vegan, How Good Friendly"
Stetson_East,Dinner,FRESH 52 B,Fat Free Cottage Cheese,,1/4 cup,Fat Free Cottage Cheese^,25,4,2,0.0,0,0,0.0,0,135,50,30,0.1,0.0,0,0,0,0.0,0,"Vegetarian, Milk, MSG*"
Stetson_East,Dinner,FRESH 52 B,Low Fat Plain Yogurt,,1/4 cup,Plain Low Fat Yogurt^,30,3,4,3,0.5,0,0.0,0,40,120,90,0,0,25,0.0,0,0.0,0,"Vegetarian, Avoiding Gluten, Milk"
Stetson_East,Dinner,FRESH 52 B,Low-Fat Blueberry Yogurt,,1/4 cup,Low Fat Blueberry Yogurt^,35,1,7,5,0,0,0,0,20,60,40,0,0,30,0.0,0,0.0,0,"Vegetarian, Avoiding Gluten, Milk"
Stetson_East,Dinner,FRESH 52 B,Blueberries,,1 ounce,Blueberries,15,0,3,2,0,0,0,0.0,0,20,0,0.1,0,0,1,0,0.0,0,"Vegetarian, Avoiding Gluten, Vegan"
Stetson_East,Dinner,FRESH 52 B,Oats 'n Honey Granola,,1 ounce,Granola^,130,2,20,7,4.5,0.5,0,1,100,60,0,0.6,0,0,0,45,0,0,"Vegetarian, Soy, Wheat, Gluten*"
Stetson_East,Dinner,FRESH 52 B,Cream Cheese,,1 ounce,Cream Cheese^,100,2,2,1,10,6,30,0,90,40,30,0,0,0,0,90,0.0,5,"Vegetarian, Avoiding Gluten, Milk"
Stetson_East,Dinner,FRESH 52 B,Maple Honey Cream Cheese,Maple Honey Cream Cheese,1 ounce,"Cream Cheese^, Honey, Maple Extract^",100,2,3,3,9,5,25,0,80,40,20,0,0.0,0,0,80,0.0,5,"Vegetarian, Milk, Sulphites, Gluten*, Alcohol, Wheat*"
Stetson_East,Dinner,FRESH 52 B,Strawberry Cream Cheese,Laced with sweet strawberries,1 ounce,"Cream Cheese^, Strawberry Preserves^",100,1,4,3,8,5,25,0,75,30,20,0,0,0,0,80,0.0,5,"Vegetarian, Milk, MSG*, Strawberry, Gluten*"
