Location,Period,Kitchen,Dish_Name,Description,Portion_Size,Ingredients,Calories,Protein (g),Total Carbohydrates (g),Sugar (g),Total Fat (g),Saturated Fat (g),Cholesterol (mg),Dietary Fiber (g),Sodium (mg),Potassium (mg),Calcium (mg),Iron (mg),Trans Fat (g),Vitamin D (IU),Vitamin C (mg),Calories From Fat,Vitamin A (RE),Saturated Fat + Trans Fat (g),Allergens
Stetson_East,Breakfast,CUCINA,English Breakfast Baked Beans,Traditional tomato baked beans with maple and spices,1/2 cup,"Cannellini Beans (White Kidney Beans, Water, Salt, Calcium Chloride, Disodium Edta), Tomato puree (tomato puree, water, tomato paste, citric acid), Onions, Maple Syrup, Tomato paste (tomato paste, salt, citric acid), Canola Oil, Worcestershire Sauce with Anchovies, Garlic, Salt, Paprika (Paprika and Silicon Dioxide), Black Pepper, Thyme",180,8,29,7,4,0,0,6,380,560,70,2.4,0.0,0,6,35,5,0,"Avoiding Gluten, Good Source of Protein, Celery*, MSG*, Mustard*, Tree Nuts*, Egg*, Soy*, Gluten*, Sesame*, Beef*, Pork*, Milk*, Wheat*, Garlic*, Onion*, Sulphites*, Alcohol*, Peanuts*, Shellfish - Crustacean*, Orange*, Fish*, Shellfish - Mollusk*, Mushroom*, Buckwheat*, Tomato*, Lupin*, Poultry*, Strawberry*"
Stetson_East,Breakfast,CUCINA,Quinoa,,1/2 cup,"Quinoa, Water, Chicken Broth Concentrate",130,4,22,1,2.5,0,0,3,340,170,20,1.5,0.0,0,0,20,0,0,Poultry
Stetson_East,Breakfast,CUCINA,Meatless Vegetarian Sausage Patty,,1 each,Meatless Sausage,70,9,4,0.0,2.5,0,0,0.0,250,100,0,1.6,0,0,0,20,0,0,"Egg, Vegetarian, Good Source of Protein, Celery*, Gluten, Milk, MSG*, Mustard*, Onion, Soy, Wheat"
Stetson_East,Breakfast,CUCINA,Blistered Grape Tomatoes,Blistered Grape Tomatoes with Parsley and Thyme,1 ounce,"Tomatoes, Canola Oil, Salt, Fresh Ground Black Pepper, Parsley, Thyme",30,0,1,0.0,2.5,0,0,0,110,70,0,0.1,0,0,4,25,0.0,0,"Vegetarian, Avoiding Gluten, Tomato, Vegan"
Stetson_East,Breakfast,CUCINA,"Ham, Egg, Cheese Breakfast Pizza","Peppers, Bacon, Eggs, Ham and Cheese Pizza",1 slice,"Pizza Dough, Part Skim Mozzarella Cheese, Ham, Liquid Egg, Whole Milk, Bacon, Sharp Cheddar Cheese, Green Bell Peppers, Mushrooms, Onions, American Cheese, Butter, Canola Oil, All Purpose Flour, Salt, White Pepper",330,18,36,3,12,5,85,1,810,280,240,2.6,0.0,130,2,110,0,5,"Egg, Good Source of Protein, Gluten, Milk, Onion, Wheat, Mushroom, Pork, Soy*, Sesame*, Beef*"
Stetson_East,Breakfast,CUCINA,Cheese Pizza,"Traditional pie topped with Italian tomato sauce, mozzarella, and parmesan cheese.",1 slice,"Pizza Dough, Parmesan Cheese, Part Skim Mozzarella Cheese, Crushed tomatoes (unpeeled tomatoes, tomato puree, salt, citric acid), Chopped whole peeled tomatoes (tomatoes, tomato juice, salt, calcium chloride, citric acid), Canola Oil, Salt, Basil, Garlic, Black Pepper",200,10,18,2,10,4,20,0.0,640,140,230,1.3,0,15,3,90,0,5,"Vegetarian, Good Source of Protein, Gluten, Milk, Wheat, Garlic, Tomato, Egg*, Soy*, Sesame*"
Stetson_East,Breakfast,RICE STATION,White Rice,White Rice Cooked with Canola Oil and Salt,1/2 cup,"Water, Long Grain White Rice, Canola Oil, Salt",120,2,23,0,1.5,0,0,0.0,30,50,20,0.9,0.0,0,0,15,0,0,"Vegetarian, Avoiding Gluten, Vegan, How Good Friendly"
Stetson_East,Breakfast,RICE STATION,Brown Rice,Lightly seasoned,1/2 cup,"Water, Brown Rice",110,2,23,0,1,0,0,1,0,70,0,0.4,0,0,0,10,0,0,"Vegetarian, Avoiding Gluten, Vegan"
Stetson_East,Breakfast,RICE STATION,Olive Oil,,1 floz,Olive Oil,240,0,0,0,27,3.5,0,0,0,0,0,0.2,0.0,0,0,240,0.0,5,"Vegetarian, Avoiding Gluten, Vegan"
Stetson_East,Breakfast,RICE STATION,Gluten Free Soy Sauce,,1 floz,Soy Sauce,20,1,4,2,0,0,0,0,880,200,0,0,0,0,0.0,0,0.0,0,"Vegetarian, Avoiding Gluten, Soy, Vegan"
Stetson_East,Breakfast,RICE STATION,Seasoned Rice Vinegar,,1 floz,Seasoned Rice Vinegar,0,0,0,0,0,0,0,0,0,0,0,0,0,0,0.0,0,0.0,0,"Vegetarian, Vegan"
Stetson_East,Breakfast,HOMESTYLE,Scrambled Eggs,,1/2 cup,"Liquid Egg, Canola Oil",200,14,0.0,0,15,4,420,0,160,160,60,2,0,90,0,140,0.0,5,"Egg, Vegetarian, Avoiding Gluten, Good Source of Protein"
Stetson_East,Breakfast,HOMESTYLE,Bacon,Salty cured delicious pork back,3 slice,Bacon,130,9,0,0,10,3.5,30,0,470,140,0,0.3,0,5,0,90,0.0,5,"Good Source of Protein, Pork, Gluten*"
Stetson_East,Breakfast,HOMESTYLE,Pineapple and Sweet Potato Hash,Fresh grilled pineapples with roasted sweet potatoes with cinnamon,3 oz portion,"Pineapple, Sweet Potato, Olive Oil, Salt, Cinnamon, Black Pepper",70,1,15,7,1.5,0,0,2,280,250,30,0.5,0.0,0,29,15,0.0,0,"Vegetarian, Avoiding Gluten, Vegan"
Stetson_East,Breakfast,HOMESTYLE,Buttermilk Pancakes,,2 each,"Water, Pancake Mix, Cooking Spray^",170,4,33,6,2.5,1,5,1,520,90,70,1.8,0,0,0,20,0,0,"Egg, Vegetarian, Gluten, Milk, Soy, Wheat"
Stetson_East,Breakfast,MENUTAINMENT,Eggs Your Way,,1 each,Egg,60,6,0,0,4,1.5,165,0,60,60,20,0.8,0,35,0,40,0.0,0,"Egg, Vegetarian, Avoiding Gluten"
Stetson_East,Breakfast,MENUTAINMENT,Eggs,,1/4 cup,Liquid Egg,90,8,0,0,6,2,225,0,85,80,30,1.1,0,50,0,50,0.0,0,"Egg, Vegetarian, Avoiding Gluten, Good Source of Protein"
Stetson_East,Breakfast,MENUTAINMENT,Egg Whites,two egg whites made-to-order,1/4 cup,Liquid Egg White,30,7,0,0,0,0,0,0,100,100,0,0,0.0,0,0,0,0.0,0,"Egg, Vegetarian, Avoiding Gluten, Good Source of Protein"
Stetson_East,Breakfast,MENUTAINMENT,Diced Bacon,,1 ounce,Bacon,130,10,0,0,10,3.5,30,0,480,140,0,0.3,0,5,0,90,0.0,5,"Good Source of Protein, Pork, Gluten*"
Stetson_East,Breakfast,MENUTAINMENT,Italian Sausage Crumbles,,1 ounce,Italian Sausage,90,5,0.0,0,7,2.5,25,0,230,100,0,0.4,0,10,0,70,0.0,5,"Avoiding Gluten, Celery*, Mustard*, Soy, Pork"
Stetson_East,Breakfast,MENUTAINMENT,Diced Ham,,1 ounce,Ham,35,4,2,0.0,1,0,15,0,360,200,0,0.2,0,170,0,10,0,0,"Pork, Gluten*"
Stetson_East,Breakfast,MENUTAINMENT,Shredded Sharp American Cheese,,1 ounce,American Cheese,100,5,1,0.0,9,5,30,0,470,40,300,0.2,0,90,0,80,0.0,5,"Avoiding Gluten, Milk, Beef*, Pork*"
Stetson_East,Breakfast,MENUTAINMENT,Baby Spinach,,1/4 ounce,Spinach,0,0,0,0,0,0,0,0,5,40,10,0.2,0,0,2,0,0.0,0,"Vegetarian, Avoiding Gluten, Vegan, How Good Friendly"
Stetson_East,Breakfast,MENUTAINMENT,Sliced Mushrooms,,1 ounce,Mushrooms,5,0.0,0.0,0.0,0,0,0,0,0,90,0,0.1,0,0,1,0,0.0,0,"Vegetarian, Avoiding Gluten, Vegan, How Good Friendly, Mushroom"
Stetson_East,Breakfast,MENUTAINMENT,Diced Tomatoes,,1 ounce,Tomatoes,5,0,1,0.0,0,0,0,0,0,70,0,0.1,0,0,4,0,0.0,0,"Vegetarian, Avoiding Gluten, Tomato, Vegan"
Stetson_East,Breakfast,MENUTAINMENT,Chopped Green Bell Pepper,,1 ounce,Green Bell Peppers,5,0,1,0.0,0,0,0,0,0,50,0,0.1,0,0,23,0,0.0,0,"Vegetarian, Avoiding Gluten, Vegan"
Stetson_East,Breakfast,MENUTAINMENT, Diced Onions,,1 ounce,Onions,10,0,3,1,0,0,0,0,0,40,10,0.1,0,0,2,0,0.0,0,"Vegetarian, Avoiding Gluten, Onion, Vegan"
Stetson_East,Breakfast,SOUP,Oatmeal,,1 ladle-4oz,"Water, Oatmeal, Salt",90,3,16,0,2,0,0,2,95,90,10,1.2,0.0,0,0,20,0,0,"Vegetarian, Gluten, Wheat, Vegan"
Stetson_East,Breakfast,SOUP,Hard Boiled Eggs,,2 each,"Waters, Egg",130,11,0.0,0,8,3,325,0,125,120,50,1.5,0,70,0,80,0,5,"Egg, Vegetarian, Avoiding Gluten, Good Source of Protein"
Stetson_East,Breakfast,SOUP,Cinnamon Sugar,"cinnamon, sugar, brown sugar mix",1 ounce,"Sugar, Brown Sugar (sugar, cane syrups), Cinnamon",110,0,28,25,0,0,0,2,0,20,40,0.3,0.0,0,0,0,0.0,0,"Vegetarian, Avoiding Gluten, Vegan"
Stetson_East,Breakfast,SOUP,Brown Sugar Topping,,1 cup,"Brown Sugar (sugar, cane syrups), Sugar",800,0,208,207,0,0,0,0,30,150,90,0.8,0.0,0,0,0,0.0,0,"Vegetarian, Avoiding Gluten, Vegan"
Stetson_East,Breakfast,FRESH 52 B,Grapefruit,,1 half,Ruby Red Grapefruit,35,0.0,9,6,0,0,0,1,0,110,20,0.1,0,0,26,0,0.0,0,"Vegetarian, Avoiding Gluten, Vegan, How Good Friendly"
Stetson_East,Breakfast,FRESH 52 B,Watermelon,,1 wedge,Watermelon,90,2,22,18,0,0,0,1,0,330,20,0.7,0,0,24,0,0.0,0,"Vegetarian, Avoiding Gluten, Vegan"
Stetson_East,Breakfast,FRESH 52 B,Red Seedless Grapes,,1/4 cup,Grapes,25,0,7,6,0,0,0,0,0,80,0,0.1,0,0,1,0,0.0,0,"Vegetarian, Avoiding Gluten, Vegan"
Stetson_East,Breakfast,FRESH 52 B,Cubed Pineapple,,1/4 cup,Pineapple,20,0,5,4,0,0,0,0.0,0,40,10,0.1,0,0,20,0,0.0,0,"Vegetarian, Avoiding Gluten, Vegan"
Stetson_East,Breakfast,FRESH 52 B,Cubed Cantaloupe,,1/4 cup,Cantaloupe,15,0,3,3,0,0,0,0,5,110,0,0.1,0,0,15,0,0.0,0,"Vegetarian, Avoiding Gluten, Vegan, How Good Friendly"
Stetson_East,Breakfast,FRESH 52 B,Cubed Honeydew,,1/4 cup,Honeydew Melon,15,0,4,3,0,0,0,0,10,100,0,0.1,0,0,8,0,0.0,0,"Vegetarian, Avoiding Gluten, Vegan, How Good Friendly"
Stetson_East,Breakfast,FRESH 52 B,Fat Free Cottage Cheese,,1/4 cup,Fat Free Cottage Cheese,25,4,2,0.0,0,0,0.0,0,135,50,30,0.1,0.0,0,0,0,0.0,0,"Vegetarian, Milk, MSG*"
Stetson_East,Breakfast,FRESH 52 B,Low Fat Plain Yogurt,,1/4 cup,Low Fat Yogurt,30,3,4,3,0.5,0,0.0,0,40,120,90,0,0,25,0.0,0,0.0,0,"Vegetarian, Avoiding Gluten, Milk"
Stetson_East,Breakfast,FRESH 52 B,Low-Fat Blueberry Yogurt,,1/4 cup,Low Fat Blueberry Yogurt,35,1,7,5,0,0,0,0,20,60,40,0,0,30,0.0,0,0.0,0,"Vegetarian, Avoiding Gluten, Milk"
Stetson_East,Breakfast,FRESH 52 B,Blueberries,,1 ounce,Blueberries,15,0,3,2,0,0,0,0.0,0,20,0,0.1,0,0,1,0,0.0,0,"Vegetarian, Avoiding Gluten, Vegan"
Stetson_East,Breakfast,FRESH 52 B,Oats 'n Honey Granola,,1 ounce,Granola,130,2,20,7,4.5,0.5,0,1,100,60,0,0.6,0,0,0,45,0,0,"Vegetarian, Soy, Wheat, Gluten*"
Stetson_East,Breakfast,FRESH 52 B,Cream Cheese,,1 ounce,Cream Cheese,100,2,2,1,10,6,30,0,90,40,30,0,0,0,0,90,0.0,5,"Vegetarian, Avoiding Gluten, Milk"
Stetson_East,Breakfast,FRESH 52 B,Maple Honey Cream Cheese,Maple Honey Cream Cheese,1 ounce,"Cream Cheese, Honey, Maple Extract",100,2,3,3,9,5,25,0,80,40,20,0,0.0,0,0,80,0.0,5,"Vegetarian, Milk, Sulphites, Gluten*, Alcohol, Wheat*"
Stetson_East,Breakfast,FRESH 52 B,Strawberry Cream Cheese,Laced with sweet strawberries,1 ounce,"Cream Cheese, Strawberry Preserves",100,1,4,3,8,5,25,0,75,30,20,0,0,0,0,80,0.0,5,"Vegetarian, Milk, MSG*, Strawberry, Gluten*"
Stetson_East,Breakfast,FRESH 52 B,Butter PC,,1 each,Butter,70,0,0,0,8,4.5,25,0,60,0,0,0,0,0,0,70,0.0,5,"Vegetarian, Avoiding Gluten, Milk"
Stetson_East,Breakfast,FRESH 52 B,"Margarine, Smart Balance, 5g",Margarine,1 each,"INGREDIENTS: NATURAL OIL BLEND (PALM FRUIT, SOYBEAN, CANOLA, FLAXSEED AND OLIVE OILS), WATER, CONTAINS LESS THAN 2% SALT, SORBITAN ESTER OF VEGETABLE FATTY ACIDS, MONOGLYCERIDE OF VEGETABLE FATTY ACIDS, SOYBEAN LECITHIN, POTASSIUM SORBATE, TBHQ AND CALCIUM DISODIUM EDTA TO PROTECT FRESHNESS, NATURAL AND ARTIFICIAL FLAVOR, LACTIC ACID, VITAMIN A PALMITATE, BETA-CAROTENE COLOR AND VITAMIN E ACETATE. CONTAINS: SOYBEAN.",30,0,0,0,3,1,0,0,30,0,0,0,0,0,0,30,35,0,"Vegetarian, Avoiding Gluten, Soy, Vegan"
Stetson_East,Breakfast,FRESH 52 B,"Jelly, Assorted (Grape, Strawberry, Mixed Fruit), Smuckers",,1 each,"Concord Grape Jelly: Concord Grape Juice, High Fructose Corn Syrup, Corn Syrup, Fruit Pectin, Citric Acid, Sodium Citrate.
Strawberry Jam: Strawberries, High Fructose Corn Syrup, Corn Syrup, Sugar, Fruit Pectin, Citric Acid.
Mixed Fruit Jelly: High Fructose Corn Syrup, Corn Syrup, Grape Juice, Apple Juice, Fruit Pectin, Citric Acid. 
Manufacturer will not declare gluten free ",35,0,9,8,0,0,0,0,5,0.0,0.0,0.0,0,0.0,0.0,0,0.0,0,"Strawberry, Gluten*"
Stetson_East,Breakfast,FRESH 52 B,"Peanut Butter, .75 oz, Jif",,1 each,"INGREDIENTS: MADE FROM ROASTED PEANUTS AND SUGAR, CONTAINS 2% OR LESS OF: MOLASSES, FULLY HYDROGENATED VEGETABLE OILS (RAPESEED AND SOYBEAN), MONO AND DIGLYCERIDES, SALT. Gluten Free. ALLERGENS: Peanuts. ",120,4,5,2,10,2,0,2,90,120,10,0.3,0,0,0.0,90,0.0,0,"Vegetarian, Avoiding Gluten, Vegan, Peanuts"
Stetson_East,Breakfast,FRESH 52 B,Nutella,,3/4 ounce,Chocolate Hazelnut Spread,110,1,13,12,6,2.5,0.0,0.0,10,100,20,0.6,0,0,0.0,60,0.0,0,"Vegetarian, Avoiding Gluten, Milk, Soy, Tree Nuts"
Stetson_East,Breakfast,FRESH 52 B,Dried Cranberries,,1 tbsp,Cranberries,30,0,8,7,0,0,0,0,0,0,0,0,0,0,0,0,0.0,0,"Vegetarian, Avoiding Gluten, Vegan"
Stetson_East,Breakfast,FRESH 52 B,Raisins,,1 tbsp,Raisins,25,0,7,6,0,0,0,0,0,70,10,0.2,0,0,0,0,0.0,0,"Vegetarian, Avoiding Gluten, Vegan"
Stetson_East,Breakfast,FRESH 52 B,Roasted Sunflower Seeds,,1 tbsp,Sunflower Seeds,45,2,2,0,4,0,0,0.0,0,70,10,0.3,0.0,0,0,35,0.0,0,"Vegetarian, Avoiding Gluten, Vegan"
Stetson_East,Breakfast,SWEET SHOPPE,Plain Bagel,,1 each,Plain Bagel,300,9,60,4,2,0,0,2,300,0.0,100,3.8,0,0,0.0,20,0.0,0,"Vegetarian, Good Source of Protein, Gluten, Soy, Wheat, Vegan"
Stetson_East,Breakfast,SWEET SHOPPE,Cinnamon Raisin Bagel,,1 each,Cinnamon Raisin Bagel,330,11,66,14,2,0.5,0,3,460,150,40,3.4,0,0,0.0,20,0.0,0,"Vegetarian, Good Source of Protein, Gluten, Soy, Wheat, Vegan, Sesame"
Stetson_East,Breakfast,SWEET SHOPPE,Everything Bagel,,1 each,Everything Bagel,310,11,61,6,2.5,0,0,3,570,120,60,4,0,0,5,25,20,0,"Vegetarian, Good Source of Protein, Gluten, Onion, Wheat, Garlic, Sulphites, Vegan, Soy*, Sesame"
Stetson_East,Breakfast,SWEET SHOPPE,Mini Croissant,,1 each,Croissant,90,1,11,1,4.5,2.5,10,0,90,10,0,0.2,0,0,0.0,40,0.0,5,"Egg, Vegetarian, Gluten, Milk, Wheat, Tree Nuts*"
Stetson_East,Breakfast,SWEET SHOPPE,Blueberry Muffin,Sweet blueberries in a fluffy cake.,1 each,"Muffin Mix, Water, Blueberries, All Purpose Flour",360,3,63,33,10,4.5,0,1,530,70,60,2.1,0.0,0,0,90,0,5,"Vegetarian, Gluten, Milk, Soy, Wheat, Egg*"
Stetson_East,Breakfast,SWEET SHOPPE,Assorted Mini Danishes,"Assortment of apple, cheese, raspberry, or cinnamon raisin",1 each,Demi Danish,110,2,16,7,5,2.5,0.0,0.0,135,10,10,1,0,0,0.0,45,0.0,0,"Egg, Vegetarian, Gluten, Milk, Soy, Wheat, Sulphites"
Stetson_East,Breakfast,SWEET SHOPPE,Vanilla and Sprinkle Donut,Donut topped with vanilla icing and rainbow sprinkles,1 each,"Homestyle Doughnut, Vanilla Icing, Rainbow Sprinkles",400,4,62,33,15,8,0,0.0,260,60,20,1.6,0,0,0,140,15,10,"Vegetarian, Gluten, Milk, Soy, Wheat, Sulphites, Egg*"
Stetson_East,Breakfast,SWEET SHOPPE,Brown Sugar Cinnamon Scone,,1 each,Brown Sugar Cinnamon Scone Dough,420,5,58,30,18,10,0,1,360,150,90,2.1,0,0,0.0,160,0.0,10,"Vegetarian, Gluten, Milk, Soy, Wheat"
Stetson_East,Dinner,CUCINA,Buffalo Shrimp Macaroni and Cheese,Combine traditional mac & cheese and the flavors of a buffalo wing sauce,1 cup,"Water, Cheese Sauce, Shrimp, Elbow Macaroni, Whole Milk, Buffalo Wing Sauce, Blue Cheese, Cheddar Cheese, Panko Bread Crumbs, Kosher Salt, Black Pepper",310,16,35,2,12,6,85,2,1350,160,180,1,0.0,15,0,100,25,5,"Good Source of Protein, Gluten, Milk, Wheat, Garlic, Sulphites, Shellfish - Crustacean"
Stetson_East,Dinner,CUCINA,Garlic Breadstick ,"Garlic Breadstick, Butter, and Parsley ",1 each,"French Breadsticks Dough, Butter, Parsley, Garlic",80,2,12,0.0,3,1.5,5,0,140,30,10,0.8,0,10,0,25,0,0,"Egg, Vegetarian, Gluten, Milk, Wheat, Garlic, How Good Friendly, Soy*"
Stetson_East,Dinner,CUCINA,Marinara Sauce,marinara sauce,1 ladle-2oz,Marinara Sauce,35,0.0,7,4,0,0,0,1,230,180,20,0.4,0,0,0.0,0,0.0,0,"Vegetarian, Onion, Garlic, Tomato, Vegan, Gluten*"
Stetson_East,Dinner,CUCINA,Caesar Salad,"With romaine lettuce, parmesan cheese, and garlic croutons",1 cup,"Lettuce, White Bread, Parmesan Cheese, Canola Oil, Garlic",110,4,11,2,5,1.5,0.0,1,190,150,100,1,0.0,0,2,45,0.0,0,"Vegetarian, Gluten, Milk, Soy, Wheat, Garlic, Tree Nuts*"
Stetson_East,Dinner,CUCINA,Cheese Pizza,"Traditional pie topped with Italian tomato sauce, mozzarella, and parmesan cheese.",1 slice,"Pizza Dough, Parmesan Cheese, Part Skim Mozzarella Cheese, Crushed tomatoes (unpeeled tomatoes, tomato puree, salt, citric acid), Chopped whole peeled tomatoes (tomatoes, tomato juice, salt, calcium chloride, citric acid), Canola Oil, Salt, Basil, Garlic, Black Pepper",200,10,18,2,10,4,20,0.0,640,140,230,1.3,0,15,3,90,0,5,"Vegetarian, Good Source of Protein, Gluten, Milk, Wheat, Garlic, Tomato, Egg*, Soy*, Sesame*"
Stetson_East,Dinner,CUCINA,Buffalo Chicken Pizza, Buffalo Chicken Pizza,1 slice,"Seasoned Chicken Breast, Pizza Dough, Part Skim Mozzarella Cheese, Buffalo Wing Sauce, Green Onions, Canola Oil",210,18,17,1,7,3.5,40,0.0,770,270,160,1.5,0,15,1,70,0,5,"Good Source of Protein, Gluten, Milk, MSG*, Onion, Soy, Wheat, Garlic, Poultry, Egg*, Sesame*"
Stetson_East,Dinner,CUCINA,Pepperoni Pizza,A Classic Favorite,1 slice,"Pizza Dough, Part Skim Mozzarella Cheese, Crushed tomatoes (unpeeled tomatoes, tomato puree, salt, citric acid), Chopped whole peeled tomatoes (tomatoes, tomato juice, salt, calcium chloride, citric acid), Pepperoni-, Canola Oil, Salt, Basil, Garlic, Black Pepper",200,11,17,2,10,5,25,0.0,560,150,210,1.3,0,20,2,90,0,5,"Good Source of Protein, Gluten, Milk, Mustard*, Wheat, Garlic, Tomato, Beef, Pork, Egg*, Soy*, Sesame*"
Stetson_East,Dinner,CUCINA,Grated Parmesan Cheese,,1 tbsp,Parmesan Cheese,25,2,0.0,0,1.5,1,5,0,115,10,50,0,0,0,0,15,0.0,0,"Vegetarian, Avoiding Gluten, Milk"
Stetson_East,Dinner,CUCINA,Crushed Red Pepper,,1 tsp,Red Pepper,5,0,1,0,0,0,0,0,0,40,0,0.1,0.0,0,1,0,0.0,0,"Vegetarian, Avoiding Gluten, Vegan"
Stetson_East,Dinner,CUCINA,Dried Oregano,,1 tsp,Oregano,0,0,0.0,0,0,0,0,0,0,10,20,0.4,0,0,0,0,0.0,0,"Vegetarian, Avoiding Gluten, Vegan"
Stetson_East,Dinner,RICE STATION,White Rice,White Rice Cooked with Canola Oil and Salt,1/2 cup,"Water, Long Grain White Rice, Canola Oil, Salt",120,2,23,0,1.5,0,0,0.0,30,50,20,0.9,0.0,0,0,15,0,0,"Vegetarian, Avoiding Gluten, Vegan, How Good Friendly"
Stetson_East,Dinner,RICE STATION,Brown Rice,Lightly seasoned,1/2 cup,"Water, Brown Rice",110,2,23,0,1,0,0,1,0,70,0,0.4,0,0,0,10,0,0,"Vegetarian, Avoiding Gluten, Vegan"
Stetson_East,Dinner,RICE STATION,Olive Oil,,1 floz,Olive Oil,240,0,0,0,27,3.5,0,0,0,0,0,0.2,0.0,0,0,240,0.0,5,"Vegetarian, Avoiding Gluten, Vegan"
Stetson_East,Dinner,RICE STATION,Gluten Free Soy Sauce,,1 floz,Soy Sauce,20,1,4,2,0,0,0,0,880,200,0,0,0,0,0.0,0,0.0,0,"Vegetarian, Avoiding Gluten, Soy, Vegan"
Stetson_East,Dinner,RICE STATION,Seasoned Rice Vinegar,,1 floz,Seasoned Rice Vinegar,0,0,0,0,0,0,0,0,0,0,0,0,0,0,0.0,0,0.0,0,"Vegetarian, Vegan"
Stetson_East,Dinner,HOMESTYLE,Chicken and Dumplings,Tender chicken with moist dumplings,8 oz portion,"Water, Chicken, Biscuit Mix, Reduced Fat Milk, Carrots, Celery, Unsalted Butter, All Purpose Flour, Chicken Base, Onions, Parsley, Salt, Poultry Seasoning, White Pepper",440,28,35,4,20,10,90,2,730,320,130,3.2,0.0,20,3,180,0,10,"Egg, Good Source of Protein, Gluten, Milk, Onion, Soy, Wheat, Celery, Poultry"
Stetson_East,Dinner,HOMESTYLE,Vegan Southern Green Beans,Slow cooked green beans with onion and garlic,4 ounce,"Green Beans, Water, Onions, Garlic, Vegetable Base, Canola Oil, Salt, Roasted peppers (Roasted Peppers, Water, Salt Citric Acid), Black Pepper",60,2,13,4,1,0,0,4,430,260,70,0.9,0,0,9,10,0,0,"Vegetarian, Avoiding Gluten, Onion, Garlic, Vegan, Celery"
Stetson_East,Dinner,HOMESTYLE,Roasted Yellow Squash,Roasted Squash,1/2 cup,"Squash, Canola Oil, Salt Free Garlic Herb Seasoning",40,0.0,4,3,2.5,0,0,0.0,0,200,20,0.4,0,0,18,20,0,0,"Vegetarian, Avoiding Gluten, Onion, Garlic, Vegan, How Good Friendly, Celery, Orange"
Stetson_East,Dinner,HOMESTYLE,Garlic Cheddar Biscuit,,1 each,Garlic Cheddar Biscuit,110,2,13,1,5,2.5,0,0,380,30,30,0.7,0,0,0.0,50,0.0,5,"Vegetarian, Gluten, Milk, MSG*, Soy, Wheat"
Stetson_East,Dinner,GLOBAL EATS,Lentil and Potato Taco,"Flour tortilla taco filled with lentils, potatoes and carrots cooked in tomatoes with garlic and cumin",2 each,"Water, Potatoes, Tomatoes, Flour Tortilla, Carrots, Onions, Yellow Lentils, Canola Oil, Garlic, Jalapeno, Cilantro, Salt, Cumin",330,11,55,6,7,1.5,0,6,680,720,100,2.8,0.0,0,23,60,0,0,"Vegetarian, Good Source of Protein, Gluten, Onion, Wheat, Garlic, Tomato, Vegan"
Stetson_East,Dinner,GLOBAL EATS,Cilantro Brown Rice,Herb infused brown rice,1/2 cup,"Water, Brown Rice, Celery, Onions, Lemon Juice, Cilantro, Canola Oil, Lemon, Salt, Black Pepper",180,3,32,1,4,0,0,2,135,170,20,0.6,0,0,6,35,0,0,"Vegetarian, Avoiding Gluten, Onion, Vegan, How Good Friendly, Celery"
Stetson_East,Dinner,GLOBAL EATS,Smashed Black Beans,Smashed black beans with fresh tomatoes,1/2 cup,"Black turtle beans (Prepared Black beans, water, salt and calcium chloride), Tomatoes, Onions, Canola Oil, Serrano Pepper, Cumin, Garlic, Salt, Black Pepper, Oregano",110,6,16,1,2.5,0,0,6,270,330,40,2.2,0.0,0,6,25,0.0,0,"Vegetarian, Avoiding Gluten, Onion, Garlic, Tomato, Vegan"
Stetson_East,Dinner,GLOBAL EATS,Onions and Peppers,Sauteed onions and sweet bell peppers,1/2 cup,"Green Bell Peppers, Onions, Canola Oil, Black Pepper",150,1,7,3,13,1,0,2,0,170,20,0.3,0,0,47,120,0.0,0,"Vegetarian, Avoiding Gluten, Onion, Vegan"
Stetson_East,Dinner,MENUTAINMENT,Eggs Your Way,,1 each,Egg,60,6,0,0,4,1.5,165,0,60,60,20,0.8,0,35,0,40,0.0,0,"Egg, Vegetarian, Avoiding Gluten"
Stetson_East,Dinner,MENUTAINMENT,Eggs,,1/4 cup,Liquid Egg,90,8,0,0,6,2,225,0,85,80,30,1.1,0,50,0,50,0.0,0,"Egg, Vegetarian, Avoiding Gluten, Good Source of Protein"
Stetson_East,Dinner,MENUTAINMENT,Egg Whites,two egg whites made-to-order,1/4 cup,Liquid Egg White,30,7,0,0,0,0,0,0,100,100,0,0,0.0,0,0,0,0.0,0,"Egg, Vegetarian, Avoiding Gluten, Good Source of Protein"
Stetson_East,Dinner,MENUTAINMENT,Diced Bacon,,1 ounce,Bacon,130,10,0,0,10,3.5,30,0,480,140,0,0.3,0,5,0,90,0.0,5,"Good Source of Protein, Pork, Gluten*"
Stetson_East,Dinner,MENUTAINMENT,Italian Sausage Crumbles,,1 ounce,Italian Sausage,90,5,0.0,0,7,2.5,25,0,230,100,0,0.4,0,10,0,70,0.0,5,"Avoiding Gluten, Celery*, Mustard*, Soy, Pork"
Stetson_East,Dinner,MENUTAINMENT,Diced Ham,,1 ounce,Ham,35,4,2,0.0,1,0,15,0,360,200,0,0.2,0,170,0,10,0,0,"Pork, Gluten*"
Stetson_East,Dinner,MENUTAINMENT,Shredded Sharp American Cheese,,1 ounce,American Cheese,100,5,1,0.0,9,5,30,0,470,40,300,0.2,0,90,0,80,0.0,5,"Avoiding Gluten, Milk, Beef*, Pork*"
Stetson_East,Dinner,MENUTAINMENT,Baby Spinach,,1/4 ounce,Spinach,0,0,0,0,0,0,0,0,5,40,10,0.2,0,0,2,0,0.0,0,"Vegetarian, Avoiding Gluten, Vegan, How Good Friendly"
Stetson_East,Dinner,MENUTAINMENT,Sliced Mushrooms,,1 ounce,Mushrooms,5,0.0,0.0,0.0,0,0,0,0,0,90,0,0.1,0,0,1,0,0.0,0,"Vegetarian, Avoiding Gluten, Vegan, How Good Friendly, Mushroom"
Stetson_East,Dinner,MENUTAINMENT,Diced Tomatoes,,1 ounce,Tomatoes,5,0,1,0.0,0,0,0,0,0,70,0,0.1,0,0,4,0,0.0,0,"Vegetarian, Avoiding Gluten, Tomato, Vegan"
Stetson_East,Dinner,MENUTAINMENT,Chopped Green Bell Pepper,,1 ounce,Green Bell Peppers,5,0,1,0.0,0,0,0,0,0,50,0,0.1,0,0,23,0,0.0,0,"Vegetarian, Avoiding Gluten, Vegan"
Stetson_East,Dinner,MENUTAINMENT, Diced Onions,,1 ounce,Onions,10,0,3,1,0,0,0,0,0,40,10,0.1,0,0,2,0,0.0,0,"Vegetarian, Avoiding Gluten, Onion, Vegan"
Stetson_East,Dinner,FLAME,Hamburger Patty,Ground sirloin patty grilled to perfection ,1 each,Beef,170,16,0,0,11,4,55,0,45,190,10,1.5,0,0,0,100,0.0,5,"Avoiding Gluten, Good Source of Protein, Beef"
Stetson_East,Dinner,FLAME,Grilled Chicken,Tender and moist,1 each,Chicken,120,23,0,0,3,1,80,0,140,260,0,0.4,0,0,0,25,0.0,0,"Avoiding Gluten, Good Source of Protein, Poultry"
Stetson_East,Dinner,FLAME,All Beef Hot Dog,,1 each,Beef Hot Dog,180,7,2,0.0,17,7,35,0,480,140,10,0.7,0.0,20,0.0,150,0.0,5,"Good Source of Protein, Beef"
Stetson_East,Dinner,FLAME,Onions and Peppers,Sauteed onions and sweet bell peppers,1/2 cup,"Green Bell Peppers, Onions, Butter, Black Pepper",130,1,7,3,11,7,30,2,90,160,20,0.3,0,0,40,100,0.0,5,"Vegetarian, Avoiding Gluten, Milk, Onion"
Stetson_East,Dinner,FLAME,French Fries,,3 ounce,French Fries,150,1,18,0.0,9,1,0,1,20,270,10,0.3,0,0,0,80,0.0,0,
Stetson_East,Dinner,FLAME,White Hot Dog Bun,,1 each,Hot Dog Bun,100,3,19,2,1,0,0,0.0,160,30,30,1.3,0,0,0.0,10,0.0,0,"Vegetarian, Gluten, Wheat, Vegan, Soy*"
Stetson_East,Dinner,FLAME,White Hamburger Bun,White Hamburger Bun,1 each,Burger Bun,150,4,28,4,2,0,0,0,280,50,50,1.5,0,0,0.0,20,0.0,0,"Vegetarian, Gluten, Soy, Wheat, Tree Nuts*, Egg*, Sesame, Milk*"
Stetson_East,Dinner,FLAME,American Cheese Slice,,1 slice,American Cheese,50,3,0.0,0,4.5,2.5,15,0,240,20,150,0.1,0,45,0,40,0.0,5,"Avoiding Gluten, Milk, Beef*, Pork*"
Stetson_East,Dinner,DELI,Sliced Genoa Salami,,1 ounce,Genoa Salami,120,5,0,0,11,4,30,0,480,0.0,0,0.4,0,0.0,7,100,0.0,5,"Avoiding Gluten, Celery*, Mustard*, Garlic, Beef, Pork"
Stetson_East,Dinner,DELI,Sliced Capicola,,1 ounce,Capicola,35,5,2,0.0,1,0,15,0,440,80,0,0.3,0,0.0,0.0,10,0.0,0,"Pork, Soy*, Gluten*, Wheat*"
Stetson_East,Dinner,DELI,Sliced Smoked Ham,,1 ounce,Ham,35,5,0,0,1.5,0.5,15,0,330,90,0,0.2,0,10,0,15,0.0,0,"Pork, Gluten*, Wheat*"
Stetson_East,Dinner,DELI,Thinly Sliced Deli Turkey Breast,,1 ounce,Turkey,30,4,0.0,0,1,0,15,0,260,40,0,0.2,0,0,0,10,0,0,"Avoiding Gluten, Poultry"
Stetson_East,Dinner,DELI,FIT Tuna Salad,Classic tuna salad ,3 oz portion,"Tuna, Canola Oil, Red Onions, Celery, Lemon Juice, Light Mayonnaise, Kosher Salt, Black Pepper",90,8,0.0,0,6,0.5,15,0,240,90,10,0.7,0,20,1,50,0,0,"Egg, Good Source of Protein, MSG*, Onion, Celery, Soy*, Gluten*, Mustard, Fish"
Stetson_East,Dinner,DELI,Chicken Salad,"Moist chicken salad, in a low fat dressing",1/3 cup,"Chicken, Mayonnaise, Celery, White Pepper",110,8,0,0,9,1.5,30,0,150,130,0,0.2,0,0,0,80,5,0,"Egg, Good Source of Protein, Onion, Celery, Poultry, Gluten*, Mustard"
Stetson_East,Dinner,DELI,American Cheese Slice,,1 slice,American Cheese,50,3,0.0,0,4.5,2.5,15,0,240,20,150,0.1,0,45,0,40,0.0,5,"Avoiding Gluten, Milk, Beef*, Pork*"
Stetson_East,Dinner,DELI,Sliced Swiss Cheese,,1 ounce,Swiss Cheese,110,8,0,0,9,5,25,0,55,20,250,0,0,0,0,80,0.0,5,"Vegetarian, Avoiding Gluten, Good Source of Protein, Milk"
Stetson_East,Dinner,DELI,Sliced Sharp Cheddar Cheese,,1 ounce,Cheddar Cheese,110,6,0.0,0,9,5,30,0,190,20,200,0,0.0,5,0,80,0.0,5,"Vegetarian, Avoiding Gluten, Milk"
Stetson_East,Dinner,DELI,Sliced Provolone Cheese,,1 ounce,Provolone Cheese,100,7,0.0,0,8,5,20,0,210,40,210,0.1,0.0,5,0,70,0.0,5,"Vegetarian, Avoiding Gluten, Good Source of Protein, Milk"
Stetson_East,Dinner,DELI,Sliced Pepper Jack Cheese,,1 ounce,Pepper Jack Cheese,110,7,0,0,9,5,25,0,170,20,210,0.2,0.0,5,0,80,0.0,5,"Vegetarian, Avoiding Gluten, Good Source of Protein, Milk"
Stetson_East,Dinner,DELI,Chopped Romaine Lettuce,,1 cup,Chopped Lettuce,10,0.0,2,0.0,0,0,0,0.0,0,120,20,0.5,0,0,2,0,0.0,0,"Vegetarian, Avoiding Gluten, Vegan"
Stetson_East,Dinner,DELI,Baby Spinach,,2 cup,Spinach,15,2,2,0,0,0,0,1,45,330,60,1.6,0,0,17,0,0.0,0,"Vegetarian, Avoiding Gluten, Vegan, How Good Friendly"
