Location,Period,Kitchen,Dish_Name,Description,Portion_Size,Ingredients,Calories,Protein (g),Total Carbohydrates (g),Sugar (g),Total Fat (g),Saturated Fat (g),Cholesterol (mg),Dietary Fiber (g),Sodium (mg),Potassium (mg),Calcium (mg),Iron (mg),Trans Fat (g),Vitamin D (IU),Vitamin C (mg),Calories From Fat,Vitamin A (RE),Saturated Fat + Trans Fat (g),Allergens
IV,Lunch,ASIAN KITCHEN TOPPINGS,Sliced Pickled Ginger,,1 ounce,Pickled Ginger,5,0,1,0,0,0,0,0.0,260,10,20,0.1,0,0,0,0,0.0,0,"Vegetarian, Vegan"
IV,Lunch,ASIAN KITCHEN TOPPINGS,Sriracha Mayonnaise,A great addition to the deli station,2 tbsp,"Light Mayonnaise, Hot Chili Sauce, Lime Juice",60,0,1,0,6,1,10,0,250,10,0,0.1,0.0,0,2,60,5,0,"Egg, Vegetarian, Garlic, Sulphites, Gluten*, Mustard"
IV,Lunch,ASIAN KITCHEN TOPPINGS,Hoisin Sauce,,1 floz,Hoisin Sauce,90,1,21,17,0,0,0,1,560,0,0,0,0,0,0.0,0,0.0,0,"Vegetarian, Gluten, MSG*, Mustard*, Soy, Wheat, Garlic, Vegan, Alcohol"
IV,Lunch,ASIAN KITCHEN,Eggs,,2 ounce,Liquid Egg,80,7,0,0,5,2,210,0,80,80,30,1,0,45,0,50,0.0,0,"Egg, Vegetarian, Avoiding Gluten, Good Source of Protein"
IV,Lunch,ASIAN KITCHEN,Eggs Your Way,,1 each,Egg,60,6,0,0,4,1.5,165,0,60,60,20,0.8,0,35,0,40,0.0,0,"Egg, Vegetarian, Avoiding Gluten"
IV,Lunch,ASIAN KITCHEN,Egg Whites,two egg whites made-to-order,2 ounce,Liquid Egg White,30,6,0,0,0,0,0,0,95,90,0,0,0.0,0,0,0,0.0,0,"Egg, Vegetarian, Avoiding Gluten"
IV,Lunch,ASIAN KITCHEN,Chopped Green Bell Pepper,,1 ounce,Green Bell Peppers,5,0,1,0.0,0,0,0,0,0,50,0,0.1,0,0,23,0,0.0,0,"Vegetarian, Avoiding Gluten, Vegan"
IV,Lunch,ASIAN KITCHEN, Diced Onions,,1 ounce,Onions,10,0,3,1,0,0,0,0,0,40,10,0.1,0,0,2,0,0.0,0,"Vegetarian, Avoiding Gluten, Onion, Vegan"
IV,Lunch,ASIAN KITCHEN,Diced Tomatoes,,1 ounce,Tomatoes,5,0,1,0.0,0,0,0,0,0,70,0,0.1,0,0,4,0,0.0,0,"Vegetarian, Avoiding Gluten, Tomato, Vegan"
IV,Lunch,ASIAN KITCHEN,Sliced Mushrooms,,1 ounce,Mushrooms,5,0.0,0.0,0.0,0,0,0,0,0,90,0,0.1,0,0,1,0,0.0,0,"Vegetarian, Avoiding Gluten, Vegan, How Good Friendly, Mushroom"
IV,Lunch,ASIAN KITCHEN,Baby Spinach,,4 ounce,Spinach,25,3,4,0,0,0,0,2,90,630,110,3.1,0,0,32,0,0.0,0,"Vegetarian, Avoiding Gluten, Vegan, How Good Friendly"
IV,Lunch,ASIAN KITCHEN,Sliced Tofu,,1 ounce,Tofu,20,2,0.0,0,1.5,0,0,0,0,30,100,1.5,0,0,0,10,0.0,0,"Vegetarian, Avoiding Gluten, Soy, Vegan"
IV,Lunch,ASIAN KITCHEN,Shredded Cheddar Cheese,,1 ounce,Cheddar Cheese,110,6,0.0,0,9,5,30,0,190,20,200,0,0.0,5,0,80,0.0,5,"Vegetarian, Avoiding Gluten, Milk"
IV,Lunch,ASIAN KITCHEN,Diced Bacon,,4 ounce,Bacon,530,38,2,0,40,14,110,0,1910,570,10,1.1,0,20,0,360,0.0,15,"Good Source of Protein, Pork, Gluten*"
IV,Lunch,ASIAN KITCHEN,Diced Ham,,1 ounce,Ham,35,4,2,0.0,1,0,15,0,360,200,0,0.2,0,170,0,10,0,0,"Pork, Gluten*"
IV,Lunch,ASIAN KITCHEN,Pork Sausage Patty,,1 ounce,Pork Sausage,80,4,0,0,7,2.5,20,0,170,80,10,0.3,0,0.0,0,70,0.0,0,"Avoiding Gluten, Celery*, Mustard*, Pork, MSG"
IV,Lunch,UNITED KITCHEN,Popcorn Chicken,"Crispy, golden, breaded fried popcorn chicken",4 ounce,Breaded Chicken,330,16,19,0,21,3.5,40,1,910,240,20,1,0,0,0,190,0,5,"Good Source of Protein, Celery*, Gluten, Mustard*, Wheat, Garlic, Poultry"
IV,Lunch,UNITED KITCHEN,Garlic Mashed Potatoes,Garlic Mashed Potatoes,1/2 cup,"Potatoes, Water, Fat Free Milk, Garlic, Salt",90,2,19,2,0,0,0,2,290,330,30,0.3,0.0,10,7,0,0,0,"Vegetarian, Avoiding Gluten, Milk, Garlic, How Good Friendly"
IV,Lunch,UNITED KITCHEN,Chicken Gravy,,2 floz,"Water, Unsalted Butter, All Purpose Flour, Chicken Base, Brown Sugar (sugar, cane syrups), Lime Juice, Salt, Cornstarch, Black Pepper",30,0,2,0.0,2.5,1.5,5,0,80,10,0,0.1,0.0,0,0,20,0,0,"Celery*, Gluten, Milk, Soy, Wheat, Poultry"
IV,Lunch,UNITED KITCHEN,Roasted Broccoli,Broccoli seasoned with sea salt and pepper,1/2 cup,"Broccoli, Canola Oil, Salt, Black Pepper",40,2,5,1,2,0,0,2,140,240,40,0.6,0,0,67,20,0.0,0,"Vegetarian, Avoiding Gluten, Vegan, How Good Friendly"
IV,Lunch,UNITED KITCHEN,Vinegar Slaw,,1/2 cup,"Cabbage, Apple Cider Vinegar, Sugar, Carrots, Extra Virgin Olive Oil, Garlic, Black Pepper",100,1,20,16,2.5,0,0,3,25,220,50,0.6,0.0,0,37,25,0.0,0,"Vegetarian, Avoiding Gluten, Garlic, Vegan"
IV,Lunch,UNITED KITCHEN,Greek Pasta Salad,"Tomatoes, olive, cucumbers and pasta tossed in Greek dressing",1 cup,"Water, Tomatoes, Elbow Macaroni, Greek Dressing, Leaf Lettuce, Cucumber, Feta Cheese, Green Bell Peppers, Kalamata Olives, Salt, Black Pepper",210,6,25,3,9,2.5,10,2,470,230,70,1.3,0.0,0,14,90,0,5,"Vegetarian, Celery*, Gluten, Milk, Wheat, Garlic, Tomato, Mustard"
IV,Lunch,UNITED KITCHEN,Dinner Roll,,1 each,Dinner Roll,150,4,29,0,2,0,0,1,380,50,10,1.9,0,0,0,15,0,0,"Vegetarian, Gluten, Wheat, Tree Nuts*, Soy*, Milk*"
IV,Lunch,FUSION GRILL,Hamburger Bun,,1 each,Whole Wheat Hamburger Bun,190,7,34,3,3,1,0,3,380,170,60,1.8,0,0,0.0,25,0.0,0,"Vegetarian, Good Source of Protein, Gluten, Wheat, Egg*, Soy*, Sesame*, Milk*"
IV,Lunch,FUSION GRILL,Beef Patty,,1 each,Beef,230,22,0,0,15,6,75,0,65,260,20,2.1,0.5,0,0,140,0.0,5,"Avoiding Gluten, Good Source of Protein, Beef"
IV,Lunch,FUSION GRILL,Beef Hot Dog,An American classic,1 each,"Beef Hot Dog, Hot Dog Bun",280,10,21,3,18,7,35,0.0,640,170,40,2,0.0,20,0.0,160,0.0,5,"Good Source of Protein, Gluten, Wheat, Beef, Soy*"
IV,Lunch,FUSION GRILL,Grilled Chicken,"Boneless chicken breast, grilled to perfection.",4 ounce,"Chicken, Canola Oil",140,23,0,0,5,1,80,0,140,260,0,0.4,0,0,0,45,0.0,0,"Avoiding Gluten, Good Source of Protein, Poultry"
IV,Lunch,FUSION GRILL,"Bacon, Egg, Cheese, Waffle Sandwich","Grilled waffle sandwich with bacon, egg and pepper jack",1 sandwich,"Waffles, Egg, Bacon, Pepper Jack Cheese",370,18,31,4,19,8,190,1,680,160,440,4.6,0.0,45,0,170,200,10,"Egg, Good Source of Protein, Gluten, Milk, Soy, Wheat, Pork"
IV,Lunch,FUSION GRILL,Meatless Garden Burger,,1 each,Vegan Garden Burger,100,10,15,0.0,1.5,0,0,6,570,260,60,1.7,0,0,0,15,0,0,"Vegetarian, Good Source of Protein, Gluten, Onion, Soy, Wheat, Garlic, Vegan, Mushroom, Tree Nuts, Alcohol, Mustard"
IV,Lunch,FUSION GRILL,"3/8"" French Fries, Fried",,3 ounce,French Fries,150,1,18,0.0,9,1,0,1,20,270,10,0.3,0,0,0,80,0.0,0,"Vegetarian, Vegan"
IV,Lunch,FUSION GRILL,Sliced American Cheese,,1 ounce,American Cheese,100,5,1,0.0,9,5,30,0,470,40,300,0.2,0,90,0,80,0.0,5,"Avoiding Gluten, Milk, Beef*, Pork*"
IV,Lunch,FUSION GRILL,Sliced Cheddar Cheese,,1 ounce,Cheddar Cheese,110,6,0.0,0,9,5,30,0,190,20,200,0,0.0,5,0,80,0.0,5,"Vegetarian, Avoiding Gluten, Milk"
IV,Lunch,FUSION GRILL,Sliced Provolone Cheese,,1 ounce,Provolone Cheese,100,7,0.0,0,8,5,20,0,210,40,210,0.1,0.0,5,0,70,0.0,5,"Vegetarian, Avoiding Gluten, Good Source of Protein, Milk"
IV,Lunch,FUSION GRILL,Sliced Swiss Cheese,,1 ounce,Swiss Cheese,110,8,0,0,9,5,25,0,55,20,250,0,0,0,0,80,0.0,5,"Vegetarian, Avoiding Gluten, Good Source of Protein, Milk"
IV,Lunch,FUSION GRILL,Lettuce Leaf,,1 each,Lettuce Leaf,0,0,0,0,0,0,0,0,0,10,0,0.1,0,0,1,0,0.0,0,"Vegetarian, Avoiding Gluten, Vegan"
IV,Lunch,FUSION GRILL,Sliced Tomatoes,,1 slice,Tomatoes,0,0,0.0,0,0,0,0,0,0,30,0,0,0,0,2,0,0.0,0,"Vegetarian, Avoiding Gluten, Tomato, Vegan"
IV,Lunch,FUSION GRILL,Julienne Yellow Onions,,1/4 cup,Onions,10,0,3,1,0,0,0,0,0,40,10,0.1,0,0,2,0,0.0,0,"Vegetarian, Avoiding Gluten, Onion, Vegan"
IV,Lunch,FUSION GRILL,Dill Pickle Spears,,1 each,Pickles,0,0,0.0,0,0,0,0,0,240,40,20,0.1,0,0,1,0,0.0,0,"Avoiding Gluten, Beef*, Pork*"
IV,Lunch,FUSION GRILL,Banana Pepper Rings,,1 tbsp,Banana Peppers,0,0,0,0,0,0,0,0,30,0.0,0,0,0,0.0,0,0,0,0,"Vegetarian, Avoiding Gluten, Sulphites, Vegan"
IV,Lunch,FUSION GRILL,Sriracha Ketchup,Spicy and smoky,1 floz,"Ketchup, Hot Chili Sauce",20,0,5,4,0,0,0,0,580,20,0,0.1,0.0,0,11,0,0.0,0,"Vegetarian, Mustard*, Onion, Garlic, Sulphites, Tomato, Vegan, Gluten*"
IV,Lunch,FUSION GRILL,Loaded Potato Salad,"Potato salad fill with green onion, cheese, bacon and yogurt mayo dressing",3/4 cup,"Red Bliss Potatoes, Mayonnaise, Plain Fat Free Greek Yogurt, Cheddar Cheese, Bacon, Green Onions, Canola Oil, Kosher Salt, Black Pepper, Cooking Spray^",280,6,23,2,19,4,20,2,370,640,90,0.9,0.0,5,14,170,0,5,"Egg, Milk, Onion, Pork, Gluten*, Mustard"
IV,Lunch,FUSION GRILL,Burger Sauce,,1 floz,"Mayonnaise, Ketchup, Barbecue Sauce, Dijon Mustard, Pickle Relish, Worcestershire Sauce with Anchovies, Garlic, Onion",130,0,4,2,13,1.5,10,0,270,20,10,0.1,0.0,0,0,120,0,0,"Egg, Onion, Soy, Garlic, Tomato, Celery, Gluten*, Alcohol, Mustard, Fish"
IV,Lunch,GLOBAL BOWLS,Chopped Romaine Lettuce,,2 ounce,Chopped Lettuce,10,0.0,2,0.0,0,0,0,1,0,140,20,0.5,0,0,2,0,0.0,0,"Vegetarian, Avoiding Gluten, Vegan"
IV,Lunch,GLOBAL BOWLS,Spring Mix,,2 ounce,Spring Lettuce Salad Mix,5,0.0,1,0.0,0,0,0,0.0,0,130,20,0.7,0,0,2,0,0.0,0,"Vegetarian, Avoiding Gluten, Vegan"
IV,Lunch,GLOBAL BOWLS,Baby Spinach,,1 ounce,Spinach,5,0.0,1,0,0,0,0,0.0,20,160,30,0.8,0,0,8,0,0.0,0,"Vegetarian, Avoiding Gluten, Vegan, How Good Friendly"
IV,Lunch,GLOBAL BOWLS,Diced Tomatoes,,1 ounce,Tomatoes,5,0,1,0.0,0,0,0,0,0,70,0,0.1,0,0,4,0,0.0,0,"Vegetarian, Avoiding Gluten, Tomato, Vegan"
IV,Lunch,GLOBAL BOWLS,Sliced Cucumber,,1 ounce,Cucumber,0,0,1,0,0,0,0,0,0,40,0,0.1,0,0,1,0,0.0,0,"Vegetarian, Avoiding Gluten, Vegan, How Good Friendly"
IV,Lunch,GLOBAL BOWLS,Grated Carrots,,1 ounce,Carrots,10,0,3,1,0,0,0,0.0,20,90,10,0.1,0,0,2,0,0.0,0,"Vegetarian, Avoiding Gluten, Vegan"
IV,Lunch,GLOBAL BOWLS,Sliced Green Bell Pepper,,1 ounce,Green Bell Peppers,5,0,1,0.0,0,0,0,0,0,50,0,0.1,0,0,23,0,0.0,0,"Vegetarian, Avoiding Gluten, Vegan"
IV,Lunch,GLOBAL BOWLS,Sliced Red Onion,,1/4 ounce,Onions,0,0,0.0,0,0,0,0,0,0,10,0,0,0,0,1,0,0.0,0,"Vegetarian, Avoiding Gluten, Onion, Vegan"
IV,Lunch,GLOBAL BOWLS,Broccoli Florets,,1 ounce,Broccoli,10,0.0,2,0,0,0,0,0.0,10,90,10,0.2,0,0,25,0,0.0,0,"Vegetarian, Avoiding Gluten, Vegan"
IV,Lunch,GLOBAL BOWLS,Red Potato Salad,Classic Creamy Potato Salad with Delicious Red Bliss Potatoes,1/2 cup,"Red Bliss Potatoes, Mayonnaise, Onions, Pickle Relish, Celery, Yellow Mustard, Salt, Black Pepper",170,2,21,2,9,1.5,0.0,2,260,510,20,0.8,0,0,12,80,0,0,"Egg, Vegetarian, Onion, Garlic, How Good Friendly, Celery, Gluten*, Mustard"
IV,Lunch,GLOBAL BOWLS,Greek Pasta Salad,"Tomatoes, olive, cucumbers and pasta tossed in Greek dressing",1 cup,"Water, Tomatoes, Elbow Macaroni, Greek Dressing, Leaf Lettuce, Cucumber, Feta Cheese, Green Bell Peppers, Kalamata Olives, Salt, Black Pepper",210,6,25,3,9,2.5,10,2,470,230,70,1.3,0.0,0,14,90,0,5,"Vegetarian, Celery*, Gluten, Milk, Wheat, Garlic, Tomato, Mustard"
IV,Lunch,GLOBAL BOWLS,Black Bean and Corn Salad,Spicy Classical Black Bean Salad ,1/2 cup,"Black beans (Black beans, water, salt, calcium chloride), Corn, Onions, Lime, Jalapeno, Olive Oil, Cilantro, Garlic, Cumin",100,5,18,2,2,0,0,5,75,300,30,1.5,0.0,0,9,20,0.0,0,"Vegetarian, Avoiding Gluten, Onion, Garlic, Vegan"
IV,Lunch,GLOBAL BOWLS,Cooked Quinoa,,1/4 cup,"Water, Quinoa",60,2,10,0,1,0,0,1,0,90,10,0.7,0.0,0,0,10,0,0,"Vegetarian, Avoiding Gluten, Vegan"
IV,Lunch,GLOBAL BOWLS,Kalamata Olives,,1 ounce,Kalamata Olives,40,0,1,0,4.5,0.5,0,0.0,440,10,10,0.1,0,0,0,40,0.0,0,"Vegetarian, Avoiding Gluten, Vegan"
IV,Lunch,GLOBAL BOWLS,Chick Peas,,1 ounce,"Chick peas (Chick Peas, Water, Salt, Mustard, Calcium Chloride, Disodium EDTA)",45,3,8,1,0.5,0,0,2,70,80,10,0.8,0,0,0,5,0.0,0,"Vegetarian, Avoiding Gluten, Vegan, How Good Friendly"
IV,Lunch,GLOBAL BOWLS,Fresh Chopped Celery,,1 ounce,Celery,0,0,0.0,0,0,0,0,0,25,70,10,0.1,0,0,1,0,0.0,0,"Vegetarian, Avoiding Gluten, Vegan, Celery"
IV,Lunch,GLOBAL BOWLS,Dark Red Kidney Beans,,1 ounce,Kidney Beans,25,1,4,0.0,0,0,0,2,35,70,10,0.4,0,0,0,0,0.0,0,"Vegetarian, Avoiding Gluten, Vegan"
IV,Lunch,GLOBAL BOWLS,Shredded Cheddar Cheese,,1 ounce,Cheddar Cheese,110,6,0.0,0,9,5,30,0,190,20,200,0,0.0,5,0,80,0.0,5,"Vegetarian, Avoiding Gluten, Milk"
IV,Lunch,GLOBAL BOWLS,Seasoned Grilled Chicken,A simple preparation for chicken,3 ounce,"Chicken, Canola Oil, Salt, Black Pepper",110,16,0,0,5,0.5,50,0,260,250,0,0.4,0,0,0,45,5,0,"Avoiding Gluten, Good Source of Protein, Poultry"
IV,Lunch,GLOBAL BOWLS,Shredded Parmesan Cheese,,1 ounce,Parmesan Cheese,120,11,0.0,0,8,5,20,0,480,30,360,0.2,0.0,5,0,70,0.0,5,"Vegetarian, Avoiding Gluten, Good Source of Protein, Milk"
IV,Lunch,GLOBAL BOWLS,Cubed Tofu,,1 ounce,Tofu,20,2,0.0,0,1.5,0,0,0,0,30,100,1.5,0,0,0,10,0.0,0,"Vegetarian, Avoiding Gluten, Soy, Vegan"
IV,Lunch,GLOBAL BOWLS,Crumbled Feta Cheese,,1 ounce,Feta Cheese,80,4,1,0,6,4,25,0,320,20,140,0.2,0.0,5,0,50,0.0,5,"Vegetarian, Avoiding Gluten, Milk"
IV,Lunch,GLOBAL BOWLS,Hard Boiled Egg,,1 each,Egg,70,6,0,0,4.5,1.5,165,0,55,60,20,0.5,0.0,40,0,40,0.0,0,"Egg, Vegetarian, Avoiding Gluten"
IV,Lunch,GLOBAL BOWLS,Italian Dressing,,1 floz,Italian Dressing,110,0,2,2,12,2,0,0,270,0,0,0,0,0.0,0.0,110,0.0,0,"Vegetarian, Avoiding Gluten, Celery*, Mustard*, Onion, Garlic, Vegan"
IV,Lunch,GLOBAL BOWLS,Ranch Dressing,,1 floz,Ranch Dressing,140,0,1,1,15,2,10,0,190,0,0,0,0,0,0.0,130,0.0,0,"Egg, Vegetarian, Avoiding Gluten, Celery*, Milk, Mustard*, Onion, Garlic"
IV,Lunch,GLOBAL BOWLS,Blue Cheese Dressing,,1 floz,Blue Cheese Dressing,140,1,1,1,15,2.5,10,0,230,0,0,0,0,0.0,0.0,140,0.0,5,"Egg, Vegetarian, Avoiding Gluten, Milk, Garlic, MSG"
IV,Lunch,GLOBAL BOWLS,Balsamic Vinaigrette Dressing,,1 floz,Balsamic Vinaigrette,60,0,5,4,4.5,0,0,0,190,0,0.0,0,0,0,0.0,45,0.0,0,"Vegetarian, Avoiding Gluten, Celery*, Mustard*, Garlic, Vegan"
IV,Lunch,GLOBAL BOWLS,Creamy Caesar Dressing,,1 floz,Caesar Dressing,150,1,1,0,16,2.5,0,0,280,0,0,0,0,0.0,0.0,150,0.0,5,"Avoiding Gluten, Celery*, Milk, Garlic, Mustard, Fish"
IV,Lunch,GLOBAL BOWLS,Greek Dressing,,1 floz,Greek Dressing,100,0,0.0,0,11,1.5,0,0,280,10,10,0.1,0,0,0,100,0,0,"Vegetarian, Avoiding Gluten, Milk, Onion, Garlic, Celery, Mustard"
IV,Lunch,GLOBAL BOWLS,Extra Virgin Olive Oil,,1 floz,Olive Oil,240,0,0,0,27,3.5,0,0,0,0,0,0.2,0.0,0,0,240,0.0,5,"Vegetarian, Avoiding Gluten, Vegan"
IV,Lunch,GLOBAL BOWLS,Balsamic Vinegar,,1 floz,Balsamic Vinegar,25,0,5,4,0,0,0,0,5,30,10,0.2,0,0,0,0,0,0,"Vegetarian, Avoiding Gluten, Sulphites, Vegan"
IV,Lunch,GLOBAL BOWLS,Croutons,Croutons to add to a salad,1 ounce,"French Baguette, Garlic, Salt, Canola Oil",80,2,16,0,0,0,0,0.0,360,30,10,1.1,0,0,0,0,0,0,"Vegetarian, Gluten, Wheat, Garlic, Tree Nuts*, Soy*, Milk*"
IV,Lunch,GLOBAL BOWLS,Roasted Sunflower Seeds,,1 ounce,Sunflower Seeds,160,5,7,0.0,14,1.5,0,3,0,240,20,1.1,0.0,0,0,130,0.0,0,"Vegetarian, Avoiding Gluten, Vegan"
IV,Lunch,GLOBAL BOWLS,Golden Raisins,,1 ounce,Raisins,90,0.0,23,19,0,0,0,0.0,5,210,20,0.3,0,0,1,0,0.0,0,"Vegetarian, Sulphites, Vegan"
IV,Lunch,GLOBAL BOWLS,Dried Cranberries,,1 ounce,Cranberries,90,0,23,21,0,0,0,2,0,10,0,0.1,0,0,0,0,0.0,0,"Vegetarian, Avoiding Gluten, Vegan"
IV,Dinner,LATIN KITCHEN,"6"" Flour Tortilla",,1 each,Flour Tortilla,90,2,14,0,2.5,1,0,1,170,20,40,1,0,0,0.0,25,0.0,0,"Vegetarian, Gluten, Wheat, Vegan, How Good Friendly"
IV,Dinner,LATIN KITCHEN,Beef Taco Meat,"Latin seasoned ground beef, accented with chipotle peppers, lime and cilantro will add flavor to your palate!",4 ounce,"Beef, Tomato puree (tomato puree, water, tomato paste, citric acid), Green Bell Peppers, Onions, Canola Oil, Lime, Chili Powder (Chili Pepper, Salt, Cumin, Oregano, Silicon Dioxide, Garlic), Garlic, Cumin, Garlic, Onion, Black Pepper, Cilantro, Chipotle Chile Pepper (Chipotle Chili Pepper and Silicon Dioxide)",230,18,11,5,13,4.5,55,3,100,620,50,3.8,0.0,0,20,120,0.0,5,"Avoiding Gluten, Good Source of Protein, Onion, Garlic, Tomato, Beef"
IV,Dinner,LATIN KITCHEN,"Salsa Verde, Chickpea Taco",,1 each,"Low Sodium Chick Peas, Water, Red Onions, Flour Tortilla, Apple Cider Vinegar, Tomatillo, Red Onions, Canola Oil, Garlic, Kosher Salt, Sugar, Yellow Onions, Lime, Mustard, Lime Juice, Jalapeno, Cilantro, Garlic, Garlic, Red Pepper, Lemon, Sugar, Dill Weed, Cumin",380,14,56,9,11,2,0,12,1130,520,120,5,0.0,0,9,100,0,0,"Good Source of Protein, Gluten, Onion, Wheat, Garlic, Mustard"
IV,Dinner,LATIN KITCHEN,Garlic Rice,Garlic Rice,1 cup,"Waters, Long Grain White Rice, Garlic, Canola Oil, Salt",270,5,54,0,3.5,0,0,0.0,720,80,20,2.3,0.0,0,1,30,0,0,"Vegetarian, Avoiding Gluten, Garlic, Vegan"
IV,Dinner,LATIN KITCHEN,"Onions, peppers, and tomatoes","Onions, peppers and tomatoes fajita style",3 ounce,"Onions, Green Bell Peppers, Red Bell Peppers, Garlic, Cumin, Canola Oil, Cilantro, Coriander, Black Pepper, Salt, Cayenne Pepper",50,2,9,4,1.5,0,0,2,150,240,50,1.7,0.0,0,56,15,0.0,0,"Vegetarian, Avoiding Gluten, Onion, Garlic, Vegan, How Good Friendly"
IV,Dinner,LATIN KITCHEN,Shredded Iceberg Lettuce,,1 cup,Lettuce,10,0.0,2,1,0,0,0,0.0,5,100,10,0.3,0,0,2,0,0.0,0,"Vegetarian, Avoiding Gluten, Vegan"
IV,Dinner,LATIN KITCHEN,Diced Tomatoes,,1/4 cup,Tomatoes,10,0,2,1,0,0,0,0.0,0,110,0,0.1,0,0,6,0,0.0,0,"Vegetarian, Avoiding Gluten, Tomato, Vegan"
IV,Dinner,LATIN KITCHEN, Diced Onions,,1/4 cup,Onions,15,0,4,2,0,0,0,0.0,0,60,10,0.1,0,0,3,0,0.0,0,"Vegetarian, Avoiding Gluten, Onion, Vegan"
IV,Dinner,LATIN KITCHEN,Fresh Cilantro,,1 tbsp,Cilantro,0,0,0,0,0,0,0,0,0,10,0,0,0,0,0,0,0.0,0,"Vegetarian, Avoiding Gluten, Vegan"
IV,Dinner,LATIN KITCHEN,Shredded Cheddar Cheese,,1 tbsp,Cheddar Cheese,30,2,0,0,2.5,1.5,5,0,45,10,50,0,0.0,0,0,20,0.0,0,"Vegetarian, Avoiding Gluten, Milk"
IV,Dinner,LATIN KITCHEN,Crumbled Queso Fresco Cheese,,1 tbsp,Queso Fresco Mexican Cheese,25,2,0,0,2,1.5,5,0,80,10,50,0,0.0,0,0,20,0.0,0,"Vegetarian, Avoiding Gluten, Milk"
IV,Dinner,LATIN KITCHEN,Sliced Jalapeno Pepper,,1 tbsp,Jalapeno,0,0,0,0,0,0,0,0,0,10,0,0,0,0,7,0,0.0,0,"Vegetarian, Avoiding Gluten, Vegan"
IV,Dinner,LATIN KITCHEN,Crispy Tortilla Chips,Crispy Freshly Fried Corn Tortillas,3 oz portion,"Corn Tortilla (Corn, Water, Preservatives, Xanthan Gum, Lime), Salt",190,5,38,0.0,3,0,0,5,125,160,70,1,0.0,0,0,25,0.0,0,
IV,Dinner,LATIN KITCHEN,Pico de Gallo,"fresh tomatoes, jalapenos, onions, lime and cilantro",1/4 cup,"Tomatoes, Jalapeno, Onions, Lime, Cilantro, Salt",15,0.0,3,2,0,0,0,0.0,200,140,10,0.2,0,0,16,0,0.0,0,"Vegetarian, Avoiding Gluten, Onion, Tomato, Vegan"
IV,Dinner,LATIN KITCHEN,Corn Salsa,"corn, onions, tomatoes, jalapenos, lime, cilantro",1/4 cup,"Corn, Onions, Tomatoes, Jalapeno, Lime Juice, Cilantro, Salt",35,1,8,2,0,0,0,1,120,120,10,0.2,0,0,9,0,0.0,0,"Vegetarian, Avoiding Gluten, Onion, Tomato, Vegan"
IV,Dinner,LATIN KITCHEN,Roasted Salsa Verde,Smoky Grilled  Roasted Salsa,1 oz portion,"Tomatillo, Onions, Lime Juice, Jalapeno, Cilantro, Garlic, Salt, Sugar",5,0,1,0.0,0,0,0,0,90,40,0,0.1,0.0,0,3,0,0.0,0,"Vegetarian, Avoiding Gluten, Onion, Garlic, Vegan"
IV,Dinner,DELICIOUS WITHOUT,Gyro Pit Grilled Chicken,Lemon oregano grilled chicken,4 oz meat,"Chicken, Lemon Juice, Canola Oil, Garlic, Salt, Granulated Onion, Lemon, Oregano, Black Pepper",210,27,1,0,11,2.5,145,0,460,300,10,1.3,0,10,2,90,0.0,5,"Avoiding Gluten, Good Source of Protein, Onion, Garlic, Poultry"
IV,Dinner,DELICIOUS WITHOUT,Basmati Rice,Nutty and fragrant,1/2 cup,"Water, Basmati Rice, Salt",110,2,24,0,0,0,0,0,95,30,10,1.3,0.0,0,0,0,0,0,"Vegetarian, Avoiding Gluten, Vegan"
IV,Dinner,DELICIOUS WITHOUT,Broccoli Florets,,1/2 cup,"Broccoli, Butter, Lemon",50,2,6,1,2.5,1.5,5,3,55,250,40,0.6,0,0,56,25,0.0,0,"Vegetarian, Avoiding Gluten, Milk"
IV,Dinner,DELICIOUS WITHOUT,Lemon Dill Coleslaw,Coleslaw with a light lemon-dill vinaigrette,1/2 cup,"Cabbage, Radish, Canola Oil, Lemon Juice, Salt, Black Pepper, Dill",50,0.0,3,2,4.5,0,0,1,230,100,20,0.3,0,0,19,40,0.0,0,"Vegetarian, Avoiding Gluten, Vegan"
IV,Dinner,DELICIOUS WITHOUT,Tomato Cucumber Salad,Refreshing classic tomato cucumber salad with lemon and parsley,1/2 cup,"Cucumber, Tomatoes, Lemon Juice, Extra Virgin Olive Oil, Parsley, Yellow Onions, Kosher Salt",45,0.0,3,2,3.5,0,0,0.0,90,160,10,0.4,0.0,0,11,30,0.0,0,"Vegetarian, Avoiding Gluten, Onion, Tomato, Vegan, How Good Friendly"
IV,Dinner,DELICIOUS WITHOUT,Honeydew and Grape Salad,Tangy and sweet,1/2 cup,"Honeydew Melon, Grapes, Celery, Canola Oil, Lime, Honey, Salt, Black Pepper",80,0.0,12,11,4,0,0,0.0,75,210,10,0.2,0.0,0,14,40,0.0,0,"Vegetarian, Avoiding Gluten, How Good Friendly, Celery"
IV,Dinner,DELICIOUS WITHOUT,Quinoa and ChickpeaTabouleh,"quinoa, chickpea, cucumbers, tomatoes, parsley, mint and scallions",1/2 cup,"Water, Chick peas (Chick Peas, Water, Salt, Mustard, Calcium Chloride, Disodium EDTA), Tomatoes, Red Quinoa, Cucumber, Parsley, Canola Oil, Green Onions, Lemon Juice, Mint, Salt, Black Pepper",130,4,15,1,7,0.5,0,3,95,220,30,1.7,0.0,0,12,60,0,0,"Vegetarian, Avoiding Gluten, Onion, Tomato, Vegan, How Good Friendly"
IV,Dinner,POMODORO KITCHEN,Cheese Pizza,Traditional pizza with just pizza sauce and mozzarella cheese,1 slice,"Pizza Dough, Part Skim Mozzarella Cheese, Crushed tomatoes (unpeeled tomatoes, tomato puree, salt, citric acid), Chopped whole peeled tomatoes (tomatoes, tomato juice, salt, calcium chloride, citric acid), Canola Oil, Parmesan Cheese, Salt, Garlic, Garlic, Basil, Black Pepper, Basil, Parsley, Oregano, Red Pepper",190,8,28,2,5,2,10,1,440,110,110,1.9,0.0,0,1,50,0,0,"Vegetarian, Good Source of Protein, Gluten, Milk, Wheat, Garlic, Sulphites, Tomato, Egg*, Soy*"
IV,Dinner,POMODORO KITCHEN,Hot Honey Pepperoni Pizza,,1 slice,"Pizza Dough, Part Skim Mozzarella Cheese, Hot Honey, Crushed tomatoes (unpeeled tomatoes, tomato puree, salt, citric acid), Chopped whole peeled tomatoes (tomatoes, tomato juice, salt, calcium chloride, citric acid), Pepperoni-, Canola Oil, Parmesan Cheese, Salt, Garlic, Garlic, Basil, Black Pepper, Basil, Parsley, Oregano, Red Pepper",260,10,39,7,6,2.5,10,1,550,130,120,2.3,0.0,25,1,60,0,5,"Good Source of Protein, Gluten, Milk, Mustard*, Wheat, Garlic, Tomato, Beef, Pork, Egg*, Soy*, Sesame*"
IV,Dinner,POMODORO KITCHEN,Buffalo Alfredo Chicken Pizza,,1 slice,"Pizza Dough, Crispy Chicken Tenders, Alfredo Sauce, Hot Sauce, Green Onions, Canola Oil, Parmesan Cheese, Garlic, Kosher Salt, Garlic, Basil, Parsley, Oregano, Red Pepper, Black Pepper",210,8,30,2,7,1.5,10,1,670,120,30,2,0.0,0,0,60,5,0,"Good Source of Protein, Gluten, Milk, Onion, Soy, Wheat, Garlic, Sulphites, Celery, Poultry, Egg*"
IV,Dinner,POMODORO KITCHEN,Butternut Squash and Onion Pizza,"Seasonal vegan pizza with squash, caramelized onions, and spinach",1 slice,"Pizza Dough, Butternut Squash, Spinach, Onions, Canola Oil, Onions, Nutritional Yeast, Panko Bread Crumbs, Salt, Fresh Ground Black Pepper, Black Pepper",290,9,49,4,7,1,0,3,560,390,60,3.7,0,0,16,60,0,0,"Vegetarian, Good Source of Protein, Gluten, Onion, Wheat, Sulphites, Egg*, Soy*, Milk*"
IV,Dinner,POMODORO KITCHEN,Summer Gnocchi,"Fluffy potato dumplings sauteed with sweet corn, basila dn cherry tomatoes.",6 ounce,"Water, Gnocchi, Corn, Tomatoes, Onions, Olive Oil, Lemon Juice, Basil, Salt, Black Pepper",210,5,42,2,3,0,0,3,440,420,20,0.9,0.0,0,4,25,0,0,"Vegetarian, Gluten, Onion, Wheat, Tomato, Vegan, Egg*, Milk*"
IV,Dinner,POMODORO KITCHEN,Garlic Breadstick ,"Garlic Breadstick, Butter, and Parsley ",1 each,"French Breadsticks Dough, Butter, Parsley, Garlic",80,2,12,0.0,3,1.5,5,0,140,30,10,0.8,0,10,0,25,0,0,"Egg, Vegetarian, Gluten, Milk, Wheat, Garlic, How Good Friendly, Soy*"
IV,Dinner,POMODORO KITCHEN,Crushed Red Pepper,,1 tsp,Red Pepper,5,0,1,0,0,0,0,0,0,40,0,0.1,0.0,0,1,0,0.0,0,"Vegetarian, Avoiding Gluten, Vegan"
IV,Dinner,POMODORO KITCHEN,Dried Oregano,,1 tsp,Oregano,0,0,0,0.0,0,0,0,0,0,0,10,0.3,0,0,0,0,0.0,0,"Vegetarian, Avoiding Gluten, Vegan"
IV,Dinner,POMODORO KITCHEN,Grated Parmesan Cheese,,1 tbsp,Parmesan Cheese,25,2,0.0,0,1.5,1,5,0,115,10,50,0,0,0,0,15,0.0,0,"Vegetarian, Avoiding Gluten, Milk"
IV,Dinner,SPICE BOWL,Lavash Flatbread,,1 serving(s),Lavash,270,8,56,0.0,2,0,0,3,750,0.0,10,3.3,0,0.0,0,20,0,0,"Vegetarian, Good Source of Protein, Gluten, Wheat, Soy*, Sesame*, Milk*"
IV,Dinner,SPICE BOWL,Dal and Spinach Curry,Split baby garbanzo beans braised with spices and spinach and finished with coconut milk,1 cup,"Spinach, Tomatoes, Coconut Milk, Garbanzo Beans, Yellow Onions, Garlic, Canola Oil, Ginger Root, Mustard, Curry Powder, Coriander, Kosher Salt, Fennel Seed",380,16,44,10,17,10,0,14,250,950,220,7.5,0.0,0,19,160,0,10,"Vegetarian, Avoiding Gluten, Good Source of Protein, Onion, Garlic, Sulphites, Tomato, Vegan, Celery, Tree Nuts, Mustard"
IV,Dinner,SPICE BOWL,Tarka Dal,A tasty North Indian dish made with yellow lentils.,4 oz portion,Tarka Dal,110,6,15,3,4,0,0,6,660,130,30,1.5,0,0,4,35,0.0,0,"Vegetarian, Onion, Garlic, Tomato, Vegan"
IV,Dinner,SPICE BOWL,Basmati Rice,Nutty and fragrant,1/2 cup,"Water, Basmati Rice, Salt",110,2,24,0,0,0,0,0,95,30,10,1.3,0.0,0,0,0,0,0,"Vegetarian, Avoiding Gluten, Vegan"
IV,Dinner,SPICE BOWL,Middle Eastern Spiced Chickpea Salad,,1 cup,"Chickpeas (Chick Peas, Water, Salt, Mustard, Calcium Chloride, Disodium Edta), Tomatoes, Cucumber, Onions, Canola Oil, Olive Oil, Lemon Juice, Mint, Sherry Vinegar, Salt, Parsley, Cilantro, Ground Allspice, Cumin, Cardamom, Sugar, Lemon, Garlic, Black Pepper",230,7,21,5,14,1.5,0,6,750,310,70,2.4,0.0,0,7,130,0.0,0,"Vegetarian, Avoiding Gluten, Good Source of Protein, Onion, Garlic, Sulphites, Tomato, Vegan"
IV,Dinner,SPICE BOWL,Pickled Turnips and Beets,Crunchy Pickled Turnips and Beets,2 oz portion,"Turnip, Water, Red Wine Vinegar, Red Beets, Sea Salt, Garlic, Bay Leaf",10,0,2,1,0,0,0,0.0,980,70,10,0.1,0,0,4,0,0,0,"Vegetarian, Avoiding Gluten, Garlic, Sulphites, Vegan"
IV,Dinner,SPICE BOWL,Classic Hummus,Rich and creamy,3/4 cup,"Chick peas (Chick Peas, Water, Salt, Mustard, Calcium Chloride, Disodium EDTA), Water, Sesame Tahini Paste, Lemon Juice, Cumin, Garlic, Salt",360,17,49,8,13,1.5,0,14,570,560,160,6.8,0.0,0,4,110,0,0,"Vegetarian, Avoiding Gluten, Good Source of Protein, Garlic, Vegan, Sesame"
IV,Dinner,SPICE BOWL,Pickled Onion,,1 pint,"Water, Apple Cider Vinegar, Red Onions, Sugar, Kosher Salt, Mustard, Garlic, Dill Weed, Red Pepper",280,6,53,36,4.5,0,0,6,7010,590,140,2.7,0.0,0,20,40,0,0,"Avoiding Gluten, Onion, Garlic, Mustard"
IV,Dinner,SPICE BOWL,Lemon Wedge,,1 wedge,Lemon,0,0,0,0,0,0,0,0,0,10,0,0,0,0,3,0,0.0,0,"Vegetarian, Avoiding Gluten, Vegan"
