Location,Period,Kitchen,Dish_Name,Description,Portion_Size,Ingredients,Calories,Protein (g),Total Carbohydrates (g),Sugar (g),Total Fat (g),Saturated Fat (g),Cholesterol (mg),Dietary Fiber (g),Sodium (mg),Potassium (mg),Calcium (mg),Iron (mg),Trans Fat (g),Vitamin D (IU),Vitamin C (mg),Calories From Fat,Vitamin A (RE),Saturated Fat + Trans Fat (g),Allergens
Stetson_East,Breakfast,CUCINA,English Breakfast Baked Beans,Traditional tomato baked beans with maple and spices,1/2 cup,"Low Sodium Cannellini Beans^, Tomato Puree^, White Onions, Maple Syrup, Tomato Paste^, Canola Oil, Worcestershire Sauce with Anchovies^, Garlic, Kosher Salt^, Smoked Paprika^, Black Pepper, Thyme",180,8,29,7,4,0,0,6,370,560,70,2.3,0.0,0,5,35,0.0,0,"Avoiding Gluten, Good Source of Protein, Mustard*, Onion, Soy, Garlic, Tomato, Fish"
Stetson_East,Breakfast,CUCINA,Quinoa,,1/2 cup,"Quinoa, Water, Chicken Broth Concentrate^",130,4,22,1,2.5,0,0,3,340,170,20,1.5,0.0,0,0,20,0,0,Poultry
Stetson_East,Breakfast,CUCINA,Meatless Vegetarian Sausage Patty,,1 each,Meatless Sausage^,70,9,4,0.0,2.5,0,0,0.0,250,100,0,1.6,0,0,0,20,0,0,"Egg, Vegetarian, Good Source of Protein, Celery*, Gluten, Milk, MSG*, Mustard*, Onion, Soy, Wheat"
Stetson_East,Breakfast,CUCINA,Blistered Grape Tomatoes,Blistered Grape Tomatoes with Parsley and Thyme,1 ounce,"Tomatoes, Canola Oil, Kosher Salt^, Fresh Ground Black Pepper, Parsley, Thyme",30,0,1,0.0,2.5,0,0,0,110,70,0,0.1,0,0,4,25,0.0,0,"Vegetarian, Avoiding Gluten, Tomato, Vegan"
Stetson_East,Breakfast,CUCINA,"Ham, Egg, Cheese Breakfast Pizza","Peppers, Bacon, Eggs, Ham and Cheese Pizza",1 slice,"Pizza Dough^, Part Skim Mozzarella Cheese^, Ham^, Liquid Egg^, Whole Milk^, Bacon^, Cheddar Cheese^, Green Bell Peppers, Mushrooms, Yellow Onions, American Cheese^, Butter^, Canola Oil, All Purpose Flour^, Kosher Salt^, White Pepper",330,19,35,3,13,6,85,1,790,220,240,2.6,0.0,50,2,110,0,5,"Egg, Good Source of Protein, Gluten, Milk, Onion, Wheat, Mushroom, Pork, Soy*, Sesame*, Beef*"
Stetson_East,Breakfast,CUCINA,Cheese Pizza,"Traditional pie topped with Italian tomato sauce, mozzarella, and parmesan cheese.",1 slice,"Pizza Dough^, Tomatoes^, Parmesan Cheese^, Part Skim Mozzarella Cheese^, Canola Oil, Kosher Salt^, Basil, Garlic, Black Pepper",200,10,19,2,10,4,20,0.0,650,150,230,1.4,0,15,2,90,0,5,"Vegetarian, Good Source of Protein, Gluten, Milk, Wheat, Garlic, Tomato, Egg*, Soy*, Sesame*"
Stetson_East,Breakfast,RICE STATION,White Rice,White Rice Cooked with Canola Oil and Salt,1/2 cup,"Water, Long Grain White Rice^, Canola Oil, Salt",120,2,23,0,1.5,0,0,0.0,30,50,20,0.9,0.0,0,0,15,0,0,"Vegetarian, Avoiding Gluten, Vegan, How Good Friendly"
Stetson_East,Breakfast,RICE STATION,Brown Rice,Lightly seasoned,1/2 cup,"Water, Brown Rice",110,2,23,0,1,0,0,1,0,70,0,0.4,0,0,0,10,0,0,"Vegetarian, Avoiding Gluten, Vegan"
Stetson_East,Breakfast,RICE STATION,Olive Oil,,1 floz,Olive Oil,240,0,0,0,27,3.5,0,0,0,0,0,0.2,0.0,0,0,240,0.0,5,"Vegetarian, Avoiding Gluten, Vegan"
Stetson_East,Breakfast,RICE STATION,Gluten Free Soy Sauce,,1 floz,Less Sodium Gluten Free Soy Sauce^,20,1,4,2,0,0,0,0,880,200,0,0,0,0,0.0,0,0.0,0,"Vegetarian, Avoiding Gluten, Soy, Vegan"
Stetson_East,Breakfast,RICE STATION,Seasoned Rice Vinegar,,1 floz,Seasoned Rice Vinegar^,0,0,0,0,0,0,0,0,0,0,0,0,0,0,0.0,0,0.0,0,"Vegetarian, Vegan"
Stetson_East,Breakfast,HOMESTYLE,Scrambled Eggs,,1/2 cup,"Liquid Egg^, Canola Oil",210,14,1,0,16,4,420,0,150,150,70,2,0,120,0,140,0.0,5,"Egg, Vegetarian, Avoiding Gluten, Good Source of Protein"
Stetson_East,Breakfast,HOMESTYLE,Bacon,Salty cured delicious pork back,3 slice,Bacon^,130,9,0,0,10,3.5,30,0,470,140,0,0.3,0,5,0,90,0.0,5,"Good Source of Protein, Pork, Gluten*"
Stetson_East,Breakfast,HOMESTYLE,Fried Hash Brown Patty,,1 each,Hash Brown Patties^,150,0.0,12,0.0,11,1,0,1,280,180,10,0.2,0,0,0,100,0.0,0,Onion
Stetson_East,Breakfast,HOMESTYLE,Buttermilk Pancakes,,2 each,"Water, Pancake Mix^, Cooking Spray^",170,4,33,6,2.5,1,5,1,520,90,70,1.8,0,0,0,20,0,0,"Egg, Vegetarian, Gluten, Milk, Soy, Wheat"
Stetson_East,Breakfast,MENUTAINMENT,Eggs Your Way,,1 each,Egg,60,6,0,0,4,1.5,165,0,60,60,20,0.8,0,35,0,40,0.0,0,"Egg, Vegetarian, Avoiding Gluten"
Stetson_East,Breakfast,MENUTAINMENT,Eggs,,1/4 cup,Liquid Egg^,90,7,0.0,0,6,2,225,0,80,80,40,1.1,0,60,0,50,0.0,0,"Egg, Vegetarian, Avoiding Gluten, Good Source of Protein"
Stetson_East,Breakfast,MENUTAINMENT,Egg Whites,two egg whites made-to-order,1/4 cup,Liquid Egg White^,30,7,0,0,0,0,0,0,100,100,0,0,0.0,0,0,0,0.0,0,"Egg, Vegetarian, Avoiding Gluten, Good Source of Protein"
Stetson_East,Breakfast,MENUTAINMENT,Diced Bacon,,1 ounce,Bacon^,130,10,0,0,10,3.5,30,0,480,140,0,0.3,0,5,0,90,0.0,5,"Good Source of Protein, Pork, Gluten*"
Stetson_East,Breakfast,MENUTAINMENT,Italian Sausage Crumbles,,1 ounce,Italian Sausage^,90,5,0.0,0,7,2.5,25,0,230,100,0,0.4,0,10,0,70,0.0,5,"Avoiding Gluten, Celery*, Mustard*, Soy, Pork"
Stetson_East,Breakfast,MENUTAINMENT,Diced Ham,,1 ounce,Ham^,35,4,2,0.0,1,0,15,0,360,200,0,0.2,0,170,0,10,0,0,"Pork, Gluten*"
Stetson_East,Breakfast,MENUTAINMENT,Shredded Sharp American Cheese,,1 ounce,American Cheese^,100,5,1,0.0,9,5,30,0,470,40,300,0.2,0,90,0,80,0.0,5,"Avoiding Gluten, Milk, Beef*, Pork*"
Stetson_East,Breakfast,MENUTAINMENT,Baby Spinach,,1/4 ounce,Spinach,0,0,0,0,0,0,0,0,5,40,10,0.2,0,0,2,0,0.0,0,"Vegetarian, Avoiding Gluten, Vegan, How Good Friendly"
Stetson_East,Breakfast,MENUTAINMENT,Sliced Mushrooms,,1 ounce,Mushrooms,5,0.0,0.0,0.0,0,0,0,0,0,90,0,0.1,0,0,1,0,0.0,0,"Vegetarian, Avoiding Gluten, Vegan, How Good Friendly, Mushroom"
Stetson_East,Breakfast,MENUTAINMENT,Diced Tomatoes,,1 ounce,Tomatoes,5,0,1,0.0,0,0,0,0,0,70,0,0.1,0,0,4,0,0.0,0,"Vegetarian, Avoiding Gluten, Tomato, Vegan"
Stetson_East,Breakfast,MENUTAINMENT,Chopped Green Bell Pepper,,1 ounce,Green Bell Peppers,5,0,1,0.0,0,0,0,0,0,50,0,0.1,0,0,23,0,0.0,0,"Vegetarian, Avoiding Gluten, Vegan"
Stetson_East,Breakfast,MENUTAINMENT, Diced Onions,,1 ounce,Yellow Onions,10,0,3,1,0,0,0,0,0,40,10,0.1,0,0,2,0,0.0,0,"Vegetarian, Avoiding Gluten, Onion, Vegan"
Stetson_East,Breakfast,SOUP,Oatmeal,,1 ladle-4oz,"Water, Oatmeal, Salt",90,3,16,0,2,0,0,2,95,90,10,1.2,0.0,0,0,20,0,0,"Vegetarian, Gluten, Wheat, Vegan"
Stetson_East,Breakfast,SOUP,Hard Boiled Eggs,,2 each,"Water, Egg",130,11,0.0,0,8,3,325,0,125,120,50,1.5,0,70,0,80,0,5,"Egg, Vegetarian, Avoiding Gluten, Good Source of Protein"
Stetson_East,Breakfast,SOUP,Cinnamon Sugar,"cinnamon, sugar, brown sugar mix",1 ounce,"Sugar, Light Brown Sugar^, Cinnamon",110,0,28,25,0,0,0,2,0,20,40,0.3,0.0,0,0,0,0.0,0,"Vegetarian, Avoiding Gluten, Vegan"
Stetson_East,Breakfast,SOUP,Brown Sugar Topping,,1 cup,"Light Brown Sugar^, Sugar",800,0,208,207,0,0,0,0,30,150,90,0.8,0.0,0,0,0,0.0,0,"Vegetarian, Avoiding Gluten, Vegan"
Stetson_East,Breakfast,FRESH 52 B,Grapefruit,,1 half,Ruby Red Grapefruit,35,0.0,9,6,0,0,0,1,0,110,20,0.1,0,0,26,0,0.0,0,"Vegetarian, Avoiding Gluten, Vegan, How Good Friendly"
Stetson_East,Breakfast,FRESH 52 B,Watermelon,,1 wedge,Watermelon,90,2,22,18,0,0,0,1,0,330,20,0.7,0,0,24,0,0.0,0,"Vegetarian, Avoiding Gluten, Vegan"
Stetson_East,Breakfast,FRESH 52 B,Red Seedless Grapes,,1/4 cup,Grapes,25,0,7,6,0,0,0,0,0,80,0,0.1,0,0,1,0,0.0,0,"Vegetarian, Avoiding Gluten, Vegan"
Stetson_East,Breakfast,FRESH 52 B,Cubed Pineapple,,1/4 cup,Pineapple,20,0,5,4,0,0,0,0.0,0,40,10,0.1,0,0,20,0,0.0,0,"Vegetarian, Avoiding Gluten, Vegan"
Stetson_East,Breakfast,FRESH 52 B,Cubed Cantaloupe,,1/4 cup,Cantaloupe,15,0,3,3,0,0,0,0,5,110,0,0.1,0,0,15,0,0.0,0,"Vegetarian, Avoiding Gluten, Vegan, How Good Friendly"
Stetson_East,Breakfast,FRESH 52 B,Cubed Honeydew,,1/4 cup,Honeydew Melon,15,0,4,3,0,0,0,0,10,100,0,0.1,0,0,8,0,0.0,0,"Vegetarian, Avoiding Gluten, Vegan, How Good Friendly"
Stetson_East,Breakfast,FRESH 52 B,Fat Free Cottage Cheese,,1/4 cup,Fat Free Cottage Cheese^,25,4,2,0.0,0,0,0.0,0,135,50,30,0.1,0.0,0,0,0,0.0,0,"Vegetarian, Milk, MSG*"
Stetson_East,Breakfast,FRESH 52 B,Low Fat Plain Yogurt,,1/4 cup,Plain Low Fat Yogurt^,30,3,4,3,0.5,0,0.0,0,40,120,90,0,0,25,0.0,0,0.0,0,"Vegetarian, Avoiding Gluten, Milk"
Stetson_East,Breakfast,FRESH 52 B,Low-Fat Blueberry Yogurt,,1/4 cup,Low Fat Blueberry Yogurt^,35,1,7,5,0,0,0,0,20,60,40,0,0,30,0.0,0,0.0,0,"Vegetarian, Avoiding Gluten, Milk"
Stetson_East,Breakfast,FRESH 52 B,Blueberries,,1 ounce,Blueberries,15,0,3,2,0,0,0,0.0,0,20,0,0.1,0,0,1,0,0.0,0,"Vegetarian, Avoiding Gluten, Vegan"
Stetson_East,Breakfast,FRESH 52 B,Oats 'n Honey Granola,,1 ounce,Granola^,130,2,20,7,4.5,0.5,0,1,100,60,0,0.6,0,0,0,45,0,0,"Vegetarian, Soy, Wheat, Gluten*"
Stetson_East,Breakfast,FRESH 52 B,Cream Cheese,,1 ounce,Cream Cheese^,100,2,2,1,10,6,30,0,90,40,30,0,0,0,0,90,0.0,5,"Vegetarian, Avoiding Gluten, Milk"
Stetson_East,Breakfast,FRESH 52 B,Maple Honey Cream Cheese,Maple Honey Cream Cheese,1 ounce,"Cream Cheese^, Honey, Maple Extract^",100,2,3,3,9,5,25,0,80,40,20,0,0.0,0,0,80,0.0,5,"Vegetarian, Milk, Sulphites, Gluten*, Alcohol, Wheat*"
Stetson_East,Breakfast,FRESH 52 B,Strawberry Cream Cheese,Laced with sweet strawberries,1 ounce,"Cream Cheese^, Strawberry Preserves^",100,1,4,3,8,5,25,0,75,30,20,0,0,0,0,80,0.0,5,"Vegetarian, Milk, MSG*, Strawberry, Gluten*"
Stetson_East,Breakfast,FRESH 52 B,Butter PC,,1 each,Butter^,70,0,0,0,8,4.5,25,0,60,0,0,0,0,0,0,70,0.0,5,"Vegetarian, Avoiding Gluten, Milk"
Stetson_East,Breakfast,FRESH 52 B,"Margarine, Smart Balance, 5g",Margarine,1 each,"INGREDIENTS: NATURAL OIL BLEND (PALM FRUIT, SOYBEAN, CANOLA, FLAXSEED AND OLIVE OILS), WATER, CONTAINS LESS THAN 2% SALT, SORBITAN ESTER OF VEGETABLE FATTY ACIDS, MONOGLYCERIDE OF VEGETABLE FATTY ACIDS, SOYBEAN LECITHIN, POTASSIUM SORBATE, TBHQ AND CALCIUM DISODIUM EDTA TO PROTECT FRESHNESS, NATURAL AND ARTIFICIAL FLAVOR, LACTIC ACID, VITAMIN A PALMITATE, BETA-CAROTENE COLOR AND VITAMIN E ACETATE. CONTAINS: SOYBEAN.",30,0,0,0,3,1,0,0,30,0,0,0,0,0,0,30,35,0,"Vegetarian, Avoiding Gluten, Soy, Vegan"
Stetson_East,Breakfast,FRESH 52 B,"Jelly, Assorted (Grape, Strawberry, Mixed Fruit), Smuckers",,1 each,"Concord Grape Jelly: Concord Grape Juice, High Fructose Corn Syrup, Corn Syrup, Fruit Pectin, Citric Acid, Sodium Citrate.
Strawberry Jam: Strawberries, High Fructose Corn Syrup, Corn Syrup, Sugar, Fruit Pectin, Citric Acid.
Mixed Fruit Jelly: High Fructose Corn Syrup, Corn Syrup, Grape Juice, Apple Juice, Fruit Pectin, Citric Acid. 
Manufacturer will not declare gluten free ",35,0,9,8,0,0,0,0,5,0.0,0.0,0.0,0,0.0,0.0,0,0.0,0,"Strawberry, Gluten*"
Stetson_East,Breakfast,FRESH 52 B,"Peanut Butter, .75 oz, Jif",,1 each,"INGREDIENTS: MADE FROM ROASTED PEANUTS AND SUGAR, CONTAINS 2% OR LESS OF: MOLASSES, FULLY HYDROGENATED VEGETABLE OILS (RAPESEED AND SOYBEAN), MONO AND DIGLYCERIDES, SALT. Gluten Free. ALLERGENS: Peanuts. ",120,4,5,2,10,2,0,2,90,120,10,0.3,0,0,0.0,90,0.0,0,"Vegetarian, Avoiding Gluten, Vegan, Peanuts"
Stetson_East,Breakfast,FRESH 52 B,Nutella,,3/4 ounce,Chocolate Hazelnut Spread^,110,1,13,12,6,2.5,0.0,0.0,10,100,20,0.6,0,0,0.0,60,0.0,0,"Vegetarian, Avoiding Gluten, Milk, Soy, Tree Nuts"
Stetson_East,Breakfast,FRESH 52 B,Dried Cranberries,,1 tbsp,Cranberries^,30,0,8,7,0,0,0,0,0,0,0,0,0,0,0,0,0.0,0,"Vegetarian, Avoiding Gluten, Vegan"
Stetson_East,Breakfast,FRESH 52 B,Raisins,,1 tbsp,Raisins,25,0,7,6,0,0,0,0,0,70,10,0.2,0,0,0,0,0.0,0,"Vegetarian, Avoiding Gluten, Vegan"
Stetson_East,Breakfast,FRESH 52 B,Roasted Sunflower Seeds,,1 tbsp,Unsalted Sunflower Seeds,45,2,2,0,4,0,0,0.0,0,70,10,0.3,0.0,0,0,35,0.0,0,"Vegetarian, Avoiding Gluten, Vegan"
Stetson_East,Breakfast,SWEET SHOPPE,Plain Bagel,,1 each,Plain Bagel^,300,9,60,4,2,0,0,2,300,0.0,100,3.8,0,0,0.0,20,0.0,0,"Vegetarian, Good Source of Protein, Gluten, Soy, Wheat, Vegan"
Stetson_East,Breakfast,SWEET SHOPPE,Cinnamon Raisin Bagel,,1 each,Cinnamon Raisin Bagel^,330,11,66,14,2,0.5,0,3,460,150,40,3.4,0,0,0.0,20,0.0,0,"Vegetarian, Good Source of Protein, Gluten, Soy, Wheat, Vegan, Sesame"
Stetson_East,Breakfast,SWEET SHOPPE,Everything Bagel,,1 each,Everything Bagel^,310,11,61,6,2.5,0,0,3,570,120,60,4,0,0,5,25,20,0,"Vegetarian, Good Source of Protein, Gluten, Onion, Wheat, Garlic, Sulphites, Vegan, Soy*, Sesame"
Stetson_East,Breakfast,SWEET SHOPPE,Mini Croissant,,1 each,Croissant^,90,1,11,1,4.5,2.5,10,0,90,10,0,0.2,0,0,0.0,40,0.0,5,"Egg, Vegetarian, Gluten, Milk, Wheat, Tree Nuts*"
Stetson_East,Breakfast,SWEET SHOPPE,Blueberry Muffin,Sweet blueberries in a fluffy cake.,1 each,"Muffin Mix^, Water, Blueberries, All Purpose Flour^",360,3,63,33,10,4.5,0,1,530,70,60,2.1,0.0,0,0,90,0,5,"Vegetarian, Gluten, Milk, Soy, Wheat, Egg*"
Stetson_East,Breakfast,SWEET SHOPPE,Assorted Mini Danishes,"Assortment of apple, cheese, raspberry, or cinnamon raisin",1 each,Demi Danish^,110,2,16,7,5,2.5,0.0,0.0,135,10,10,1,0,0,0.0,45,0.0,0,"Egg, Vegetarian, Gluten, Milk, Soy, Wheat, Sulphites"
Stetson_East,Breakfast,SWEET SHOPPE,Chocolate and Sprinkles Donut,Donut topped with chocolate icing and sprinkles,1 each,"Homestyle Doughnut^, Chocolate Icing^, Chocolate Sprinkles^",410,5,60,35,17,10,0,1,260,110,20,1.9,0,0,0,150,15,10,"Gluten, Milk, Soy, Wheat, Sulphites, Egg*"
Stetson_East,Breakfast,SWEET SHOPPE,Blueberry Scone,,1 each,Blueberry Scone^,380,5,57,27,14,7,0,1,320,150,90,2.1,0,0,0.0,130,0.0,5,"Vegetarian, Gluten, Milk, Wheat"
Stetson_East,Lunch,CUCINA,Penne Pasta,,1 cup,"Water, Penne^",180,7,35,0.0,1,0,0,2,0,50,10,1.5,0,0,0,10,0,0,"Vegetarian, Good Source of Protein, Gluten, Wheat, How Good Friendly, Egg*"
Stetson_East,Lunch,CUCINA,Turkey Meat Sauce,Savory pasta sauce made with ground turkey,1/2 cup,"No Added Salt Tomatoes^, Ground Turkey, Yellow Onions, Tomato Puree^, Kosher Salt^, Garlic, Canola Oil, Basil, Oregano, Thyme, Black Pepper",100,9,5,3,5,1.5,30,2,220,300,50,1.3,0,0,14,45,0.0,0,"Avoiding Gluten, Good Source of Protein, Onion, Garlic, Tomato, Poultry"
Stetson_East,Lunch,CUCINA,Marinara Sauce,marinara sauce,1 ladle-2oz,Marinara Sauce^,35,0.0,7,4,0,0,0,1,230,180,20,0.4,0,0,0.0,0,0.0,0,"Vegetarian, Onion, Garlic, Tomato, Vegan, Gluten*"
Stetson_East,Lunch,CUCINA,Garlic Breadstick ,"Garlic Breadstick, Butter, and Parsley ",1 each,"French Breadsticks Dough^, Butter^, Parsley, Garlic",80,2,12,0.0,3,1.5,5,0,140,30,10,0.8,0,0,0,25,0.0,0,"Egg, Vegetarian, Gluten, Milk, Wheat, Garlic, How Good Friendly, Soy*"
Stetson_East,Lunch,CUCINA,Caesar Salad,"With romaine lettuce, parmesan cheese, and garlic croutons",1 cup,"Lettuce, White Bread^, Parmesan Cheese^, Canola Oil, Garlic",110,4,11,2,5,1.5,0.0,1,190,150,100,1,0.0,0,2,45,0.0,0,"Vegetarian, Gluten, Milk, Soy, Wheat, Garlic, Tree Nuts*"
Stetson_East,Lunch,CUCINA,Cheese Pizza,"Traditional pie topped with Italian tomato sauce, mozzarella, and parmesan cheese.",1 slice,"Pizza Dough^, Tomatoes^, Parmesan Cheese^, Part Skim Mozzarella Cheese^, Canola Oil, Kosher Salt^, Basil, Garlic, Black Pepper",200,10,19,2,10,4,20,0.0,650,150,230,1.4,0,15,2,90,0,5,"Vegetarian, Good Source of Protein, Gluten, Milk, Wheat, Garlic, Tomato, Egg*, Soy*, Sesame*"
Stetson_East,Lunch,CUCINA,Buffalo Chicken Pizza, Buffalo Chicken Pizza,1 slice,"Seasoned Chicken Breast^, Pizza Dough^, Part Skim Mozzarella Cheese^, Buffalo Wing Sauce^, Green Onions, Canola Oil",210,18,17,1,7,3.5,40,0.0,770,270,160,1.5,0,15,1,70,0,5,"Good Source of Protein, Gluten, Milk, MSG*, Onion, Soy, Wheat, Garlic, Poultry, Egg*, Sesame*"
Stetson_East,Lunch,CUCINA,Sausage Pepper and Onion Pizza,"Topped with Sausage, peppers and onions",1 slice,"Pizza Dough^, Tomatoes^, Italian Sausage^, Parmesan Cheese^, Part Skim Mozzarella Cheese^, Yellow Onions, Green Bell Peppers, Canola Oil, Kosher Salt^, Basil, Garlic, Black Pepper",270,14,19,2,16,6,40,1,820,230,240,1.6,0,25,4,140,0,5,"Good Source of Protein, Celery*, Gluten, Milk, Mustard*, Onion, Soy, Wheat, Garlic, Tomato, Pork, Egg*, Sesame*"
Stetson_East,Lunch,CUCINA,Grated Parmesan Cheese,,1 tbsp,Parmesan Cheese^,25,2,0.0,0,1.5,1,5,0,115,10,50,0,0,0,0,15,0.0,0,"Vegetarian, Avoiding Gluten, Milk"
Stetson_East,Lunch,CUCINA,Crushed Red Pepper,,1 tsp,Red Pepper,5,0,1,0,0,0,0,0,0,40,0,0.1,0.0,0,1,0,0.0,0,"Vegetarian, Avoiding Gluten, Vegan"
Stetson_East,Lunch,CUCINA,Dried Oregano,,1 tsp,Oregano,0,0,0.0,0,0,0,0,0,0,10,20,0.4,0,0,0,0,0.0,0,"Vegetarian, Avoiding Gluten, Vegan"
Stetson_East,Lunch,RICE STATION,White Rice,White Rice Cooked with Canola Oil and Salt,1/2 cup,"Water, Long Grain White Rice^, Canola Oil, Salt",120,2,23,0,1.5,0,0,0.0,30,50,20,0.9,0.0,0,0,15,0,0,"Vegetarian, Avoiding Gluten, Vegan, How Good Friendly"
Stetson_East,Lunch,RICE STATION,Brown Rice,Lightly seasoned,1/2 cup,"Water, Brown Rice",110,2,23,0,1,0,0,1,0,70,0,0.4,0,0,0,10,0,0,"Vegetarian, Avoiding Gluten, Vegan"
Stetson_East,Lunch,RICE STATION,Olive Oil,,1 floz,Olive Oil,240,0,0,0,27,3.5,0,0,0,0,0,0.2,0.0,0,0,240,0.0,5,"Vegetarian, Avoiding Gluten, Vegan"
Stetson_East,Lunch,RICE STATION,Gluten Free Soy Sauce,,1 floz,Less Sodium Gluten Free Soy Sauce^,20,1,4,2,0,0,0,0,880,200,0,0,0,0,0.0,0,0.0,0,"Vegetarian, Avoiding Gluten, Soy, Vegan"
Stetson_East,Lunch,RICE STATION,Seasoned Rice Vinegar,,1 floz,Seasoned Rice Vinegar^,0,0,0,0,0,0,0,0,0,0,0,0,0,0,0.0,0,0.0,0,"Vegetarian, Vegan"
Stetson_East,Lunch,HOMESTYLE,Saffron Citrus Braised Chicken,,1 each,"Chicken Thigh, Water, Yellow Onions, Lime, Garlic, Lemon Juice, Orange Juice, Turmeric, Cumin, Kosher Salt^, Black Pepper, Bay Leaf, Saffron",160,20,5,1,7,2,105,0.0,170,290,30,1.6,0.0,5,6,60,0,0,"Avoiding Gluten, Good Source of Protein, Onion, Garlic, Poultry, Orange"
Stetson_East,Lunch,HOMESTYLE,Vegetable Paella,"Saffron rice with peas, mushrooms and tomatoes",1 cup,"Water, Arborio Rice, Mushrooms, Tomatoes, Yellow Onions, Green Peas, Yellow Onions, Canola Oil, Carrots, Mushrooms, Celery, Tomato Paste^, Parsley, Garlic, Kosher Salt^, Garlic, Saffron, Black Pepper, Bay Leaf",230,4,35,3,8,0.5,0,2,110,260,20,2.1,0.0,0,8,70,0,0,"Vegetarian, Avoiding Gluten, Onion, Garlic, Tomato, Vegan, Celery, Mushroom"
Stetson_East,Lunch,HOMESTYLE,Roasted Cauliflower Garlic & Vinegar,"Roasted Cauliflower with Garlic, Parsley and Apple Cider Vinegar",3 ounce,"Cauliflower, Olive Oil, Apple Cider Vinegar, Garlic, Parsley, Canola Oil, Kosher Salt^, Fresh Ground Black Pepper, Black Pepper, Red Pepper",90,2,5,1,8,1,0,2,70,230,20,0.5,0.0,0,36,70,0.0,0,"Vegetarian, Avoiding Gluten, Garlic, Vegan"
Stetson_East,Lunch,HOMESTYLE,Sauteed Squash,,1/2 cup,"Yellow Squash, Zucchini, Canola Oil, Garlic, Kosher Salt^, Black Pepper",50,2,5,4,3,0,0,1,100,330,30,0.6,0,0,26,30,0.0,0,"Vegetarian, Avoiding Gluten, Garlic, Vegan"
Stetson_East,Lunch,GLOBAL EATS,Meatless Protein Tikka Masala,"Creamy plant-based garbanzo bean protein tikka masala with garam masala, tomatoes, oatmilk, and spices",1 cup,"Plant Based Wings^, Tomato Puree^, Oat Milk^, White Onions, Tomato Paste^, Canola Oil, Cilantro, Lemon Juice, Kosher Salt^, Ginger Root, Chili Powder^, Garlic, Black Cardamom, Cardamom, Cinnamon, Fennel Seed, Turmeric, Cloves, Cumin, Bay Leaf, Black Pepper",260,20,27,5,11,1,0,9,780,630,110,3.9,0.0,15,10,100,0.0,0,"Vegetarian, Good Source of Protein, Gluten, Onion, Wheat, Garlic, Tomato, Vegan"
Stetson_East,Lunch,GLOBAL EATS,Brown Rice & Quinoa,,1/2 cup,"Water, Brown Rice, Tri-Color Quinoa, Vegetable Base^, Kosher Salt^",100,3,19,1,1,0,0,1,170,110,10,0.8,0,0,0,10,0,0,"Vegetarian, Avoiding Gluten, Onion, Vegan, Celery"
Stetson_East,Lunch,GLOBAL EATS,Sautéed Green Beans Onions Tomatoes,"Sauteed green beans, red onions, and grape tomatoes",1/2 cup,"Green Beans, Tomatoes, Water, Red Onions, Canola Oil, Garlic, Kosher Salt^, Black Pepper",80,2,8,3,6,0,0,3,240,160,40,0.5,0,0,10,50,0,0,"Vegetarian, Avoiding Gluten, Onion, Garlic, Tomato, Vegan, How Good Friendly"
Stetson_East,Lunch,MENUTAINMENT,Eggs Your Way,,1 each,Egg,60,6,0,0,4,1.5,165,0,60,60,20,0.8,0,35,0,40,0.0,0,"Egg, Vegetarian, Avoiding Gluten"
Stetson_East,Lunch,MENUTAINMENT,Eggs,,1/4 cup,Liquid Egg^,90,7,0.0,0,6,2,225,0,80,80,40,1.1,0,60,0,50,0.0,0,"Egg, Vegetarian, Avoiding Gluten, Good Source of Protein"
Stetson_East,Lunch,MENUTAINMENT,Egg Whites,two egg whites made-to-order,1/4 cup,Liquid Egg White^,30,7,0,0,0,0,0,0,100,100,0,0,0.0,0,0,0,0.0,0,"Egg, Vegetarian, Avoiding Gluten, Good Source of Protein"
Stetson_East,Lunch,MENUTAINMENT,Diced Bacon,,1 ounce,Bacon^,130,10,0,0,10,3.5,30,0,480,140,0,0.3,0,5,0,90,0.0,5,"Good Source of Protein, Pork, Gluten*"
Stetson_East,Lunch,MENUTAINMENT,Italian Sausage Crumbles,,1 ounce,Italian Sausage^,90,5,0.0,0,7,2.5,25,0,230,100,0,0.4,0,10,0,70,0.0,5,"Avoiding Gluten, Celery*, Mustard*, Soy, Pork"
Stetson_East,Lunch,MENUTAINMENT,Diced Ham,,1 ounce,Ham^,35,4,2,0.0,1,0,15,0,360,200,0,0.2,0,170,0,10,0,0,"Pork, Gluten*"
Stetson_East,Lunch,MENUTAINMENT,Shredded Sharp American Cheese,,1 ounce,American Cheese^,100,5,1,0.0,9,5,30,0,470,40,300,0.2,0,90,0,80,0.0,5,"Avoiding Gluten, Milk, Beef*, Pork*"
Stetson_East,Lunch,MENUTAINMENT,Baby Spinach,,1/4 ounce,Spinach,0,0,0,0,0,0,0,0,5,40,10,0.2,0,0,2,0,0.0,0,"Vegetarian, Avoiding Gluten, Vegan, How Good Friendly"
Stetson_East,Lunch,MENUTAINMENT,Sliced Mushrooms,,1 ounce,Mushrooms,5,0.0,0.0,0.0,0,0,0,0,0,90,0,0.1,0,0,1,0,0.0,0,"Vegetarian, Avoiding Gluten, Vegan, How Good Friendly, Mushroom"
Stetson_East,Lunch,MENUTAINMENT,Diced Tomatoes,,1 ounce,Tomatoes,5,0,1,0.0,0,0,0,0,0,70,0,0.1,0,0,4,0,0.0,0,"Vegetarian, Avoiding Gluten, Tomato, Vegan"
Stetson_East,Lunch,MENUTAINMENT,Chopped Green Bell Pepper,,1 ounce,Green Bell Peppers,5,0,1,0.0,0,0,0,0,0,50,0,0.1,0,0,23,0,0.0,0,"Vegetarian, Avoiding Gluten, Vegan"
Stetson_East,Lunch,MENUTAINMENT, Diced Onions,,1 ounce,Yellow Onions,10,0,3,1,0,0,0,0,0,40,10,0.1,0,0,2,0,0.0,0,"Vegetarian, Avoiding Gluten, Onion, Vegan"
Stetson_East,Lunch,FLAME,Hamburger Patty,Ground sirloin patty grilled to perfection ,1 each,Beef Patty,170,16,0,0,11,4,55,0,45,190,10,1.5,0,0,0,100,0.0,5,"Avoiding Gluten, Good Source of Protein, Beef"
Stetson_East,Lunch,FLAME,Grilled Chicken,Tender and moist,1 each,Chicken Breast^,120,23,0,0,3,1,80,0,140,260,0,0.4,0,0,0,25,0.0,0,"Avoiding Gluten, Good Source of Protein, Poultry"
Stetson_East,Lunch,FLAME,All Beef Hot Dog,,1 each,Beef Hot Dog^,180,7,2,0.0,17,7,35,0,480,140,10,0.7,0.0,20,0.0,150,0.0,5,"Good Source of Protein, Beef"
Stetson_East,Lunch,FLAME,Onions and Peppers,sauteed onions and sweet bell peppers,1/2 cup,"Green Bell Peppers, Yellow Onions, Butter, Black Pepper",130,1,7,3,11,7,30,2,0,160,20,0.3,0.0,0,40,100,0.0,5,"Vegetarian, Avoiding Gluten, Milk, Onion"
Stetson_East,Lunch,FLAME,French Fries,,3 ounce,French Fries^,150,1,18,0.0,9,1,0,1,20,270,10,0.3,0,0,0,80,0.0,0,
Stetson_East,Lunch,FLAME,White Hot Dog Bun,,1 each,Hot Dog Bun^,100,3,19,2,1,0,0,0.0,160,30,30,1.3,0,0,0.0,10,0.0,0,"Vegetarian, Gluten, Wheat, Vegan, Soy*"
Stetson_East,Lunch,FLAME,White Hamburger Bun,White Hamburger Bun,1 each,Burger Bun^,150,4,28,4,2,0,0,0,280,50,50,1.5,0,0,0.0,20,0.0,0,"Vegetarian, Gluten, Soy, Wheat, Tree Nuts*, Egg*, Sesame, Milk*"
Stetson_East,Lunch,FLAME,American Cheese Slice,,1 slice,American Cheese^,50,3,0.0,0,4.5,2.5,15,0,240,20,150,0.1,0,45,0,40,0.0,5,"Avoiding Gluten, Milk, Beef*, Pork*"
Stetson_East,Lunch,DELI,Sliced Genoa Salami,,1 ounce,Genoa Salami^,120,5,0,0,11,4,30,0,480,0.0,0,0.4,0,0.0,7,100,0.0,5,"Avoiding Gluten, Celery*, Mustard*, Garlic, Beef, Pork"
Stetson_East,Lunch,DELI,Sliced Capicola,,1 ounce,Capicola^,35,5,2,0.0,1,0,15,0,440,80,0,0.3,0,0.0,0.0,10,0.0,0,"Pork, Soy*, Gluten*, Wheat*"
Stetson_East,Lunch,DELI,Sliced Smoked Ham,,1 ounce,Ham^,35,5,0,0,1.5,0.5,15,0,330,90,0,0.2,0,10,0,15,0.0,0,"Pork, Gluten*, Wheat*"
Stetson_East,Lunch,DELI,Thinly Sliced Deli Turkey Breast,,1 ounce,Turkey Breast^,30,4,0.0,0,1,0,15,0,260,40,0,0.2,0,0,0,10,0,0,"Avoiding Gluten, Poultry"
Stetson_East,Lunch,DELI,FIT Tuna Salad,Classic tuna salad ,3 oz portion,"Tuna^, Canola Oil, Red Onions, Celery, Lemon Juice, Light Mayonnaise^, Kosher Salt^, Black Pepper",90,8,0.0,0,6,0.5,15,0,240,90,10,0.7,0,20,1,50,0,0,"Egg, Good Source of Protein, MSG*, Onion, Celery, Soy*, Gluten*, Mustard, Fish"
Stetson_East,Lunch,DELI,Chicken Salad,"Moist chicken salad, in a low fat dressing",1/3 cup,"Chicken Breast^, Mayonnaise^, Celery, White Pepper",110,8,0,0,9,1.5,30,0,150,130,0,0.2,0,0,0,80,5,0,"Egg, Good Source of Protein, Onion, Celery, Poultry, Gluten*, Mustard"
Stetson_East,Lunch,DELI,American Cheese Slice,,1 slice,American Cheese^,50,3,0.0,0,4.5,2.5,15,0,240,20,150,0.1,0,45,0,40,0.0,5,"Avoiding Gluten, Milk, Beef*, Pork*"
Stetson_East,Lunch,DELI,Sliced Swiss Cheese,,1 ounce,Swiss Cheese^,110,8,0,0,9,5,25,0,55,20,250,0,0,0,0,80,0.0,5,"Vegetarian, Avoiding Gluten, Good Source of Protein, Milk"
Stetson_East,Lunch,DELI,Sliced Sharp Cheddar Cheese,,1 ounce,Cheddar Cheese^,110,6,0.0,0,9,5,30,0,190,20,200,0,0.0,5,0,80,0.0,5,"Vegetarian, Avoiding Gluten, Milk"
Stetson_East,Lunch,DELI,Sliced Provolone Cheese,,1 ounce,Provolone Cheese^,100,7,0.0,0,8,5,20,0,210,40,210,0.1,0.0,5,0,70,0.0,5,"Vegetarian, Avoiding Gluten, Good Source of Protein, Milk"
Stetson_East,Lunch,DELI,Sliced Pepper Jack Cheese,,1 ounce,Pepper Jack Cheese^,110,7,0,0,9,5,25,0,170,20,210,0.2,0.0,5,0,80,0.0,5,"Vegetarian, Avoiding Gluten, Good Source of Protein, Milk"
Stetson_East,Lunch,DELI,Chopped Romaine Lettuce,,1 cup,Chopped Lettuce,10,0.0,2,0.0,0,0,0,0.0,0,120,20,0.5,0,0,2,0,0.0,0,"Vegetarian, Avoiding Gluten, Vegan"
Stetson_East,Lunch,DELI,Baby Spinach,,2 cup,Spinach,15,2,2,0,0,0,0,1,45,330,60,1.6,0,0,17,0,0.0,0,"Vegetarian, Avoiding Gluten, Vegan, How Good Friendly"
Stetson_East,Lunch,DELI,Sliced Tomatoes,,1 slice,Tomatoes,0,0,0.0,0,0,0,0,0,0,30,0,0,0,0,2,0,0.0,0,"Vegetarian, Avoiding Gluten, Tomato, Vegan"
Stetson_East,Lunch,DELI,Sliced Red Onion,,1 slice,Red Onions,5,0,1,0.0,0,0,0,0,0,20,0,0,0,0,1,0,0.0,0,"Vegetarian, Avoiding Gluten, Onion, Vegan"
Stetson_East,Lunch,DELI,Bread & Butter Pickles,,4 each,Pickles^,25,0,6,6,0,0,0,0,160,0,0,0,0,0,0.0,0,0.0,0,"Mustard*, Beef*, Pork*"
Stetson_East,Lunch,DELI,Banana Pepper Rings,,1 tbsp,Banana Peppers^,0,0,0,0,0,0,0,0,30,0.0,0,0,0,0.0,0,0,0,0,"Vegetarian, Avoiding Gluten, Sulphites, Vegan"
