Location,Period,Kitchen,Dish_Name,Description,Portion_Size,Ingredients,Calories,Protein (g),Total Carbohydrates (g),Sugar (g),Total Fat (g),Saturated Fat (g),Cholesterol (mg),Dietary Fiber (g),Sodium (mg),Potassium (mg),Calcium (mg),Iron (mg),Trans Fat (g),Vitamin D (IU),Vitamin C (mg),Calories From Fat,Vitamin A (RE),Saturated Fat + Trans Fat (g),Allergens
Stetson_East,Dinner,FRESH 52 B,Strawberry Cream Cheese,Laced with sweet strawberries,1 ounce,"Cream Cheese^, Strawberry Preserves^",100,1,4,3,8,5,25,0,75,30,20,0,0,0,0,80,0.0,5,"Vegetarian, Milk, MSG*, Strawberry, Gluten*"
Stetson_East,Dinner,FRESH 52 B,Butter PC,,1 each,Butter^,70,0,0,0,8,4.5,25,0,60,0,0,0,0,0,0,70,0.0,5,"Vegetarian, Avoiding Gluten, Milk, Jain"
Stetson_East,Dinner,FRESH 52 B,"Margarine Spread, Pareve, Smart Balance",,1 each,"Oil blend (palm, soybean, flaxseed, canola, and olive oils), water, contains less than 2% of salt, sorbitan tristearate, monoglyceride of vegetable fatty acids, soybean lecithin, potassium sorbate, tbhq and calcium disodium edta (to preserve freshness),citric acid, natural & artificial flavor, lactic acid, vitamin a palmitate, beta-carotene color, vitamin e acetate. Vegan, Gluten Free.",30,0,0,0,3,1,0,0,30,0,0,0,0,0,0.0,30,0.0,0,"Vegetarian, Avoiding Gluten, Soy, Vegan"
Stetson_East,Dinner,FRESH 52 B,"Jelly, Assorted (Grape, Strawberry, Mixed Fruit), Smuckers",,1 each,"Concord Grape Jelly: Concord Grape Juice, High Fructose Corn Syrup, Corn Syrup, Fruit Pectin, Citric Acid, Sodium Citrate.
Strawberry Jam: Strawberries, High Fructose Corn Syrup, Corn Syrup, Sugar, Fruit Pectin, Citric Acid.
Mixed Fruit Jelly: High Fructose Corn Syrup, Corn Syrup, Grape Juice, Apple Juice, Fruit Pectin, Citric Acid. 
Manufacturer will not declare gluten free ",35,0,9,8,0,0,0,0,5,0.0,0.0,0.0,0,0.0,0.0,0,0.0,0,"Strawberry, Gluten*"
Stetson_East,Dinner,FRESH 52 B,"Peanut Butter, .75 oz, Jif",,1 each,"INGREDIENTS: MADE FROM ROASTED PEANUTS AND SUGAR, CONTAINS 2% OR LESS OF: MOLASSES, FULLY HYDROGENATED VEGETABLE OILS (RAPESEED AND SOYBEAN), MONO AND DIGLYCERIDES, SALT. Gluten Free. ALLERGENS: Peanuts. ",120,4,5,2,10,2,0,2,90,120,10,0.3,0,0,0.0,90,0.0,0,"Vegetarian, Avoiding Gluten, Vegan, Peanuts"
Stetson_East,Dinner,FRESH 52 B,Nutella,,3/4 ounce,Chocolate Hazelnut Spread^,110,1,13,12,6,2.5,0.0,0.0,10,100,20,0.6,0,0,0.0,60,0.0,0,"Vegetarian, Avoiding Gluten, Milk, Soy, Tree Nuts"
Stetson_East,Dinner,SWEET SHOPPE,Chocolate Chip Cookies,Soft sugar cookie dotted with chocolate chips,1 each,Chocolate Chip Cookie Dough^,130,1,17,10,6,3,0.0,0,100,30,0,1,0,0,0,50,15,5,"Egg, Gluten, Milk, Soy, Wheat, Beef*, Pork*"
Stetson_East,Dinner,SWEET SHOPPE,Carnival Cookies,Soft sugar cookie dotted with M&Ms,1 each,M&M Cookie Dough^,120,1,18,11,5,2.5,0.0,0,105,30,0,1.1,0,0,0,50,0,0,"Egg, Vegetarian, Gluten, Milk, Soy, Wheat"
Stetson_East,Dinner,SWEET SHOPPE,Brownie,,1 each,Brownie^,210,3,35,26,6,2.5,45,1,240,190,0,1,0,0,0.0,60,0.0,5,"Egg, Vegetarian, Gluten, Milk, Soy, Wheat"
Stetson_East,Dinner,SWEET SHOPPE,Chocolate Frosted Cake,Moist and delicious.,1 1/16th,"Chocolate Cake Mix^, Chocolate Icing^, Water",400,3,65,48,14,7,10,3,510,100,40,3.9,0,0,0,130,0,5,"Egg, Vegetarian, Gluten, Milk, Soy, Wheat"
Stetson_East,Dinner,SWEET SHOPPE,White Cake with Vanilla Icing,Moist and delicious.,1 slice,"White Cake Mix^, Water, Powdered Sugar, Whole Milk^, Butter^, Vanilla Extract^",240,2,46,33,6,3.5,5,0,270,10,10,0.7,0.0,0,0,50,0,5,"Egg, Vegetarian, Gluten, Milk, Soy, Wheat"
Stetson_East,Dinner,SWEET SHOPPE,Rice Krispie Treat,,"1 2"" x 3""","Marshmallows^, Rice Krispies Cereal^, Butter^, Vanilla Extract^",190,1,35,16,5,3,15,0,135,10,0,4.2,0,45,0,45,0.0,5,"Gluten, Milk, Beef*, Pork*"
Stetson_East,Dinner,SWEET SHOPPE,Chocolate Chip Cookie,"Cookie dough loaded with chocolate chips and so delicious, you won’t miss the egg or dairy",1 each,Vegan Chocolate Chip Cookie^,200,2,25,13,10,5,0,1,150,80,10,1.8,0,0,0,90,170,5,"Vegetarian, Gluten, Soy, Wheat, Tree Nuts*, Egg*, Milk*, Peanuts*"
Stetson_East,Dinner,DELICIOUS WITHOUT,Barbecued Chicken,Barbecued Chicken Thighs,4 ounce,"Chicken Thigh, Tomatoes^, Maple Syrup, Apple Cider Vinegar, Garlic, Light Brown Sugar^, Black Pepper, Canola Oil, Chili Powder^, Kosher Salt^, Granulated Onion, Cumin",210,27,4,3,9,2.5,145,0,200,350,20,1.5,0.0,10,1,80,0.0,5,"Avoiding Gluten, Good Source of Protein, Onion, Garlic, Tomato, Poultry"
Stetson_East,Dinner,DELICIOUS WITHOUT,Herb Roasted Potato Wedges,Red bliss potatoes with fresh herbs and garlic,4 oz portion,"Red Bliss Potatoes, Canola Oil, Kosher Salt^, Garlic, Parsley, Basil, Oregano, Thyme, Ground Paprika^, Black Pepper",150,3,23,2,6,0,0,2,390,630,20,1,0,0,16,50,0.0,0,"Vegetarian, Avoiding Gluten, Garlic, Vegan, How Good Friendly, Jain"
Stetson_East,Dinner,DELICIOUS WITHOUT,Roasted Corn and Peppers,"With onion, garlic, cumin, cilantro, and scallions",1/4 cup,"Corn, Red Onions, Red Bell Peppers, Green Onions, Canola Oil, Kosher Salt^, Garlic, Cumin, Cilantro, Black Pepper",50,1,10,2,1.5,0,0,1,380,150,10,0.7,0.0,0,12,15,0.0,0,"Vegetarian, Avoiding Gluten, Onion, Garlic, Vegan, How Good Friendly"
Stetson_East,Dinner,DELICIOUS WITHOUT,Lemon Dill Coleslaw,Coleslaw with a light lemon-dill vinaigrette,1/2 cup,"Cabbage, Radish, Canola Oil, Lemon Juice, Salt, Black Pepper, Dill",50,0.0,3,2,4.5,0,0,1,230,100,20,0.3,0,0,19,40,0.0,0,"Vegetarian, Avoiding Gluten, Vegan"
Stetson_East,Dinner,DELICIOUS WITHOUT,Mediterranean Chopped Salad,Fresh Chopped Vegetable Salad,1 cup,"Cucumber, Tomatoes, Lemon Juice, Red Bell Peppers, Green Onions, Olive Oil, Kosher Salt^, Fresh Ground Black Pepper",80,1,7,4,6,1,0,2,380,350,30,0.6,0.0,0,35,50,0.0,0,"Vegetarian, Avoiding Gluten, Onion, Tomato, Vegan, How Good Friendly"
