Location,Period,Kitchen,Dish_Name,Description,Portion_Size,Ingredients,Calories,Protein (g),Total Carbohydrates (g),Sugar (g),Total Fat (g),Saturated Fat (g),Cholesterol (mg),Dietary Fiber (g),Sodium (mg),Potassium (mg),Calcium (mg),Iron (mg),Trans Fat (g),Vitamin D (IU),Vitamin C (mg),Calories From Fat,Vitamin A (RE),Saturated Fat + Trans Fat (g),Allergens
Stetson_East,Lunch,DELI,Olive Oil,,1 floz,Olive Oil,240,0,0,0,27,3.5,0,0,0,0,0,0.2,0.0,0,0,240,0.0,5,"Vegetarian, Avoiding Gluten, Vegan"
Stetson_East,Lunch,DELI,Red Wine Vinegar,,1 floz,Red Wine Vinegar^,5,0,0,0,0,0,0.0,0,0,10,0,0.1,0,0.0,0,0,0.0,0,"Vegetarian, Avoiding Gluten, Sulphites, Vegan"
Stetson_East,Lunch,DELI,White Bread,,1 slice,White Bread^,80,3,15,1,1,0,0,0.0,130,30,30,1,0,0,0.0,5,0.0,0,"Vegetarian, Gluten, Soy, Wheat, Egg*, Sesame*, Milk*"
Stetson_East,Lunch,DELI,Whole Wheat Bread,,1 slice,Whole Wheat Bread^,110,4,21,3,2,0,0,3,170,100,40,0.9,0,0,0.0,20,0.0,0,"Vegetarian, Gluten, Soy, Wheat, Tree Nuts*, Milk*"
Stetson_East,Lunch,DELI,Kaiser Roll,,1 each,Kaiser Roll^,240,7,43,3,4.5,0,0,1,410,90,70,2,0,0,0.0,40,0.0,0,"Egg, Vegetarian, Good Source of Protein, Gluten, Wheat"
Stetson_East,Lunch,DELI,Hoagie Roll,,1 each,Hoagie Roll^,190,7,34,0,2,0,0,1,350,60,100,2,0,0,0.0,20,0.0,0,"Vegetarian, Gluten, Wheat, Vegan, Sesame*"
Stetson_East,Lunch,DELI,"10"" Flour Tortilla",,1 each,Flour Tortilla^,200,6,34,1,6,3,0,1,400,50,80,2,0,0,0.0,50,0.0,5,"Vegetarian, Gluten, Wheat, Sulphites, Vegan"
Stetson_East,Lunch,DELI,"12"" Spinach Herb Tortilla",,1 each,Spinach Herb Tortilla^,290,8,47,0,8,4,0,2,640,80,120,3,0,0,0.0,70,0.0,5,"Vegetarian, Good Source of Protein, Gluten, Onion, Wheat, Garlic, Sulphites, Vegan"
Stetson_East,Lunch,DELI,"12"" Tomato Basil Flour Tortilla",,1 each,Tomato Basil Tortilla^,300,9,47,0,9,4,0,2,620,80,120,3,0,0,0.0,80,0.0,5,"Vegetarian, Good Source of Protein, Gluten, Onion, Wheat, Garlic, Sulphites, Tomato, Vegan"
Stetson_East,Lunch,DELI,Homemade Potato Chips,Fresh Fried Potato Chips,4 ounce,Potato Chips^,370,2,21,0.0,30,3.5,0,2,260,360,10,0.7,0,0,0,270,0.0,5,Soy
Stetson_East,Lunch,DELI SPECIAL,"Bratwurst, Sauerkraut on Potato Roll",Grilled bratwurst with sauerkraut on a potato roll,1 sandwich,"Water, Bratwurst^, Potato Roll^, Sauerkraut^, Yellow Onions",450,23,34,8,24,8,60,6,1310,550,150,3,0,0,8,220,0,10,"Good Source of Protein, Gluten, MSG*, Onion, Soy, Wheat, Pork, Beef*"
Stetson_East,Lunch,SOUP,Curried Rice & Lentil Soup,"brown lentils simmered in a tomato vegetable  broth with onions, carrots, ground peppers, curry spices and long grain rice",8 floz,Curried Rice and Lentil Soup^,100,6,23,3,1,0,0,6,710,400,60,2.3,0,0,5,5,150,0,"Vegetarian, Avoiding Gluten, MSG*, Onion, Soy, Garlic, Tomato, Vegan, Celery, Mustard, Jain"
Stetson_East,Lunch,SOUP,Italian Wedding Soup,"chicken broth with chicken meatballs, onions, pasta, tomatoes, spinach, carrots, garlic, celery, romano cheese and spices",8 floz,Italian Wedding Soup^,120,6,11,3,5,1.5,15,2,490,400,100,1.1,0,0,4,45,100,0,"Egg, Gluten, Milk, MSG*, Onion, Soy, Wheat, Garlic, Tomato, Celery, Poultry, Jain"
Stetson_East,Lunch,SOUP,"Crackers, Oyster, Zesta, Keebler, 0.5 oz",Keebler Zesta Oyster Crackers,1 each,"Enriched flour (wheat flour, niacin, reduced iron, vitamin B1 [thiamin mononitrate], vitamin B2 [riboflavin], folic acid), soybean oil (with TBHQ for freshness), leavening (baking soda, sodium acid pyrophosphate, monocalcium phosphate). Contains 2% or less of sugar, salt, malt extract, soy lecithin. Contains: Wheat, Soy. ",60,1,9,0,2.5,0,0,0,140,10,0,0.5,0,0,0.0,20,0.0,0,"Vegetarian, Gluten, Soy, Wheat"
Stetson_East,Lunch,FRESH 52 A,Romaine Blend,,1 cup,Lettuce Blend,10,0.0,1,0.0,0,0,0,0.0,0,110,10,0.4,0,0,2,0,0.0,0,"Vegetarian, Avoiding Gluten, Vegan"
Stetson_East,Lunch,FRESH 52 A,Spring Mix,,1 cup,Spring Lettuce Salad Mix,5,0.0,1,0.0,0,0,0,0.0,0,130,20,0.7,0,0,2,0,0.0,0,"Vegetarian, Avoiding Gluten, Vegan"
Stetson_East,Lunch,FRESH 52 A,Baby Spinach,,1 cup,Spinach,5,0.0,1,0,0,0,0,0.0,25,170,30,0.8,0,0,8,0,0.0,0,"Vegetarian, Avoiding Gluten, Vegan, How Good Friendly"
Stetson_East,Lunch,FRESH 52 A,Cherry Tomatoes,,1 ounce,Tomatoes,5,0,1,0.0,0,0,0,0,0,70,0,0.1,0,0,4,0,0.0,0,"Vegetarian, Avoiding Gluten, Tomato, Vegan"
Stetson_East,Lunch,FRESH 52 A,Sliced Cucumber,,1 ounce,Cucumber,0,0,1,0,0,0,0,0,0,40,0,0.1,0,0,1,0,0.0,0,"Vegetarian, Avoiding Gluten, Vegan, How Good Friendly"
Stetson_East,Lunch,FRESH 52 A,Shredded Carrots,,1 ounce,Carrots,10,0,3,1,0,0,0,0.0,20,90,10,0.1,0,0,2,0,0.0,0,"Vegetarian, Avoiding Gluten, Vegan, How Good Friendly"
Stetson_East,Lunch,FRESH 52 A,Julienne Celery,,1 ounce,Celery,0,0,0.0,0,0,0,0,0,25,70,10,0.1,0,0,1,0,0.0,0,"Vegetarian, Avoiding Gluten, Vegan, Celery"
Stetson_East,Lunch,FRESH 52 A,Sliced Red Onion,,1 ounce,Red Onions,10,0,3,1,0,0,0,0,0,40,10,0.1,0,0,2,0,0.0,0,"Vegetarian, Avoiding Gluten, Onion, Vegan"
Stetson_East,Lunch,FRESH 52 A,Red and Green Bell Peppers,,1 ounce,"Green Bell Peppers, Red Bell Peppers",5,0,2,0.0,0,0,0,0.0,0,50,0,0.1,0,0,29,0,0.0,0,"Vegetarian, Avoiding Gluten, Vegan"
Stetson_East,Lunch,FRESH 52 A,Sliced Mushrooms,,1 cup,Mushrooms,15,2,2,1,0,0,0,0.0,0,220,0,0.3,0,5,1,0,0.0,0,"Vegetarian, Avoiding Gluten, Vegan, How Good Friendly, Mushroom"
Stetson_East,Lunch,FRESH 52 A,Sliced Black Olives,,1 ounce,Black Olives^,35,0,2,0,3,0.5,0,0,210,0,20,1.8,0,0,0,30,0.0,0,"Vegetarian, Avoiding Gluten, Vegan"
Stetson_East,Lunch,FRESH 52 A,Blanched Broccoli,,1 ounce,"Water, Water, Broccoli, Kosher Salt^",10,0.0,2,0,0,0,0,0.0,15,90,10,0.2,0,0,25,0,0,0,"Vegetarian, Avoiding Gluten, Vegan, How Good Friendly"
Stetson_East,Lunch,FRESH 52 A,Curry Roasted Cauliflower,"curry, lemon, cauliflower",1 ounce,"Cauliflower, Canola Oil, Lemon Juice, Curry Powder^, Kosher Salt^, Black Pepper",25,0.0,1,0.0,2.5,0,0,0.0,55,80,10,0.2,0,0,13,20,0,0,"Vegetarian, Vegan, Mustard"
Stetson_East,Lunch,FRESH 52 A,Roasted Corn,roasted corn,1 ounce,"Corn, Canola Oil",45,0.0,5,0.0,2.5,0,0,0.0,0,60,0,0.1,0,0,1,25,0.0,0,"Vegetarian, Avoiding Gluten, Vegan"
Stetson_East,Lunch,FRESH 52 A,Black Bean and Corn Salad,Spicy Classical Black Bean Salad ,1 ounce,"Low Sodium Black Turtle Beans^, Corn, Red Onions, Lime, Jalapeno, Olive Oil, Cilantro, Garlic, Cumin",25,1,5,0,0.5,0,0,1,20,80,10,0.4,0.0,0,2,5,0.0,0,"Vegetarian, Avoiding Gluten, Onion, Garlic, Vegan"
Stetson_East,Lunch,FRESH 52 A,Edamame,,1 ounce,Edamame,35,3,3,0.0,1.5,0,0,1,0,120,20,0.6,0,0,2,15,0.0,0,"Vegetarian, Avoiding Gluten, Soy, Vegan, How Good Friendly"
Stetson_East,Lunch,FRESH 52 A,Green Peas,,1 ounce,Green Peas,20,1,4,1,0,0,0,1,20,30,10,0.4,0,0,3,0,0.0,0,"Vegetarian, Avoiding Gluten, Vegan"
Stetson_East,Lunch,FRESH 52 A,Cooked Quinoa,,1 ounce,"Water, Quinoa",50,2,8,0,1,0,0,0.0,0,70,10,0.6,0.0,0,0,5,0,0,"Vegetarian, Avoiding Gluten, Vegan, Jain"
Stetson_East,Lunch,FRESH 52 A,Sliced Pepperoncini Peppers,,1 ounce,Pepperoncini^,5,0,1,0.0,0,0,0,0,330,50,0,0.1,0,0,19,0,0.0,0,"Vegetarian, Avoiding Gluten, Sulphites, Vegan"
Stetson_East,Lunch,FRESH 52 A,Grilled Chicken,"Boneless breast of chicken, grilled to perfection",1 ounce,"Chicken Breast^, Canola Oil, Kosher Salt^, Black Pepper",50,7,0,0,2,0,25,0,280,80,0,0.1,0,0,0,20,0.0,0,"Avoiding Gluten, Good Source of Protein, Poultry"
Stetson_East,Lunch,FRESH 52 A,Diced Bacon,,1 ounce,Bacon^,130,10,0,0,10,3.5,30,0,480,140,0,0.3,0,5,0,90,0.0,5,"Good Source of Protein, Pork, Gluten*"
Stetson_East,Lunch,FRESH 52 A,Shredded Cheddar Cheese,,1 ounce,Cheddar Cheese^,110,6,0.0,0,9,5,30,0,190,20,200,0,0.0,5,0,80,0.0,5,"Vegetarian, Avoiding Gluten, Milk"
Stetson_East,Lunch,FRESH 52 A,Roasted Butternut Squash,,1 ounce,"Butternut Squash, Canola Oil, Kosher Salt^, Black Pepper",20,0,3,0.0,0.5,0,0,0.0,45,100,10,0.2,0,0,6,5,0.0,0,"Vegetarian, Avoiding Gluten, Vegan, How Good Friendly, Jain"
Stetson_East,Lunch,FRESH 52 A,Shredded Parmesan Cheese,,1 ounce,Parmesan Cheese^,120,11,0.0,0,8,5,20,0,480,30,360,0.2,0.0,5,0,70,0.0,5,"Vegetarian, Avoiding Gluten, Good Source of Protein, Milk"
Stetson_East,Lunch,FRESH 52 A,Classic Caesar Dressing,,1 floz,Caesar Dressing^,150,1,0.0,0,16,3,15,0,220,10,30,0.1,0,0,1,140,5,5,"Egg, Avoiding Gluten, Milk, Onion, Garlic, Mustard, Fish"
Stetson_East,Lunch,FRESH 52 A,Sesame Dressing,,1 floz,Asian Sesame Dressing^,80,0,12,10,4,0,0,0,320,0,0,0,0,0,0,35,0,0,"Vegetarian, Celery*, Gluten, Mustard*, Soy, Wheat, Garlic, Vegan, Sesame"
Stetson_East,Lunch,FRESH 52 A,Balsamic Vinaigrette Dressing,,1 floz,Balsamic Vinaigrette^,60,0,5,4,4.5,0,0,0,190,0,0.0,0,0,0,0.0,45,0.0,0,"Vegetarian, Avoiding Gluten, Celery*, Mustard*, Garlic, Vegan"
Stetson_East,Lunch,FRESH 52 A,Fat Free Raspberry Dressing,,1 floz,Fat Free Raspberry Vinaigrette^,30,0,8,7,0,0,0,0,75,0,0,0,0,0.0,0.0,0,0.0,0,"Vegetarian, Avoiding Gluten, Onion, Garlic, Vegan"
Stetson_East,Lunch,FRESH 52 A,Homestyle Ranch Dressing,,1 floz,Ranch Dressing^,100,0,0.0,0.0,11,1.5,10,0,250,0,0,0,0,0,0,100,0.0,0,"Egg, Vegetarian, Celery*, Milk, Mustard*, MSG"
Stetson_East,Lunch,FRESH 52 A,Fat Free Italian Dressing,,1 floz,Fat Free Italian Dressing^,15,0,3,2,0,0,0,0,470,0,0,0,0,0,0.0,0,0.0,0,"Vegetarian, Avoiding Gluten, Celery*, Mustard*, Onion, Garlic, Vegan"
Stetson_East,Lunch,FRESH 52 A,Blue Cheese Dressing,,1 floz,Blue Cheese Dressing^,160,0,1,1,16,3.5,15,0,270,0,0,0,0,0.0,0.0,140,0.0,5,"Egg, Vegetarian, Avoiding Gluten, Milk, Onion, Garlic, Mustard, MSG"
Stetson_East,Lunch,FRESH 52 A,Greek Dressing,,1 floz,Greek Dressing^,100,0,2,1,10,1.5,5,0,280,0,0,0,0,0.0,0.0,90,0.0,0,"Vegetarian, Avoiding Gluten, Celery*, Milk, Garlic, Mustard"
Stetson_East,Lunch,FRESH 52 A,Croutons,Croutons to add to a salad,1 ounce,"French Baguette^, Garlic, Kosher Salt^, Canola Oil",80,2,16,0,0,0,0,0.0,360,30,10,1.1,0,0,0,0,0,0,"Vegetarian, Gluten, Wheat, Garlic, Tree Nuts*, Soy*, Milk*"
Stetson_East,Lunch,FRESH 52 A,Baked Wonton Strips,,1 ounce,Wonton Wrapper^,50,3,7,0,1.5,0,5,0,115,0.0,0,0.4,0,0.0,3,15,0,0,"Egg, Vegetarian, Gluten, Wheat"
Stetson_East,Lunch,FRESH 52 A,Roasted Sunflower Seeds,,1 tbsp,Unsalted Sunflower Seeds,45,2,2,0,4,0,0,0.0,0,70,10,0.3,0.0,0,0,35,0.0,0,"Vegetarian, Avoiding Gluten, Vegan"
Stetson_East,Lunch,FRESH 52 A,Raisins,,1 tbsp,Raisins,25,0,7,6,0,0,0,0,0,70,10,0.2,0,0,0,0,0.0,0,"Vegetarian, Avoiding Gluten, Vegan"
Stetson_East,Lunch,FRESH 52 A,Dried Cranberries,,1 tbsp,Cranberries^,30,0,8,7,0,0,0,0,0,0,0,0,0,0,0,0,0.0,0,"Vegetarian, Avoiding Gluten, Vegan"
Stetson_East,Lunch,FRESH 52 A,Balsamic Vinegar,,1 floz,Balsamic Vinegar^,25,0,5,4,0,0,0,0,5,30,10,0.2,0,0,0,0,0,0,"Vegetarian, Avoiding Gluten, Sulphites, Vegan"
Stetson_East,Lunch,FRESH 52 A,Red Wine Vinegar,,1 floz,Red Wine Vinegar^,5,0,0,0,0,0,0.0,0,0,10,0,0.1,0,0.0,0,0,0.0,0,"Vegetarian, Avoiding Gluten, Sulphites, Vegan"
Stetson_East,Lunch,FRESH 52 A,Canola Oil,,1 floz,Canola Oil,240,0,0,0,27,2,0,0,0,0,0,0,0,0,0,250,0.0,0,"Vegetarian, Avoiding Gluten, Vegan"
Stetson_East,Lunch,FRESH 52 A,Olive Oil,,1 floz,Olive Oil,240,0,0,0,27,3.5,0,0,0,0,0,0.2,0.0,0,0,240,0.0,5,"Vegetarian, Avoiding Gluten, Vegan"
Stetson_East,Lunch,FRESH 52 B,Sweet and Sour Tofu,Fried Tofu with a sweet and tangy sauce with fresh steamed vegetables.,1 ounce,"Tofu^, Green Bell Peppers, Pineapple^, Red Bell Peppers, Yellow Onions, Water, Ketchup^, Rice Wine^, Less Sodium Gluten Free Soy Sauce^, Unseasoned Rice Wine Vinegar, Cornstarch, Green Onions, Sugar",20,0.0,4,2,0,0,0,0,50,40,10,0.2,0.0,0,8,0,0,0,"Mustard*, Onion, Soy, Sulphites, Tomato, How Good Friendly, Gluten*, Alcohol, Wheat*"
Stetson_East,Lunch,FRESH 52 B,Cubed Tempeh,,1 ounce,Tempeh^,50,6,4,0,1.5,0,0,2,0,90,30,0.7,0,0,0.0,15,0.0,0,"Vegetarian, Soy, Vegan, Jain"
Stetson_East,Lunch,FRESH 52 B,Chick Peas,,1 ounce,Low Sodium Chick Peas^,45,3,8,1,0.5,0,0,2,70,80,10,0.8,0,0,0,5,0.0,0,"Vegetarian, Avoiding Gluten, Vegan, How Good Friendly, Jain"
Stetson_East,Lunch,FRESH 52 B,Dark Red Kidney Beans,,1 ounce,Low Sodium Kidney Beans^,25,1,4,0.0,0,0,0,2,35,70,10,0.4,0,0,0,0,0.0,0,"Vegetarian, Avoiding Gluten, Vegan, Jain"
Stetson_East,Lunch,FRESH 52 B,Hummus,,1 ounce,Hummus^,70,2,4,0,5,0.5,0,2,120,90,10,0.7,0,0,0,45,0.0,0,"Vegetarian, Avoiding Gluten, Garlic, Vegan, Sesame"
Stetson_East,Lunch,FRESH 52 B,Salsa,,1 floz,Salsa^,10,0,2,1,0,0,0,0.0,230,90,10,0.1,0.0,0,1,0,0.0,0,"Vegetarian, Onion, Garlic, Tomato, Vegan"
Stetson_East,Lunch,FRESH 52 B,Shredded Vegan Cheddar Cheese,,1 ounce,Vegan Cheddar Cheese Style Shreds^,90,0.0,8,0,7,4,0,0,230,10,120,0,0,0,0,60,0.0,5,"Vegetarian, Avoiding Gluten, Vegan"
Stetson_East,Lunch,FRESH 52 B,Lettuce Leaf,,1 each,Lettuce Leaf,0,0,0,0,0,0,0,0,0,10,0,0.1,0,0,1,0,0.0,0,"Vegetarian, Avoiding Gluten, Vegan"
Stetson_East,Lunch,FRESH 52 B,Sliced Tomatoes,,1 slice,Tomatoes,0,0,0.0,0,0,0,0,0,0,30,0,0,0,0,2,0,0.0,0,"Vegetarian, Avoiding Gluten, Tomato, Vegan"
Stetson_East,Lunch,FRESH 52 B,Dill Relish,,1 ounce,Pickle Relish^,35,0,10,0.0,0,0,0,0.0,310,20,0,0.3,0,0,1,0,0.0,0,"Vegetarian, Avoiding Gluten, Vegan"
Stetson_East,Lunch,FRESH 52 B,Sliced Dill Pickles,Sliced Dill Pickles,1 ounce,Pickles^,0,0,0.0,0,0,0,0,0,230,30,20,0.1,0,0,1,0,0.0,0,"Vegetarian, Mustard*, Vegan"
Stetson_East,Lunch,FRESH 52 B,Julienne Yellow Onions,,1 ounce,Yellow Onions,10,0,3,1,0,0,0,0,0,40,10,0.1,0,0,2,0,0.0,0,"Vegetarian, Avoiding Gluten, Onion, Vegan"
Stetson_East,Lunch,FRESH 52 B,Kale Salad,"kale, lemon, tomato, radish",1/2 cup,"Kale, Tomatoes, Radish, Canola Oil, Lemon Juice, Kosher Salt^, Sugar, White Pepper",90,3,7,3,7,0.5,0,5,320,470,270,1.8,0.0,0,104,60,0.0,0,"Vegetarian, Avoiding Gluten, Tomato, Vegan"
Stetson_East,Lunch,FRESH 52 B,Pickled Beet Salad,"Sliced pickled beets, fresh onions all tossed and served in a light vinaigrette",1/2 cup,"Beets^, Red Onions, Lettuce Leaf, Red Wine Vinegar^, Canola Oil, Parsley, Salt, Sugar, Black Pepper, Cumin",45,1,8,5,1,0,0,2,260,160,20,1.7,0.0,0,6,10,0.0,0,"Vegetarian, Avoiding Gluten, Onion, Sulphites, Vegan, Jain"
Stetson_East,Lunch,FRESH 52 B,Vegetable Pasta Salad,"penne pasta, broccoli, olives, grape tomatoes, onions, parsley, balsamic",1/2 cup,"Water, Water, Penne^, Tomatoes, Balsamic Vinaigrette^, Broccoli, Kalamata Olives^, Red Onions, Parsley, Kosher Salt^",130,3,18,4,5,0.5,0,2,330,160,20,0.9,0,0,24,45,0,0,"Vegetarian, Celery*, Gluten, Mustard*, Onion, Wheat, Garlic, Tomato, Egg*"
Stetson_East,Lunch,FRESH 52 B,Coleslaw,Shredded cabbage tossed in dressing.,1/2 cup,"Shredded Cabbage Mix^, Coleslaw Dressing^, Carrots",120,1,11,9,9,1.5,10,2,220,280,40,0.6,0,0,26,80,5,0,"Egg, Vegetarian, Avoiding Gluten, Onion, Garlic, Celery, Mustard"
Stetson_East,Lunch,FRESH 52 B,Watermelon,,1 wedge,Watermelon,90,2,22,18,0,0,0,1,0,330,20,0.7,0,0,24,0,0.0,0,"Vegetarian, Avoiding Gluten, Vegan"
Stetson_East,Lunch,FRESH 52 B,Red Seedless Grapes,,1/4 cup,Grapes,25,0,7,6,0,0,0,0,0,80,0,0.1,0,0,1,0,0.0,0,"Vegetarian, Avoiding Gluten, Vegan"
Stetson_East,Lunch,FRESH 52 B,Cubed Pineapple,,1/4 cup,Pineapple,20,0,5,4,0,0,0,0.0,0,40,10,0.1,0,0,20,0,0.0,0,"Vegetarian, Avoiding Gluten, Vegan"
Stetson_East,Lunch,FRESH 52 B,Cubed Cantaloupe,,1/4 cup,Cantaloupe,15,0,3,3,0,0,0,0,5,110,0,0.1,0,0,15,0,0.0,0,"Vegetarian, Avoiding Gluten, Vegan, How Good Friendly"
Stetson_East,Lunch,FRESH 52 B,Fat Free Cottage Cheese,,1/4 cup,Fat Free Cottage Cheese^,25,4,2,0.0,0,0,0.0,0,135,50,30,0.1,0.0,0,0,0,0.0,0,"Vegetarian, Milk, MSG*"
Stetson_East,Lunch,FRESH 52 B,Low Fat Plain Yogurt,,1/4 cup,Plain Low Fat Yogurt^,30,3,4,3,0.5,0,0.0,0,40,120,90,0,0,25,0.0,0,0.0,0,"Vegetarian, Avoiding Gluten, Milk"
Stetson_East,Lunch,FRESH 52 B,Low-Fat Blueberry Yogurt,,1/4 cup,Low Fat Blueberry Yogurt^,35,1,7,5,0,0,0,0,20,60,40,0,0,30,0.0,0,0.0,0,"Vegetarian, Avoiding Gluten, Milk, Jain"
Stetson_East,Lunch,FRESH 52 B,Blueberries,,1 ounce,Blueberries,15,0,3,2,0,0,0,0.0,0,20,0,0.1,0,0,1,0,0.0,0,"Vegetarian, Avoiding Gluten, Vegan"
Stetson_East,Lunch,FRESH 52 B,Oats 'n Honey Granola,,1 ounce,Granola^,130,2,20,7,4.5,0.5,0,1,100,60,0,0.6,0,0,0,45,0,0,"Vegetarian, Wheat, Gluten*"
Stetson_East,Lunch,FRESH 52 B,Cream Cheese,,1 ounce,Cream Cheese^,100,2,2,1,10,6,30,0,90,40,30,0,0,0,0,90,0.0,5,"Vegetarian, Avoiding Gluten, Milk"
Stetson_East,Lunch,FRESH 52 B,Maple Honey Cream Cheese,Maple Honey Cream Cheese,1 ounce,"Cream Cheese^, Honey, Maple Extract^",100,2,3,3,9,5,25,0,80,40,20,0,0.0,0,0,80,0.0,5,"Vegetarian, Milk, Sulphites, Gluten*, Alcohol, Wheat*"
Stetson_East,Lunch,FRESH 52 B,Strawberry Cream Cheese,Laced with sweet strawberries,1 ounce,"Cream Cheese^, Strawberry Preserves^",100,1,4,3,8,5,25,0,75,30,20,0,0,0,0,80,0.0,5,"Vegetarian, Milk, MSG*, Strawberry, Gluten*"
Stetson_East,Lunch,FRESH 52 B,Butter PC,,1 each,Butter^,70,0,0,0,8,4.5,25,0,60,0,0,0,0,0,0,70,0.0,5,"Vegetarian, Avoiding Gluten, Milk, Jain"
Stetson_East,Lunch,FRESH 52 B,"Margarine Spread, Pareve, Smart Balance",,1 each,"Oil blend (palm, soybean, flaxseed, canola, and olive oils), water, contains less than 2% of salt, sorbitan tristearate, monoglyceride of vegetable fatty acids, soybean lecithin, potassium sorbate, tbhq and calcium disodium edta (to preserve freshness),citric acid, natural & artificial flavor, lactic acid, vitamin a palmitate, beta-carotene color, vitamin e acetate. Vegan, Gluten Free.",30,0,0,0,3,1,0,0,30,0,0,0,0,0,0.0,30,0.0,0,"Vegetarian, Avoiding Gluten, Soy, Vegan"
Stetson_East,Lunch,FRESH 52 B,"Jelly, Assorted (Grape, Strawberry, Mixed Fruit), Smuckers",,1 each,"Concord Grape Jelly: Concord Grape Juice, High Fructose Corn Syrup, Corn Syrup, Fruit Pectin, Citric Acid, Sodium Citrate.
Strawberry Jam: Strawberries, High Fructose Corn Syrup, Corn Syrup, Sugar, Fruit Pectin, Citric Acid.
Mixed Fruit Jelly: High Fructose Corn Syrup, Corn Syrup, Grape Juice, Apple Juice, Fruit Pectin, Citric Acid. 
Manufacturer will not declare gluten free ",35,0,9,8,0,0,0,0,5,0.0,0.0,0.0,0,0.0,0.0,0,0.0,0,"Strawberry, Gluten*"
Stetson_East,Lunch,FRESH 52 B,"Peanut Butter, .75 oz, Jif",,1 each,"INGREDIENTS: MADE FROM ROASTED PEANUTS AND SUGAR, CONTAINS 2% OR LESS OF: MOLASSES, FULLY HYDROGENATED VEGETABLE OILS (RAPESEED AND SOYBEAN), MONO AND DIGLYCERIDES, SALT. Gluten Free. ALLERGENS: Peanuts. ",120,4,5,2,10,2,0,2,90,120,10,0.3,0,0,0.0,90,0.0,0,"Vegetarian, Avoiding Gluten, Vegan, Peanuts"
Stetson_East,Lunch,FRESH 52 B,Nutella,,3/4 ounce,Chocolate Hazelnut Spread^,110,1,13,12,6,2.5,0.0,0.0,10,100,20,0.6,0,0,0.0,60,0.0,0,"Vegetarian, Avoiding Gluten, Milk, Soy, Tree Nuts"
Stetson_East,Lunch,SWEET SHOPPE,Chocolate Chip Cookies,Soft sugar cookie dotted with chocolate chips,1 each,Chocolate Chip Cookie Dough^,130,1,17,10,6,3,0.0,0,100,30,0,1,0,0,0,50,15,5,"Egg, Gluten, Milk, Soy, Wheat, Beef*, Pork*"
Stetson_East,Lunch,SWEET SHOPPE,Carnival Cookies,Soft sugar cookie dotted with M&Ms,1 each,M&M Cookie Dough^,120,1,18,11,5,2.5,0.0,0,105,30,0,1.1,0,0,0,50,0,0,"Egg, Vegetarian, Gluten, Milk, Soy, Wheat"
Stetson_East,Lunch,SWEET SHOPPE,Brownie,,1 each,Brownie^,210,3,35,26,6,2.5,45,1,240,190,0,1,0,0,0.0,60,0.0,5,"Egg, Vegetarian, Gluten, Milk, Soy, Wheat"
Stetson_East,Lunch,SWEET SHOPPE,Chocolate Frosted Cake,Moist and delicious.,1 1/16th,"Chocolate Cake Mix^, Chocolate Icing^, Water",400,3,65,48,14,7,10,3,510,100,40,3.9,0,0,0,130,0,5,"Egg, Vegetarian, Gluten, Milk, Soy, Wheat"
Stetson_East,Lunch,SWEET SHOPPE,White Cake with Vanilla Icing,Moist and delicious.,1 slice,"White Cake Mix^, Water, Powdered Sugar, Whole Milk^, Butter^, Vanilla Extract^",240,2,46,33,6,3.5,5,0,270,10,10,0.7,0.0,0,0,50,0,5,"Egg, Vegetarian, Gluten, Milk, Soy, Wheat"
Stetson_East,Lunch,SWEET SHOPPE,Rice Krispie Treat,,"1 2"" x 3""","Marshmallows^, Rice Krispies Cereal^, Butter^, Vanilla Extract^",190,1,35,16,5,3,15,0,135,10,0,4.2,0,45,0,45,0.0,5,"Gluten, Milk, Beef*, Pork*"
Stetson_East,Lunch,SWEET SHOPPE,Chocolate Chip Cookie,"Cookie dough loaded with chocolate chips and so delicious, you won’t miss the egg or dairy",1 each,Vegan Chocolate Chip Cookie^,200,2,25,13,10,5,0,1,150,80,10,1.8,0,0,0,90,170,5,"Vegetarian, Gluten, Soy, Wheat, Tree Nuts*, Egg*, Milk*, Peanuts*"
Stetson_East,Lunch,DELICIOUS WITHOUT,Grilled Flank Steak ,Marinated & Grilled Flank Steak ,3 oz meat,"Flank Steak, Balsamic White Vinegar, Garlic, Black Pepper, Parsley, Oregano, Tarragon, Bay Leaf",180,26,0.0,0,8,3,75,0,55,340,30,1.8,0.0,0,1,70,0.0,5,"Avoiding Gluten, Good Source of Protein, Garlic, Beef"
Stetson_East,Lunch,DELICIOUS WITHOUT,Herb Roasted Potato Wedges,Red bliss potatoes with fresh herbs and garlic,4 oz portion,"Red Bliss Potatoes, Canola Oil, Kosher Salt^, Garlic, Parsley, Basil, Oregano, Thyme, Ground Paprika^, Black Pepper",150,3,23,2,6,0,0,2,390,630,20,1,0,0,16,50,0.0,0,"Vegetarian, Avoiding Gluten, Garlic, Vegan, How Good Friendly, Jain"
Stetson_East,Lunch,DELICIOUS WITHOUT,Steamed Green Beans ,"Steamed, lightly seasoned green beans ",1/2 cup,"Green Beans, Canola Oil, Kosher Salt^",80,2,7,3,6,0,0,3,370,130,40,0.6,0,0,9,50,0.0,0,"Vegetarian, Avoiding Gluten, Vegan, How Good Friendly, Jain"
Stetson_East,Lunch,DELICIOUS WITHOUT,Lemon Dill Coleslaw,Coleslaw with a light lemon-dill vinaigrette,1/2 cup,"Cabbage, Radish, Canola Oil, Lemon Juice, Salt, Black Pepper, Dill",50,0.0,3,2,4.5,0,0,1,230,100,20,0.3,0,0,19,40,0.0,0,"Vegetarian, Avoiding Gluten, Vegan"
Stetson_East,Lunch,DELICIOUS WITHOUT,Mediterranean Chopped Salad,Fresh Chopped Vegetable Salad,1 cup,"Cucumber, Tomatoes, Lemon Juice, Red Bell Peppers, Green Onions, Olive Oil, Kosher Salt^, Fresh Ground Black Pepper",80,1,7,4,6,1,0,2,380,350,30,0.6,0.0,0,35,50,0.0,0,"Vegetarian, Avoiding Gluten, Onion, Tomato, Vegan, How Good Friendly"
Stetson_East,Dinner,CUCINA,Cheese Tortellini,,1 cup,"Water, Cheese Tortellini^",230,9,41,2,2.5,1.5,15,2,390,0,90,2.4,0,0,0,25,0,0,"Egg, Vegetarian, Good Source of Protein, Gluten, Milk, Onion, Wheat, Garlic"
Stetson_East,Dinner,CUCINA,Alfredo Sauce,Classic pasta sauce made of cream and parmesan cheese,1/2 cup,"Whole Milk^, Whipping Cream^, Parmesan Cheese^, Unsalted Butter, All Purpose Flour^, Garlic, Kosher Salt^, White Pepper",220,6,8,4,18,11,55,0,410,150,190,0.3,0.0,50,0,170,0.0,10,"Vegetarian, Gluten, Milk, Wheat, Garlic"
Stetson_East,Dinner,CUCINA,Marinara Sauce,marinara sauce,1 ladle-2oz,Marinara Sauce^,35,0.0,7,4,0,0,0,1,230,180,20,0.4,0,0,0.0,0,0.0,0,"Vegetarian, Onion, Garlic, Tomato, Vegan, Gluten*"
Stetson_East,Dinner,CUCINA,Garlic Breadstick ,"Garlic Breadstick, Butter, and Parsley ",1 each,"French Breadsticks Dough^, Butter^, Parsley, Garlic",80,2,12,0.0,3,1.5,5,0,140,30,10,0.8,0,0,0,25,0.0,0,"Egg, Vegetarian, Gluten, Milk, Wheat, Garlic, How Good Friendly, Soy*"
Stetson_East,Dinner,CUCINA,Caesar Salad,"With romaine lettuce, parmesan cheese, and garlic croutons",1 cup,"Lettuce, White Bread^, Parmesan Cheese^, Canola Oil, Garlic",110,4,11,2,5,1.5,0.0,1,190,150,100,1,0.0,0,2,45,0.0,0,"Vegetarian, Gluten, Milk, Soy, Wheat, Garlic, Tree Nuts*"
Stetson_East,Dinner,CUCINA,Cheese Pizza,"Traditional pie topped with Italian tomato sauce, mozzarella, and parmesan cheese.",1 slice,"Pizza Dough^, Tomatoes^, Parmesan Cheese^, Part Skim Mozzarella Cheese^, Canola Oil, Kosher Salt^, Basil, Garlic, Black Pepper",200,10,19,2,10,4,20,0.0,650,150,230,1.4,0,15,2,90,0,5,"Vegetarian, Good Source of Protein, Gluten, Milk, Wheat, Garlic, Tomato, Egg*, Soy*, Sesame*"
Stetson_East,Dinner,CUCINA,Pepperoni Pizza,A Classic Favorite,1 slice,"Pizza Dough^, Part Skim Mozzarella Cheese^, Tomatoes^, Pepperoni-^, Canola Oil, Kosher Salt^, Basil, Garlic, Black Pepper",210,11,17,2,10,5,25,0.0,560,160,210,1.3,0,20,2,90,0,5,"Good Source of Protein, Gluten, Milk, Mustard*, Wheat, Garlic, Tomato, Beef, Pork, Egg*, Soy*, Sesame*"
Stetson_East,Dinner,CUCINA,Margherita Pizza,"Taste of tomatoes, mozzarella and fresh basil",1 slice,"Pizza Dough^, Mozzarella Cheese^, Tomatoes^, Basil, Parmesan Cheese^, Canola Oil, Kosher Salt^, Garlic, Black Pepper, Oregano, Red Pepper",220,10,28,1,7,4,20,1,420,90,140,2,0.0,5,1,70,0,5,"Vegetarian, Good Source of Protein, Gluten, Milk, Wheat, Garlic, Sulphites, Tomato, Egg*, Soy*"
Stetson_East,Dinner,CUCINA,Grated Parmesan Cheese,,1 tbsp,Parmesan Cheese^,25,2,0.0,0,1.5,1,5,0,115,10,50,0,0,0,0,15,0.0,0,"Vegetarian, Avoiding Gluten, Milk"
Stetson_East,Dinner,CUCINA,Crushed Red Pepper,,1 tsp,Red Pepper,5,0,1,0,0,0,0,0,0,40,0,0.1,0.0,0,1,0,0.0,0,"Vegetarian, Avoiding Gluten, Vegan"
Stetson_East,Dinner,CUCINA,Dried Oregano,,1 tsp,Oregano,0,0,0.0,0,0,0,0,0,0,10,20,0.4,0,0,0,0,0.0,0,"Vegetarian, Avoiding Gluten, Vegan"
Stetson_East,Dinner,RICE STATION,White Rice,White Rice Cooked with Canola Oil and Salt,1/2 cup,"Water, Long Grain White Rice^, Canola Oil, Salt",120,2,23,0,1.5,0,0,0.0,30,50,20,0.9,0.0,0,0,15,0,0,"Vegetarian, Avoiding Gluten, Vegan, How Good Friendly, Jain"
Stetson_East,Dinner,RICE STATION,Brown Rice,Lightly seasoned,1/2 cup,"Water, Brown Rice",110,2,23,0,1,0,0,1,0,70,0,0.4,0,0,0,10,0,0,"Vegetarian, Avoiding Gluten, Vegan, Jain"
Stetson_East,Dinner,RICE STATION,Olive Oil,,1 floz,Olive Oil,240,0,0,0,27,3.5,0,0,0,0,0,0.2,0.0,0,0,240,0.0,5,"Vegetarian, Avoiding Gluten, Vegan"
Stetson_East,Dinner,RICE STATION,Gluten Free Soy Sauce,,1 floz,Less Sodium Gluten Free Soy Sauce^,20,1,4,2,0,0,0,0,880,200,0,0,0,0,0.0,0,0.0,0,"Vegetarian, Avoiding Gluten, Soy, Vegan"
Stetson_East,Dinner,RICE STATION,Seasoned Rice Vinegar,,1 floz,Seasoned Rice Vinegar^,0,0,0,0,0,0,0,0,0,0,0,0,0,0,0.0,0,0.0,0,"Vegetarian, Vegan"
Stetson_East,Dinner,HOMESTYLE,Tomato Basil Baked Whiting,Topped fresh tomatoes and basil,3 oz meat,"Whiting, Tomatoes, Red Wine Vinegar^, Sauterne Cooking Wine^, Yellow Onions, Canola Oil, Basil, White Pepper, Garlic",140,21,3,1,2,0,75,0.0,200,460,70,0.8,0.0,60,4,20,0.0,0,"Good Source of Protein, Onion, Garlic, Sulphites, Tomato, Gluten*, Alcohol, Fish"
Stetson_East,Dinner,HOMESTYLE,Vegetable & Rice Pilaf ,Seasoned Rice & Vegetables ,1/2 cup,"Water, Broccoli, Carrots, Corn, Green Peas, Long Grain White Rice^, Yellow Onions, Canola Oil, Garlic",100,3,20,3,1.5,0,0,3,35,240,30,1,0.0,0,25,10,0,0,"Vegetarian, Avoiding Gluten, Onion, Garlic, Vegan, How Good Friendly, Jain"
